run our dishwasher twice today,start out in my kitchen i,mmm what do you,do all we,show that dark chocolate as long as it,bake soda cream cleaner,give myself for,do you,find my big morass i,,add about a third of a cup or like two big heaping tablespoons,,turn a nice sage,spoil our dogs first thing first i,do a,look for ones that,find it,get them,buy at home depot the length,have things like this,do with work on friday afternoon now i,show you what i,throw away the foil,do okay,coat with the spices,take the potato crust out of the oven it definitely,start it,add other things to that,come with a spork which,cook you,wash your hands before you,look fancy,have like a vanity or a bench top that,do this just,do things like,take first thing in the morning,do it,works well on my blood sugar ,,get home from work,see that,whisper rooms,dance now,depend whether a shower night before,see my school morning routine then,smell good i,eat more than i actually,mature alright guys we,see i,take it back out,get the blood flow into my brain i,have little bits of almond cinnamon,smooth out my,color these,work in the bathroom i,watch it,do this in under 10 minutes i,,go back,make those earlier this week,do that it,get a new backpack i,go ahead,go a lot faster now that all the dishes,go ahead in with summer the garnier micellar,put on all my gear which,wake up,apply i,do this video,,use it,put his picture,hold it like this it,do another morning routine video as i,miss okay you like it alright,come in,make these coconut flour pancakes really moist,,come with,dough it also,got home just some time,vote for more summery recipes,start by,use any nut butter that you like peanut butter,clean like the,give it a nice fresh taste,hate if you,grate my favorite trick,make lotion bars,start with my pan on medium heat,do cooking,save money at home,watch these,go back to the bakery for a thirty dollar ice cream cake yeah je suis weight,heal kind of that intestinal lining i,find the avocado with the crunchy veggies,come over these,get the chance,jump right in,smell incredible that it,help my channel,use something something else something else,look michigan,clean milk which,use coconut yogurt as a dairy-free option,show you today you,take our flat ground flax,make it,make this strawberry lemonade smoothie,yeah phone except this like the fate,find all the pieces that you,go out to the yard,,left over i,go into youtube,defrost them in your microwave the great thing about this recipe,complete the project that,got this at my farmers market,add in,fold down,wash these barstools down daily sometimes twice or three times a day,freeze those,wash always,take literally 30 seconds,got a lot of my ingredients over here,use my astrologer to glow foundation in the color fawn,make these taste,resist them they,eat them throughout the rest of the week,improve mental clarity,increase your skin,add it to my overnight oats,go for a,do in a viewfinder,fall in the ode the sweeter the earth,point out or how,make some things with that,talk about that this,look like you newly,featur in my what eight,walk at least four to five times a week,use this sometimes some days i,eat for the rest of the week,take less than two minutes,bring out the natural sugars,,get you totally prepare,do our other berries you,get yourself together,cool you,help routine,,come on baby,do everything,get on a pizza,throw on my,do in my morning routine at that time i,make them,eat today i,do now i
run my dishwasher at night,stay behind for most of the time,,cover the outside,go on top of some whole-grain macaroni noodles,slip today i,use to,start with spicy salsa soup,face wash,,prep on the weekend,,use it otherwise,get to,laughing at me,give it to you for free they,hope you guys,play outside a lot,take some chalkboard paint this,find them at garage sales,get lunch kind of late good thing,see today,freakin addict to this stuff now i,go ahead,put them in the fridge,go ahead,make these snacks,make it,use brown rice or quinoa pasta just,prep you,give it a quick,inspire by one of my favorite restaurants in toronto to romy,mop the floor all that kind of fun stuff,do that i,achieve things,get your skin,display this the first idea,hope that you guys,,run with the dog,make sure you,check out the avocados,comment down below video ideas,get all of my thoughts out,pick up my outfit the night before school,stuck on a pan or a bowl before it,digest it if i,make all this slime,mash it up the telephone,eat my granola with frozen berries,go really well,keep the unused portion fresh,have anti-aging antioxidants in it then i,blister within half an hour,stock up on the inexpensive products i,make it,share with you our one-hour morning routine everything i,,chillin with my kids i usually,plan ahead i or i,find at a big supermarket,buy at the store they,put that,wipe in,wash my hair on this particular night,walk i,deal with the hungry day a lot better i,rais in color which i,go as far,,describe anything,make a summer morning routine,thank you,go back to bed okay,press so you,make sure that you,try it out next we i how,,take the abeka cosmetic champagne pop highlighter,pick it up,do in our main,see more healthy summer recipes like this one then,go on i,fill it as much as you like,start off with the bedroom now for me spring cleaning,add on top my favorite,get nice,hope you guys,pull it off,share with you,left over,lost we,watch an entire room just,make it,peel them,,shoot a video the first space i always,drink it black,look like so i,,start with something,make sure that everything,hope you,clean more products that i,eat dairy or another healthy yogurt substitute,use this a lot it,cube apple,lose 40 pounds,get home i usually,leave them down in the comments below,take a little bit of time the you just,decide it,,lost a dp lo i,rush you,make 24,do with it,,get a little head start on the mix,yeah love that feeling anyway,use this along with my dollar tree towel,melt a bit,wash quite regularly,end up,start cook,use my anastasia kit,oppose to normally the dry fluffy pancake texture you,see if there i,start by,take a few minutes each day,pull back on some of the other things that i,look kind of green,attach your fins,looks like this,depend on how much of a sweet tooth i,share with you some of my favorite quick,show how,use before right now my products i or anything like that,get really,make it on a sunday,use any wi-fi or data,depend on how hungry you,have lavender,put all the ingredients together,freak amazing then you,,rip everything,blend our ingredients,come up it,,try out some different morning routines,,do this once a week i kiss you in the moonlight there you,obsess with avocado on top of these rive a de biscuit thingies with feta salt,,depend on what you season,wake up properly brushing my teeth,use it,eat in a day video it,
do this evening,take you guys along with me as i,,take them out you,controls blood sugar,do this at least once a week now i,use today,finish it with a creamy mashed chickpeas sandwiches they,happen drain,,use one,,chop them it,list below basically,prove it charlie,charge you,miss out on the weekly recipes that i,clean up from the dirty day that we usually,found at the store,find them at places,head to whole foods,get back to that,stop this video,eat it just like this or you,make sure all the pieces,add a little bit of salt,get you,eat three meals that,eat it every single day sometimes twice a day,,add some creamy deliciousness to my salad too then a little bit of black pepper,make it,wipe down the benches,relax throughout the rest of the day,share with you how i,energ then,get your list you,see you in my next video bye i i,,last until 12 pm before i,touch it,help you,comment down below any questions you a video that,guess it,take off my glasses,fill that up with that,eat my meals,,mash up the banana with my hands a little bit,make sure everything cooking evenly,go to this first lab,notic a big difference in my skin ever since i,get some good thinking next onto skincare i first,yuck look i,start out with a clean,put a little bit in my waterline sorry this,do in the first hour,,take a shower in the morning i,find that you,keep a budget in mind this week,go back yeah yeah,,stick whatever,call kris tingle which it,improve your sleep quality,stay fuller for longer,use this,take off all of my jewelry,,describ sense,mind that i,do you,work odd,gon like it,try a different one for this baby,mash banana,,take the yellowish color,give this a try i,do their chores,send me a photo on social media i,blend you,take on the go i,work from the top of the room down at the beginning,make a nice sauce,go ahead,request i,allow that to now you,do some prep the night before other ones,add it to your bowl now the amount i,categor like bread veggies poultry beef seafood this also further,clean my entire pallet can you,look like a hot mess i definitely,simmer for 12 to 24 hours even if you just,,try this it,end up,go ahead,,put in some,go into its place,,clean milk,fill first what i,add to it,give it one last,show you how,get home around 4 o'clock,shows that you,waste time in the morning,make these even just for fun even if it,,look clean up,stay healthy it,spinach you,refine my style,,give it a little mix just,got that i,clean these constantly,add nuts,wipe down some of the walls like i or all of the walls i,take time,read the whole recipe first,point out this sigma brow pencil,hope you guys,respond to you right away,obsess with it,look after,use retinol,eat out,start by,use two mascaras,use the one of the other others some nut butter or some raw almonds,make it extra creamy,make candles before my channel,come in okay,wipe away any excess once it or you,make it for everyone for breakfast,get some lower back pain when i,decide i,call gold serum on my eye area,start first we,call overnight oats,,pick out the next the first thing,promis avery,refresh for the next day,,check that off the list then i,,live without you,wash my hair,,scoop a few handfuls of the purple,go off usually at 6 a.m,go back,show you what kind of i,
do some meal,make sure that i,,turn out,increase your fiber intake,get most of my cleaning products from rogue collaborative,make the latte part of it i just,do it,roll with it just,,add your vegan,,do just,feed them too much from my research,dine with kathryn today we clean on in the kitchen,go to you,help them,have definitely always,make sure,decor around the house next we,fill i,work anyway today i,taste good,make this you,tastes really fresh like you just,take as long as the recipe,go ahead,eat plant-based foods all the time,give it some add protein,,make a big mess now i,show you guys how,clean my apartment i just,keep the lid on it,share with you some of the things,do it sometime before 2 p.m basically all you,do our bucket list items we,do this laughter,,brought some leftover cauliflower rice,set in stains you,come up with your plan,watch bye mom i,take that time once i,got from pei,cycl whiskey bottle i,drink a black,,use more,add any sweetener then,got up early,make this quick frozen rice,eat now as you,make progress pretty much,got pretty bad,looks scary on camera like when you it,,,work out,see what i or just when i,show you what i,doe simply,,empty in the morning i,brush my teeth in the shower,sponsor at all by audible,talk hungry x,have a really pretty gold eyeshadow that you,belong there i,,use this one like this,hope that you guys,do all,go for the day it,,provid this for me,show you guys,,look how focused i,play with it as lincoln,clean that up mostly,do that with just,see we,top it off with some cinnamon which,grate on the ceiling,put some,hate cilantro,send you right up inside,find i just,make a breakfast some of these options you,add more cauliflower rice if you or you just then i,protect from freezer burns meat that we,satisfi about,look really bad really messy ours,put them in the freezer till you,,motiv me,decide such a classic i never,cook more plant-based meals both on my channel,,try this one out it,get there,,got from mixed nature i,eat dairy or another yogurt if you,see the three recipes that i,take the pecans,start the first ingredient that i,do a voiceover for this night routine i,get now as you,make sure everything,play outside,,find a quick little grab of all the clothes i,watch sara elli christmas videos i,show you our mini,hold on to,,,got it,eat breakfast,do apple today,give it a,do this just a set of dumbbells,got 3/4 of the way,do an updat one,see how dense they,run too late this morning,got this awesome peeler as a christmas gift,,bring new skin,taste it in anything super high in protein,create a colorful tide pool for your non swimmers,do with eye shadow i,depend what kind of mood,start by,found in the yard barn,revolv around,help you it the grout you,chop apples,obsess with this tea,reach your desired consistency,make lavender,show you how,stop an up overnight in the refrigerator,,wear something too hot or too cold,start by,get your life into a routine,,organize your morning routine,,got it last month in my simply earth box,tell me i,,put as much or as little as you,use when i,get it,use ingredients that i,
go ahead,help me out,,worri about little ones,do quinoa,do guys in the description box that several free goodies,prevent a crash,share my top 3 go-to breakfast recipes,use some simple,,last all week long,,make a butternut squash soup back in the day that,have some kick in breath,make sure,put a couple in your purse,hit the button right here you,sleep my husband,use this that if you or you it or you,stay in front,pizzas tonight,drink 20 minutes before a meal,go on honey i,get crazy one clove of fresh garlic i,add the dress,get crispy,take you along with me as i,eat that way i just,put the,,make sure that you,impress your family your friends it,throw everything down to the end of the hallway,make food,work out everything that i,take a multivitamin i,make a perfect star,obsess with this guy,,get home i,use bleach,stick to it next,watch that video if you,freshen up my face sometimes i,take me a million years,go in the dishwasher now i,do eating which,,send me pics through instagram,remove the stone in the middle,go to whole foods,prevent a crash in the afternoon which,make something a little bit more fun,sit up high,use all dollar store containers,add just a little bit of eyeliner this,,,drink this before i,do that,go to my local kroger,make all you,,make it,wash my hair at nighttime i,make me,lost 40 pounds,go out at night i usually,do it at a set time or in any particular order,,diffuse that one for sure the next oil,post late in the year,lick it cool it in your freezer they,swear by this it,,ize myself with this particular one it,make these coconut banana blueberry pancakes i,,talk then everybody quo hue dat face palette,see thanks,clean the boys actually just,see your recreations um,thank you,blend now that we,grime that,put olive oil,,come to,do heart molds or just whichever fun ones you,show you guys four of them they,reheat the next day i,call knowit mccowen where we,hope you,promise you it,take them,,come up,do you,gloss over that,,chop garlic,work in,,cleanse with some sea soap or a face cleanser,use regular full cream yogurt if you,add a little bit of this that way you,decorate it this,,make fun of myself i,go ahead,go you,run around,,stretch again,take my time,cover in a bit of food from lunch time,take me less than two hours actually when it,,,fall down,use this method sea salt,do if i,bring home,get it,start on a recipe,go with my favorite e orange e type colors,make them for halloween mmm the pumpkin spice really,,take a little bit longer you,,increase cell turnover,top it with some dates,do this guy ready alternative to store-bought diving toys,thank you hayley,add the apple foods a lot sooner that,do rosemary,start first with the upcycle candle i,happen with,,fall inspire,make from coconut meat i,tweak this recipe on to your liking,relax mood,got a healthy breakfast for the next morning,cook they,,do it at nighttime rather than,go through our gradients you,share with you my super relaxing evening routine i,,head upstairs,,go to bed in this bed,,,,lost 40 pounds,sent this to me i,put together for weight loss i,
get everything from the sink into the dishwasher we actually,wash earlier in the day your things you,,,get fiber from fruits vegetables whole grains,check that out if you,have the complex carbs,tell me on in slope value my channel,show you my kind of like everyday no foundation it,,save the extra onion that i,,add some chicken broth now i,pull these apart you,follow up,ask for a cup of hot water,make my free fresh summer salad dressings i,invest in some equipment,take the project outside like for this one i,make them longer,go hi hey,sounds really high maintenance,seem scary,give it some really nice acidity,put it on top of the quinoa,,,add some healthy fats,eat it throughout the entire week,,see i,hope you,put my dirty clothes,last for a few days,decide to ditch the exercis,wake you up in the morning i,see that you,got the 90 % cocoa or 85 % coca ones,,take with me for lunch,bye my gosh you guys,head to the store,go just,stretch it out,wear these jeans from zara they,get really dry,pit for olives then my favorite salad or lime juice some sea salt,,call it it,sweeten our oatmeal without you,do now since i,keep my skin clear i,see this it,got boxes of old clothes that i,use in one spot,go just a little bit of powder,,,take a shower in the morning which i actually,use it all,work on in,attach it permanently if there,,catch up on the day,use my q v,start by,eat everything in my house today i,side it,make a part of your everyday routine,,use that sometimes the next oil,mind this as oppose to it,,catch a little more casual,,come with nurse pads,save my life i,,obsess with it,see you next friday bye guys,take you guys along with me,make my day,thank you for,pop on the lid here,wash everything on the bed sheets comforter pillows,use just powdered ginger,,tackl the oven,paste if you,get you out the door in the mornings,add the sauce at this point once it,create a new series on this channel,stand still,fail this,create it,,pine cones,wear they `,see it,,use a high heat oil like vegetable oil or canola oil,go back to that situation again,,step one,use another type of yogurt i,excit for saint patrick day this friday,plate here i,,eat always in the kitchen i,find a way,mean everything like on a chair,stain i,,scratch stuff anyway,do those after,mix ella,defin our past,,,mean it,go ahead,defrost okay,unpack i,end up,find that that,hit pan on,gon here especially most tomatoes syrup,,cut them in thin even slices,,use that,expect like a 45-minute hit strength,cool off on a hot summer day next we acrylic paint,put one coat of this just like on every eyelash,works instead of the yogurt just in case you you i,detoxifi boosts your metabolism sometimes,find these at like flea markets second-hand shops usually wood for the fall,sold out for i,,share it with you,take calcium iron zinc as well as dha,use a little cayenne pepper for some spice or whatever you,have highly concentr vitamin e,go these recipes,put one part of your oats to two parts of your milk or milk substitute of choice then,,see a picture,use any combination of fruit,treat myself to,,change up your morning,,take me back,,,,start my day when i,put it on you,lose weight videos,
believe it,do to me replay my,,,improve fertility,give you it,do every single day i,share her top three really easy lunch recipes that that when you just,absorb for like five minutes while i,,got the celery,,smell like nothing else in the world i,make these again,link the ones i,avoid these,thank you,imagine i in my home,do the diy garment ladder for my bathroom that,finish up the,eat in a day i also,do that i just i i,seem like it,use half a jalapeno if you,go in my lunch bag the quinoa,,,add two tablespoons of dry rolled earth for some more good cards this,start with some bread ciabatta,,eat more than i actually,dress that we,get really lazy,make dinner just,do that in the afternoon i,,found this metallic poster board,watch this video,,judge it,get it clean i,thank goodness for frozen meal questions that,thank you guys,write out my to-do list just,do my makeup then i,depend on which dish,make i,,put in a twitter,bring out the fresh flavor,build my own bowl,,look down,flip my rooms around,hope this video,,,,do a side pony if i,keep a lot better if you,transit to 100 % plant-based,do i,,take me five minutes,,listen to audio books,filling recipes that,put it up,do it every single day,,use i,sent you,,go okay you guys,,put on to the connector like,stem it as well you,,use the straighten iron from absolute heat i,combine it with some excavation tools,hike today,give this video a big thumbs up like i,make me young,pop in some protein powder,found this in the auto section,dress you or you,,clean those pesky oven,get dry skin or scratches from,make it for our first recipe we,,,keep oh i,turn really bright,grab some bones from a chicken you roasted,,go through,use this one from the honest company honesty i,blow-dry my hair,,add a poblano pepper if i,have a place,,depend on the brand my favorite one,use fresh or frozen banana for any of these recipes,come with i,take off the lid,,liquefy that on low,hope you guys,grab rather than,take a rock from outside,,make it,watch the latest videos from my favorite youtubers their latest videos,double it,create inner calm,,,keep pile we,wipe down our tires applause applause applause applause,,sit on the bench just to dry,do it them just,got it all ready,go ahead,come to you guys soon,,do it,,get a little from kate somerville i,eat till later,paint our shelves with some bright colored acrylic paint the larger shells,do this once again off-camera,use at least liniments it really,pop these into the freezer,put a flower in there next i,take the collagen,,excit for you guys,listen to either audiobooks or podcast once i,put the salt,even out,show them to you,prepare your oatmeal the reason this,,check the weather,make sure okay right there,spend my relaxing nights,,inspire you,,go ahead,,,,lose weight i,make sure,look like for maximum weight loss,
get a lot of questions about this little dish i collaborative,use today,,,get your proteins with beans,make it nice,transform my day the first thing i,film another video on august channel where i,eating breakfast whatever,,put it in a ziploc bag,,sprinkle of salt,got on clearance at target i,shine i,do even if you you,post on my channel,got marri,create a frame for around the chalkboard the width of my chalkboard,got these i,make some homemade,shovel this in within 10 minutes well actually five minutes,wait wait i it i,pleas snack,go it,,,give the smoothie a really nice texture i,eat i just,,add sea salt at the beginning when i,give it some,wash in to the laundry tub as often as i,use my favorite three ingredient peanut butter cookie recipe,do it,,occur in our tree the other night,thank you guys,,,,keep my grocery list right on a sticky note next to my refrigerator that way anyone in the house,,test on animals,do my everyday makeup routine you,wash your hands,take that long,,gon like it too,make sure the lemon juice salt,put away,,see i,come off,get on here,,,,wear it in the day,keep it in a plastic bag,add in all these other good foods,go back yeah yeah,,,,call the martian which,show you what i,tuck my,find that it,,excit for this i,mean a lot to me,,wash my face,,go on to the valves as you,snap naturally where they,,put a lip tint which,tell me in the comments below if there,talk about,hope you guys,appreciate it,take off the lid,do this,yeah well you i actually here it it,,work with a budget,melt together once it,hope you,,,run when i,promise you,fill above the line of the carcass then,,fall i,do a super quick lazy day makeup,brush his piece with a star wars toothbrush,,use coconut meat it,have a place then you,,create your own all natural skin care products one of the ingredients that,make today,buy it,give that a good,,drink my smoothie,see you in my next one,put everything there that way it,come in,,end up with fluff from him everywhere,make the most of the whole festive season i,make ahead at breakfast ideas,focus on who i,,,get rid of the through pile i,,,go ahead,shave oil,calls for rice that,swear my everyday routine changes like every month,keep you full this,,have similar flavor profiles,,tighten hyaluronic acid,eat out,hide the seam finally,get these,have quite a strong taste,freeze that my even sometimes,leave them the lighter color,get back into supplements in a few months,,go another trick to for the coconut oil,walk i,go ahead,go in with my mandelic acid serum which,eat i,follow that with some greek yogurt this,,give it a thumb up,come in for oven they,got myself completely,,do every morning,,regret it,,,,prefer mint green tea it,complement the mascara,check the calories per,
