Miniclip Visible,Stemmed Visible Actions,Miniclip NOT Visible,Stemmed NOT Visible Actions
1p0_4mini_6.mp4,iron it,1p0_4mini_6.mp4,put it up
1p0_4mini_6.mp4,it straight,1p0_4mini_6.mp4,tuck my
1p0_4mini_6.mp4,use my flat iron,1p0_4mini_6.mp4,make the mistake in my last hair care video of in a bun it
1p0_4mini_6.mp4,iron my hair,1p0_4mini_6.mp4,get as many tangles that way
1p0_9mini_11.mp4,clean the kitchen,1p0_4mini_6.mp4,bang underneath the hair
1p0_9mini_11.mp4,clean this,1p0_4mini_6.mp4,tangle like that
1p0_2mini_6.mp4,use this jesse j palette by makeup forever,1p0_5mini_11.mp4,make time for the things that i
1p0_2mini_6.mp4,blush on,1p0_5mini_11.mp4,come by that
1p0_2mini_6.mp4,blush there,1p0_5mini_11.mp4,do it
1p0_2mini_6.mp4,apply the cc cream,1p0_5mini_11.mp4,stress out for sure
1p0_2mini_6.mp4,do kind of conceals,1p0_5mini_11.mp4,do every time i
1p0_2mini_6.mp4,cover up,1p0_5mini_11.mp4,stress out like i
1p0_2mini_6.mp4,use something to kind of even out my skin tone the little tiny bit of melasma,1p0_5mini_11.mp4,matching socks or something it
1p0_2mini_6.mp4,put a little bit,1p0_5mini_11.mp4,stress out
1p0_2mini_6.mp4,put a concealer under my eyes,1p0_5mini_11.mp4,have a lot of energy
1p0_2mini_6.mp4,blush every single day,1p0_5mini_11.mp4,get stress i
1p0_2mini_6.mp4,use the it cosmetics,1p0_5mini_11.mp4,find that time
1p0_2mini_6.mp4,go palette by makeup forever,1p0_5mini_11.mp4,mean you
1p0_5mini_8.mp4,use a serum or an oil underneath,1p0_5mini_11.mp4,try to film something
1p0_5mini_8.mp4,put some cc cream on this,1p0_5mini_11.mp4,stress out i
1p0_1mini_3.mp4,get them dress for bedtime pajamas,1p0_9mini_11.mp4,do this on the weekends when i
1p0_1mini_3.mp4,remove them from the bath,1p0_9mini_11.mp4,clean the kitchen stove usually once a week it
1p0_1mini_1.mp4,clean up after dinner,1p0_9mini_11.mp4,break it down to once a day every three days
1p0_1mini_1.mp4,clean up right after,1p0_9mini_11.mp4,seem like a lot
1p0_2mini_1.mp4,do in the morning,1p0_9mini_11.mp4,do any more than that
1p0_2mini_1.mp4,clean my skin,1p0_9mini_11.mp4,see you guys in my next video bye
1p0_2mini_1.mp4,remove cream cleansers with a damp cloth,1p0_9mini_11.mp4,do this
1p0_2mini_1.mp4,share with guys,1p0_9mini_11.mp4,collabor with me
1p0_2mini_1.mp4,clean my skin,1p0_9mini_11.mp4,make sure that i
1p0_2mini_1.mp4,use my clarisonic,1p0_9mini_11.mp4,look nice
1p0_2mini_1.mp4,do for my skin,1p0_9mini_11.mp4,get the free products
1p0_2mini_1.mp4,use that with the clarisonic cleanser,1p0_9mini_11.mp4,spend a little bit more time
1p0_2mini_1.mp4,use the clarisonic mia,1p0_2mini_6.mp4,give a little smoky smile
1p0_6mini_5.mp4,look nice,1p0_9mini_3.mp4,take this
1p0_1mini_5.mp4,do our own thing for a few hours,1p0_9mini_3.mp4,use gloves i also
1p0_1mini_5.mp4,built a home studio music,1p0_9mini_3.mp4,stick a lemon usually a use lemon down the disposal
1p0_6mini_2.mp4,take a comb,1p0_9mini_3.mp4,clean the kitchen sink i
1p0_6mini_2.mp4,use this coconut water shampoo,1p0_9mini_3.mp4,bake soda
1p0_5mini_7.mp4,hydrate facial toner by fresh,1p0_9mini_3.mp4,mention this in my diy upcycle video
1p0_2mini_9.mp4,try out the laser genesis at kate somerville,1p0_9mini_3.mp4,smell good i
1p0_9mini_7.mp4,mop,1p0_9mini_3.mp4,stuck on a pan or a bowl before it
1p0_9mini_7.mp4,try to steam the floors every three days,1p0_9mini_3.mp4,fill that up with that
1p0_9mini_7.mp4,use the steam mop every day,1p0_9mini_3.mp4,cycl whiskey bottle i
1p0_9mini_7.mp4,make sure that sweep,1p0_9mini_3.mp4,go in the dishwasher now i
1p0_4mini_4.mp4,apply your eyebrow powder,1p0_9mini_3.mp4,get really dry
1p0_4mini_4.mp4,put some mascara on,1p0_9mini_3.mp4,depend on which dish
1p0_8mini_3.mp4,give them a really nice full look,1p0_9mini_3.mp4,wash your hands
1p0_8mini_3.mp4,fill in any spaces,1p0_5mini_8.mp4,work more as a team than before
1p0_8mini_5.mp4,do my hair in that case,1p0_5mini_8.mp4,use i
1p0_8mini_5.mp4,dry naturally the rest of my hair,1p0_5mini_8.mp4,eat right now parenting style
1p0_8mini_5.mp4,use the naked palette the good old naked palette in the color buck,1p0_5mini_8.mp4,do you
1p0_8mini_5.mp4,dry naturally,1p0_5mini_8.mp4,correct full coverage plus anti-aging serum from a cosmetics
1p0_8mini_5.mp4,flatiron,1p0_5mini_8.mp4,stress out about things
1p0_2mini_8.mp4,use,1p0_5mini_8.mp4,worri about with oliver
1p0_2mini_8.mp4,use a deep puf stick from kate somerville,1p0_5mini_8.mp4,build upon
1p0_2mini_8.mp4,wash my face over the sink,1p0_5mini_8.mp4,break out
1p0_5mini_3.mp4,smell like tangerine,1p0_5mini_8.mp4,try a sample of this first
1p0_10mini_1.mp4,make super quick chicken tacos,1p0_5mini_8.mp4,do that
1p0_10mini_1.mp4,cook dinner,1p0_5mini_8.mp4,see you
1p0_10mini_1.mp4,get my son ready for bed,1p0_1mini_3.mp4,play outside a lot
1p0_10mini_1.mp4,do the dishes,1p0_1mini_3.mp4,clean up from the dirty day that we usually
1p0_10mini_2.mp4,take showers at night,1p0_1mini_1.mp4,go to bed
1p0_10mini_4.mp4,take that with a nice big glass of water,1p0_1mini_1.mp4,go down before we all
1p0_10mini_4.mp4,take my prenatal one my vitamin d,1p0_1mini_1.mp4,share with guys what my typical routine look like every day
1p0_10mini_4.mp4,put it on a plate with some peanut butter,1p0_1mini_1.mp4,make dinner at around five o'clock
1p0_10mini_4.mp4,make some tea,1p0_1mini_1.mp4,get that all
1p0_10mini_4.mp4,cut up an apple,1p0_1mini_1.mp4,leave a big mess for the next morning
1p0_10mini_4.mp4,take every single night before,1p0_1mini_1.mp4,share my night
1p0_10mini_4.mp4,make a snack for myself,1p0_1mini_1.mp4,jump right in
1p0_9mini_5.mp4,make my house look really clean,1p0_1mini_1.mp4,end up
1p0_9mini_5.mp4,try to spray,1p0_2mini_1.mp4,mind that
1p0_9mini_5.mp4,sweep the house obviously with hardwood floors,1p0_2mini_1.mp4,get over a cold
1p0_2mini_2.mp4,use some,1p0_2mini_1.mp4,apologize i
1p0_2mini_2.mp4,put it on your skin,1p0_2mini_1.mp4,do here i
1p0_4mini_3.mp4,use the it cosmetics concealer,1p0_2mini_1.mp4,start by
1p0_4mini_3.mp4,use a few matte colors for around my eyes that light brown color,1p0_6mini_5.mp4,do a side pony if i
1p0_6mini_6.mp4,use my macadamia nut oil on my damp hair,1p0_6mini_5.mp4,wear it in the day
1p0_6mini_6.mp4,use the beauty water,1p0_6mini_5.mp4,figure out what work
1p0_6mini_6.mp4,add it to some hot water,1p0_6mini_5.mp4,use that
1p0_6mini_6.mp4,put my hair in two braids,1p0_6mini_5.mp4,do a high pony
1p0_9mini_6.mp4,divide the laundry,1p0_6mini_5.mp4,do lately with long hair
1p0_9mini_6.mp4,put fabric softener,1p0_6mini_5.mp4,try every hairstyle
1p0_9mini_6.mp4,turn it on,1p0_6mini_5.mp4,do my hair in the day i usually
1p0_9mini_2.mp4,jump right into my cleaning routine,1p0_6mini_5.mp4,wash it every single day i
1p0_9mini_2.mp4,make your bed every morning,1p0_6mini_5.mp4,keep it at night
1p0_9mini_2.mp4,fix the bed,1p0_6mini_5.mp4,blow it out
1p0_9mini_2.mp4,make the bedroom look really clean,1p0_6mini_5.mp4,do it like that where it or i
1p0_4mini_7.mp4,use a instant bronzer,1p0_6mini_5.mp4,make it
1p0_2mini_5.mp4,use the cc cream,1p0_1mini_5.mp4,have definitely always
1p0_2mini_5.mp4,use a foundation brush,1p0_1mini_5.mp4,sleep my husband
1p0_5mini_1.mp4,add a little bit of water it,1p0_1mini_5.mp4,invest in some equipment
1p0_5mini_1.mp4,cleanse my skin with the clean oil,1p0_1mini_5.mp4,imagine i in my home
1p0_1mini_4.mp4,wind down with both of them,1p0_1mini_5.mp4,got marri
1p0_10mini_3.mp4,last a really long time,1p0_1mini_5.mp4,do with this room
1p0_10mini_3.mp4,wash my face,1p0_1mini_5.mp4,move into this house
1p0_10mini_3.mp4,use dream cream all over my body,1p0_1mini_5.mp4,devot to music
1p0_10mini_3.mp4,keep it pretty simple,1p0_1mini_5.mp4,film this video
1p0_10mini_3.mp4,use at night,1p0_1mini_5.mp4,live in our apartment when we first
1p0_10mini_3.mp4,make a cooling foot cream,1p0_6mini_2.mp4,head out
1p0_10mini_3.mp4,rub that dream cream all over my legs my arms all over my body,1p0_6mini_2.mp4,drop that kind of cash on shampoo
1p0_10mini_3.mp4,rub that in,1p0_6mini_2.mp4,take showers at night
1p0_10mini_3.mp4,buy this one,1p0_6mini_2.mp4,mean a lot of knots
1p0_10mini_3.mp4,put a little bit of serum on a light hydrating serum,1p0_6mini_2.mp4,put a ball cap on
1p0_10mini_3.mp4,get that at lush,1p0_6mini_2.mp4,work out if i or i
1p0_4mini_5.mp4,side lipstick,1p0_6mini_2.mp4,go back
1p0_4mini_5.mp4,blush color on my lips,1p0_6mini_2.mp4,chillin with my kids i usually
1p0_5mini_2.mp4,left in there,1p0_6mini_2.mp4,take a shower in the morning i
1p0_5mini_2.mp4,wash it,1p0_6mini_2.mp4,work out
1p0_5mini_2.mp4,use a little bit of that into your skin,1p0_6mini_2.mp4,drink this before i
1p0_5mini_2.mp4,use this,1p0_6mini_2.mp4,take a shower in the morning which i actually
1p0_8mini_4.mp4,apply this product,1p0_5mini_7.mp4,happen with
1p0_8mini_4.mp4,apply it,1p0_5mini_7.mp4,sold out for i
1p0_8mini_4.mp4,do one coat,1p0_5mini_7.mp4,take the collagen
1p0_5mini_6.mp4,part it like this,1p0_5mini_7.mp4,get back into supplements in a few months
1p0_9mini_4.mp4,clean the kitchen every day,1p0_5mini_7.mp4,smell really beautiful it
1p0_9mini_4.mp4,clean the counters,1p0_5mini_7.mp4,use this all through my pregnancy just it
1p0_9mini_4.mp4,use it on my refrigerator,1p0_5mini_7.mp4,help i
1p0_9mini_4.mp4,get to the stainless steel,1p0_5mini_7.mp4,take right now
1p0_9mini_4.mp4,clean the surface of my kitchen,1p0_5mini_7.mp4,give you a nice glow
1p0_9mini_4.mp4,work great really like this method stainless steel cleaner,1p0_5mini_7.mp4,notic a difference in my skin in my nails
1p0_2mini_7.mp4,use a little bit of mascara,1p0_5mini_7.mp4,doe smell really nice
1p0_2mini_7.mp4,use the elizabeth arden hour cream on my lips,1p0_5mini_7.mp4,hope that that
1p0_2mini_7.mp4,light a candle,1p0_5mini_7.mp4,fall out right now
1p0_6mini_7.mp4,curl,1p0_2mini_9.mp4,do these occasionally
1p0_6mini_7.mp4,put my hair in the braids,1p0_2mini_9.mp4,sleep thing
1p0_6mini_7.mp4,put it in two braids,1p0_2mini_9.mp4,get a little puffy
1p0_6mini_7.mp4,take my hair out of the braids,1p0_2mini_9.mp4,give your skin
1p0_6mini_7.mp4,do anything to my hair,1p0_2mini_9.mp4,look like i
1p0_9mini_9.mp4,use the anti back tile it cleaner,1p0_2mini_9.mp4,base on your age range
1p0_9mini_9.mp4,work really great,1p0_2mini_9.mp4,look for in your skin i recently
1p0_9mini_9.mp4,clean those up,1p0_2mini_9.mp4,gone into my 30s i
1p0_9mini_9.mp4,clean the toilets,1p0_2mini_9.mp4,go into a little bit more detail of this treatment on my blog
1p0_9mini_9.mp4,clean once,1p0_2mini_9.mp4,show you guys what it
1p0_9mini_9.mp4,clean the toilet,1p0_2mini_9.mp4,increase collagen production in your skin
1p0_9mini_9.mp4,clean the shower,1p0_9mini_7.mp4,look with this house i
1p0_9mini_9.mp4,clean the toilets,1p0_9mini_7.mp4,have black tile
1p0_5mini_14.mp4,talk about how,1p0_9mini_7.mp4,go on how they
1p0_5mini_14.mp4,smell good,1p0_9mini_7.mp4,do it a lot more at the old place
1p0_5mini_14.mp4,try different products,1p0_9mini_7.mp4,look i
1p0_1mini_8.mp4,create that kind of zen space,1p0_9mini_7.mp4,do it as often
1p0_1mini_8.mp4,call it my rest nest with a candle some crystals from the shop,1p0_9mini_7.mp4,have a door that
1p0_1mini_8.mp4,put some hyaluronic acid serum on my face,1p0_9mini_7.mp4,mop the kitchen floor
1p0_1mini_8.mp4,head to bed,1p0_9mini_7.mp4,make sure there
1p0_3mini_5.mp4,warm it,1p0_9mini_7.mp4,run in
1p0_3mini_5.mp4,relieve your cramping,1p0_9mini_7.mp4,got heavy traffic just
1p0_3mini_5.mp4,put in the microwave,1p0_4mini_4.mp4,side brush for
1p0_3mini_5.mp4,put it on your lower abdomen,1p0_4mini_4.mp4,look nice
1p0_3mini_5.mp4,go to the drugstore,1p0_4mini_4.mp4,go a little too over the top with the filling in of the brows
1p0_3mini_5.mp4,depend on the wattage of your microwave work,1p0_4mini_4.mp4,have an eyeliner with like a
1p0_3mini_5.mp4,make one yourself,1p0_4mini_4.mp4,use for years voluminous carbon black by l'oreal
1p0_3mini_5.mp4,do a little,1p0_4mini_4.mp4,fill them in
1p0_3mini_5.mp4,fall out,1p0_4mini_4.mp4,apply i
1p0_3mini_5.mp4,stick in the microwave ten to thirty seconds,1p0_4mini_4.mp4,rais in color which i
1p0_3mini_5.mp4,keep your eyes very closely on anything like this,1p0_4mini_4.mp4,use this
1p0_3mini_5.mp4,pull out a few stress relief products,1p0_4mini_4.mp4,have a really pretty gold eyeshadow that you
1p0_1mini_2.mp4,use baby ganic spa,1p0_4mini_4.mp4,go out at night i usually
1p0_1mini_2.mp4,put a little bubble bath in there,1p0_4mini_4.mp4,side it
1p0_1mini_2.mp4,add a little bit of bubble bath,1p0_8mini_3.mp4,end up under my eyes by the end of the day as much as this one
1p0_1mini_2.mp4,add their toys,1p0_8mini_3.mp4,make my lashes
1p0_1mini_2.mp4,prep for the boys,1p0_8mini_3.mp4,use the lip sense in sass easy someone
1p0_1mini_2.mp4,use the seventh generation coconut care mousse shampoo for both of them it,1p0_8mini_3.mp4,do really like this one
1p0_1mini_2.mp4,clean up,1p0_8mini_3.mp4,look as even as possible
1p0_1mini_2.mp4,make sure the water,1p0_8mini_3.mp4,use a lot
1p0_6mini_3.mp4,get rid of any knots,1p0_8mini_3.mp4,make them
1p0_6mini_3.mp4,get them out,1p0_8mini_3.mp4,use it
1p0_6mini_3.mp4,go under the hair,1p0_8mini_3.mp4,go back
1p0_6mini_3.mp4,use a comb in the shower,1p0_8mini_3.mp4,get it
1p0_6mini_3.mp4,take a shower,1p0_8mini_3.mp4,sent this to me i
1p0_6mini_3.mp4,blow it,1p0_8mini_3.mp4,put it on you
1p0_6mini_3.mp4,start with my hands,1p0_8mini_5.mp4,make sure
1p0_3mini_2.mp4,try right here,1p0_8mini_5.mp4,complement the mascara
1p0_3mini_2.mp4,do this one outside cramps,1p0_8mini_5.mp4,do a five-minute makeup routine that
1p0_3mini_2.mp4,stretch routine,1p0_8mini_5.mp4,use a tiny bit on the corners of my eyes
1p0_2mini_3.mp4,put it all over my entire body,1p0_8mini_5.mp4,looks really smooth
1p0_2mini_3.mp4,focus on my arms or the areas of my body,1p0_8mini_5.mp4,brush it out i usually
1p0_2mini_3.mp4,use the vitamin c peel pads for my face,1p0_8mini_5.mp4,go for a full eye shadow or anything just like a little tiny bit
1p0_9mini_10.mp4,clean the shower doors,1p0_8mini_5.mp4,look a little shiny
1p0_9mini_10.mp4,clean the glass,1p0_8mini_5.mp4,clean up the makeup
1p0_9mini_10.mp4,clean the bathtub,1p0_2mini_8.mp4,increase your skin
1p0_9mini_10.mp4,use that with a scrubber,1p0_2mini_8.mp4,pull back on some of the other things that i
1p0_3mini_8.mp4,garnish it,1p0_2mini_8.mp4,use retinol
1p0_3mini_8.mp4,take the rosemary out,1p0_2mini_8.mp4,bring new skin
1p0_3mini_8.mp4,try it out,1p0_2mini_8.mp4,increase cell turnover
1p0_3mini_8.mp4,make your own bath salts with epsom salt,1p0_2mini_8.mp4,use that
1p0_3mini_8.mp4,take baths,1p0_2mini_8.mp4,get a little from kate somerville i
1p0_3mini_8.mp4,add the kale in there,1p0_2mini_8.mp4,tighten hyaluronic acid
1p0_3mini_8.mp4,mix together,1p0_2mini_8.mp4,notice a huge difference in your skin
1p0_3mini_8.mp4,put it in a bowl,1p0_2mini_8.mp4,make your skin peel
1p0_3mini_8.mp4,hope,1p0_2mini_8.mp4,use vitamin c
1p0_3mini_3.mp4,put that into silicone molds,1p0_2mini_10.mp4,check that out on my blog applause applause thanks oh it
1p0_3mini_3.mp4,mix together ingredients,1p0_2mini_10.mp4,get some tips from it i
1p0_3mini_6.mp4,make a lentil kale soup,1p0_2mini_10.mp4,include those three ingredients into my skincare routine
1p0_3mini_6.mp4,reach for products,1p0_2mini_10.mp4,hurt at all
1p0_3mini_6.mp4,make something hearty,1p0_2mini_10.mp4,rain drop you
1p0_3mini_6.mp4,reduce redness or puffiness,1p0_2mini_10.mp4,see you guys very soon in the next one bye
1p0_3mini_6.mp4,reduce any redness or puffiness,1p0_2mini_10.mp4,got a little sunburn or something
1p0_3mini_6.mp4,add some onions,1p0_5mini_3.mp4,break out
1p0_9mini_1.mp4,stay clean,1p0_5mini_3.mp4,take his naps
1p0_3mini_7.mp4,chop kale in,1p0_5mini_3.mp4,sleep through the night
1p0_3mini_7.mp4,stick it in a crock pot,1p0_5mini_3.mp4,chang my life
1p0_3mini_7.mp4,add some rosemary from the garden,1p0_5mini_3.mp4,start like
1p0_3mini_7.mp4,do by dinner,1p0_5mini_3.mp4,use before right now my skin
1p0_3mini_7.mp4,put it,1p0_5mini_3.mp4,talk about that this
1p0_3mini_7.mp4,keep it mild,1p0_5mini_3.mp4,use before right now my products i or anything like that
1p0_3mini_7.mp4,add,1p0_5mini_3.mp4,come in okay
1p0_3mini_7.mp4,go by dinner,1p0_5mini_3.mp4,revolv around
1p0_3mini_7.mp4,add spice to mine after the fact,1p0_1mini_6.mp4,obsess with these they
1p0_3mini_7.mp4,keep it on,1p0_1mini_6.mp4,listen to him
1p0_3mini_7.mp4,use it in everything,1p0_1mini_6.mp4,unravel all of my music equipment it kind of
1p0_3mini_7.mp4,have lots of great ingredients,1p0_1mini_6.mp4,release the songs that i
1p0_10mini_5.mp4,drink my tea,1p0_1mini_6.mp4,get better another goal of mine with this space
1p0_10mini_5.mp4,eat my snack,1p0_1mini_6.mp4,grew up
1p0_10mini_5.mp4,put my hair in a braid,1p0_1mini_6.mp4,turns into wildflowers i
1p0_3mini_9.mp4,find this at pacific time,1p0_1mini_6.mp4,finish on spotify
1p0_3mini_9.mp4,complete this video,1p0_1mini_6.mp4,improve so for me i
1p0_3mini_9.mp4,carry tons of different things,1p0_1mini_6.mp4,plant it it
1p0_3mini_9.mp4,launch at the end of this month,1p0_1mini_6.mp4,use it
1p0_3mini_9.mp4,recommend that,1p0_1mini_6.mp4,keep it really really simple i actually
1p0_3mini_9.mp4,spelt like the herb,1p0_1mini_6.mp4,sleep i
1p0_3mini_9.mp4,sign up for a newsletter,1p0_1mini_6.mp4,smell divine this
1p0_3mini_9.mp4,share my thoughts,1p0_10mini_1.mp4,go after i
1p0_3mini_9.mp4,look into cbd products cbd bath bombs,1p0_10mini_1.mp4,doe grocery shopping
1p0_3mini_9.mp4,launch new products,1p0_10mini_1.mp4,read a few books
1p0_2mini_4.mp4,follow the instructions,1p0_10mini_1.mp4,share with you guys my current nighttime routine while i
1p0_4mini_1.mp4,put on my makeup,1p0_10mini_1.mp4,start every night with dinner now i
1p0_4mini_1.mp4,apply my cc cream from it cosmetics,1p0_10mini_1.mp4,cook with whatever we
1p0_3mini_1.mp4,do tips,1p0_10mini_1.mp4,jump right in
1p0_3mini_1.mp4,make from a great herbal shop,1p0_10mini_1.mp4,look like so i
1p0_3mini_1.mp4,do custom blends,1p0_10mini_1.mp4,go ahead
1p0_3mini_1.mp4,visit in the san fernando valley,1p0_10mini_1.mp4,cook more plant-based meals both on my channel
1p0_3mini_1.mp4,blend that,1p0_8mini_6.mp4,bear with me as i
1p0_8mini_1.mp4,start with my ecco bella day cream,1p0_8mini_6.mp4,looks greasy
1p0_8mini_1.mp4,use concealer,1p0_8mini_6.mp4,wear in most of my recent videos
1p0_8mini_1.mp4,use this one,1p0_8mini_6.mp4,film schedule
1p0_8mini_1.mp4,share with my current makeup routine the products,1p0_8mini_6.mp4,watch my channel
1p0_8mini_1.mp4,found what work for me,1p0_8mini_6.mp4,keep an eye out for new videos
1p0_8mini_1.mp4,works really beautifully under makeup some moisturizers,1p0_8mini_6.mp4,see my hair
1p0_8mini_1.mp4,apply that first,1p0_8mini_6.mp4,come soon
1p0_6mini_4.mp4,look,1p0_8mini_6.mp4,thank you guys
1p0_6mini_4.mp4,try several,1p0_8mini_6.mp4,get out the door
1p0_6mini_4.mp4,got some from drybar,1p0_8mini_6.mp4,dry it just
1p0_6mini_4.mp4,smell really good,1p0_8mini_6.mp4,see you guys very soon in the next video bye
1p0_6mini_4.mp4,make my hair a lot smoother,1p0_8mini_6.mp4,use recently
1p0_6mini_4.mp4,put the dry shampoo,1p0_8mini_6.mp4,get back to my normal
1p0_9mini_8.mp4,mop in my master bathroom,1p0_10mini_2.mp4,gloss over that
1p0_9mini_8.mp4,dust with a little duster in the bathroom,1p0_10mini_2.mp4,see it
1p0_9mini_8.mp4,use the steam,1p0_10mini_2.mp4,blow-dry my hair
1p0_9mini_8.mp4,try to dust once a week,1p0_10mini_2.mp4,brush his piece with a star wars toothbrush
1p0_8mini_2.mp4,use the highlighter,1p0_10mini_2.mp4,take my time
1p0_8mini_2.mp4,blend it out with a beauty blender,1p0_10mini_2.mp4,prevent stretch marks i
1p0_8mini_2.mp4,use the magic foundation by charlotte tilbury,1p0_10mini_2.mp4,use a lot of the same products i
1p0_8mini_2.mp4,apply bronzer on to my cheekbones,1p0_10mini_2.mp4,bring blood flow
1p0_1mini_7.mp4,use the coconut body lotion in combination with a lavender oil,1p0_10mini_2.mp4,write java barney
1p0_1mini_7.mp4,clean my body with my exfoliate gloves,1p0_10mini_2.mp4,decide whether i
1p0_1mini_7.mp4,blow-dry my hair,1p0_10mini_2.mp4,help his mommy
,,1p0_10mini_2.mp4,do kind of like my normal thing i
,,1p0_10mini_2.mp4,get out i dry his hair we
,,1p0_10mini_4.mp4,use with a lotion on your legs on your feet also
,,1p0_10mini_4.mp4,go to bed
,,1p0_10mini_4.mp4,find these at the body shop these great for up on your bum
,,1p0_10mini_4.mp4,do i
,,1p0_9mini_5.mp4,doe kind of sweep up some things that
,,1p0_9mini_5.mp4,turn it on
,,1p0_9mini_5.mp4,do these things every single day it really
,,1p0_9mini_5.mp4,do other things
,,1p0_9mini_5.mp4,go in
,,1p0_9mini_5.mp4,look like hardwood floors they
,,1p0_9mini_5.mp4,got me as a housewarm gift the irobot
,,1p0_9mini_5.mp4,works great for the
,,1p0_9mini_5.mp4,go now i
,,1p0_9mini_5.mp4,do some of the things i
,,1p0_9mini_5.mp4,carpet areas it
,,1p0_2mini_2.mp4,treat it like an exfoliant
,,1p0_2mini_2.mp4,follow the instructions i
,,1p0_2mini_2.mp4,use it every single day
,,1p0_2mini_2.mp4,brighten i
,,1p0_2mini_2.mp4,doe a mask like this
,,1p0_2mini_2.mp4,use it a few days in a row this mask also
,,1p0_2mini_2.mp4,deal with a lot of melasma or hyperpigmentation
,,1p0_2mini_2.mp4,leave it on for about 20 minutes
,,1p0_2mini_2.mp4,brighten products i
,,1p0_2mini_2.mp4,doubl as an exfoliant
,,1p0_2mini_2.mp4,use it a few days in a row
,,1p0_4mini_3.mp4,call the perfect lighting radiant touch magic wand
,,1p0_4mini_3.mp4,have a little bit more of a peach undertone
,,1p0_4mini_3.mp4,use cork too for like the base of my eye a plier
,,1p0_4mini_3.mp4,call cork though i
,,1p0_4mini_3.mp4,start with that
,,1p0_4mini_3.mp4,use this really cool it
,,1p0_4mini_3.mp4,use cavanaugh quan
,,1p0_4mini_3.mp4,call antiqued
,,1p0_6mini_6.mp4,plan sometimes i
,,1p0_6mini_6.mp4,take it at night after my kids
,,1p0_6mini_6.mp4,look for something casual
,,1p0_6mini_6.mp4,get out i
,,1p0_6mini_6.mp4,wash my hair as normal
,,1p0_6mini_6.mp4,take a shower in the daytime
,,1p0_6mini_6.mp4,take a shower
,,1p0_6mini_6.mp4,do i
,,1p0_6mini_6.mp4,drink that
,,1p0_6mini_6.mp4,prevent that
,,1p0_9mini_6.mp4,talk about before on my channel
,,1p0_9mini_6.mp4,use it for towels
,,1p0_9mini_6.mp4,spend hours
,,1p0_9mini_6.mp4,get i
,,1p0_9mini_6.mp4,do which
,,1p0_9mini_6.mp4,cleaning towels i usually
,,1p0_9mini_6.mp4,depend i
,,1p0_9mini_6.mp4,vacuum the laundry i i it
,,1p0_9mini_6.mp4,use it on clothes necessarily
,,1p0_9mini_6.mp4,do other things
,,1p0_9mini_6.mp4,do at least a load every three days sometimes
,,1p0_9mini_2.mp4,implement as
,,1p0_9mini_2.mp4,get a lot of traffic
,,1p0_9mini_2.mp4,clean it constantly i really
,,1p0_9mini_2.mp4,clutter in the bedroom
,,1p0_9mini_2.mp4,do every day my first daily habit i
,,1p0_9mini_2.mp4,get all of these items for free in the scent of your choice i
,,1p0_9mini_2.mp4,sleep in your bed every night
,,1p0_9mini_2.mp4,offer you guys a free gift
,,1p0_9mini_2.mp4,make a huge difference
,,1p0_9mini_2.mp4,make a big difference the other room that i
,,1p0_4mini_7.mp4,make sure
,,1p0_4mini_7.mp4,give your skin an instant glow
,,1p0_4mini_7.mp4,call their 24-karat lotion
,,1p0_4mini_7.mp4,keep it really really simple in the winter months especially i
,,1p0_4mini_7.mp4,use it on my arms
,,1p0_4mini_7.mp4,wait for it
,,1p0_4mini_7.mp4,works i really like this one
,,1p0_4mini_7.mp4,make your skin look really healthy
,,1p0_1mini_9.mp4,see you guys in the next one
,,1p0_1mini_9.mp4,hope you
,,1p0_2mini_5.mp4,use like a tiny bit i i i well i
,,1p0_2mini_5.mp4,sleep a little bit better
,,1p0_2mini_5.mp4,get like a little redness under my eyes when i
,,1p0_2mini_5.mp4,contain hyaluronic acid
,,1p0_2mini_5.mp4,make your skin
,,1p0_2mini_5.mp4,give you plump skin like babies
,,1p0_2mini_5.mp4,get older it
,,1p0_2mini_5.mp4,give your skin that glow that i really the it cosmetics cc cream
,,1p0_2mini_5.mp4,sleep through the night
,,1p0_2mini_5.mp4,get better
,,1p0_2mini_5.mp4,hold a thousand times its weight in water
,,1p0_2mini_5.mp4,sleep very well these days
,,1p0_5mini_1.mp4,figure i
,,1p0_5mini_1.mp4,clean oil
,,1p0_5mini_1.mp4,chat with y' all while i
,,1p0_5mini_1.mp4,use right now after i
,,1p0_5mini_1.mp4,clean it with the sensitive skin facial
,,1p0_5mini_1.mp4,clean oils i
,,1p0_5mini_1.mp4,cleanse my face my face
,,1p0_5mini_1.mp4,rose scent to it
,,1p0_5mini_1.mp4,do a little facial
,,1p0_5mini_1.mp4,ask you guys
,,1p0_5mini_1.mp4,watch a show
,,1p0_5mini_1.mp4,clean my face with
,,1p0_1mini_4.mp4,do it together
,,1p0_10mini_3.mp4,whip cream in my last video
,,1p0_10mini_3.mp4,get really swollen during pregnancy this
,,1p0_10mini_3.mp4,go a really long way
,,1p0_4mini_5.mp4,use it
,,1p0_4mini_5.mp4,use that this particular lipstick it
,,1p0_4mini_5.mp4,have like a
,,1p0_4mini_5.mp4,go for something a little bit more red
,,1p0_4mini_5.mp4,come in my fabfitfun box for the fall
,,1p0_4mini_5.mp4,get to wherever i
,,1p0_4mini_5.mp4,go my makeup
,,1p0_4mini_5.mp4,wear a red
,,1p0_4mini_5.mp4,believe i
,,1p0_4mini_5.mp4,look a little bit more natural
,,1p0_4mini_5.mp4,wear a
,,1p0_5mini_2.mp4,tell you what i
,,1p0_5mini_2.mp4,use the fresh sugar face polish which i really like this polish for a physical exfoliant i
,,1p0_5mini_2.mp4,have the tag on it
,,1p0_5mini_2.mp4,use them when you
,,1p0_5mini_2.mp4,use the fresh vitamin nectar vibrancy
,,1p0_5mini_2.mp4,use it
,,1p0_5mini_2.mp4,boost face mask this
,,1p0_5mini_2.mp4,talk about before on my channel
,,1p0_8mini_4.mp4,looks like how my lips
,,1p0_8mini_4.mp4,apply this the way that distributors
,,1p0_8mini_4.mp4,look up a distributor or someone who
,,1p0_8mini_4.mp4,recommend you
,,1p0_8mini_4.mp4,sell it
,,1p0_8mini_4.mp4,look nice
,,1p0_8mini_4.mp4,works really well for me it
,,1p0_8mini_4.mp4,do it
,,1p0_8mini_4.mp4,make my lips
,,1p0_8mini_4.mp4,last all day long
,,1p0_8mini_4.mp4,sound weird
,,1p0_5mini_6.mp4,call ollie they
,,1p0_5mini_6.mp4,go like
