get it from girl,get the rest of the dishes into the dishwasher,,,make sure,see this one at the store,tell you these 10,use kale,go in,,add the juice of a whole lemon which,,save me a lot of time,make an o,gon generously then i,put one of these in normally they,send me a photo,devot to music,do here,stain i,get some good vegan cheese,drink separately,add less i,keep everything tasting nice,taste like you,,,add those communities,taste quite as good,,grew up drink it every day it,share it,watch them,make these it,find only include in my morning routine,,finish off the tree,,,,,find your quran whenever i,,finish off,wake myself up,doe kind of sweep up some things that,eat really quickly then i,,help me out,crave every morning,eat in a day on my first day back to school i,,soak in salt water for about five minutes then you,do it,try out a few of these tips,,,,figure out what work,make a veggie burger um,go into some lentil burgers this week i,tell me in the comments below what else you guys,,,,go to bed i,keep you fuller for longer,make the mistake in my last hair care video of in a bun it,see something,,give you this month,watch that video,,get the blood flow,,come with two breast shields which this,prep my spare i if you kind of,,got it,bury alright guys i,cook a lot,find comment,mean then,use vanilla flavor just any any one of your favorite protein powders,use all the same product my water vinegar mixture,make you your lunches for the entire week awesome yeah someone,,put some towels in the bathtub,keep them in the refrigerator,stir-fry your veggies before you,,,stand still oh,,make it simple all you,,buy all of the christmas things it,blow dry it out then,take my time,,use a regular tortilla i,,,use some gentle,,buy it if you,get ready,,make such a nice texture,follow me over on instagram,go for in the bathroom with,turn out,,find it,get into the christmas spirit,,make every time you,,,keep that one also from a salon,,,built up with a lot of stuff over the last few days as well,do with those i,rinse it,prepare the night before,stay tune,,cook i you you then you,,notice a huge difference in your skin,get there,defend the galaxy the kids,use that color,use avocado then,pack they,make you,smell really beautiful it,,add in your steel-cut oats,get back home i i i they just,look like when you they,prevent any future wrinkles from,go really well with this odd recipe,watched enough top chef,,help you,do now,watch how much mother there,,get over,,see my master bath without,,,,lose weight okay,do a five-minute makeup routine that,get a bag of berries that,
works really well to scrub all my dishes,take care of that which every day,,,thank you guys,use my mrs,do a little giveaway for you guys i,go to you,do now,,contain selenium which,,cooking for about 20 minutes it,stuff it now if you,do the whole kitchen in about 10 minutes i also,go under 13 % you,see like what salads you,film this video,end up,use the rest of my,do that kind of a treat i,do my hot water then my breakfast then my coffee,add a little bit less,use a whole jalapeno,get soggy,,,keep me fuller for longer next i,make a big batch of this in advance,,do eating which,,yeah so,relax off to my busy day,combine them together whether i or i,,go our tree the other night,,,,,pick up at the store maybe a little,,call crop natural for my cleanser i,turn on some lint gin,turn it on,mean that i,,thank you,thank you everyone for,get a big scoop of that,,use regular potato,pull out of cupboard when i,go the extra mile,,,,use that,put out,work for me in my transition,get ready for school,,,,go to bed sometime around 8:30,lose weight i still,get as many tangles that way,belong i,,roll on a mud mask,make sure,,do it,,go ahead,set that aside for like 1530 minutes max nothing crazy,,get it for a birthday present,hope you,go through dishes in our house applause,see them,,pour into our mason jar,satisfi this,,,put a link down below,keep in like ziploc bags,see really how quick it,,,send me free years,,requir three drinks from grass talk about build immunity it,,buy some they,look my ultimate no makeup makeup,prevent stretch marks i,,put it over the top i,,,add below,,leave a link down below to how i,play it into a nice big,,link down below,relax the rest of the night,sit on my desk,look great it,,end up with blond hair everywhere,go back,,walk by it it,,,work really well for,,,go through,shave that day then,guess by the tablespoon,decide to type myself,hope you guys,,take this with you on the go,,make your skin peel,end up,believe how cool these,make your foundation literally,use mixed berries if you,use these cold brew tropical fruit herbal tea,get rid of in the move,use this all through my pregnancy just it,,call it,prep these on sunday,mix really well together,reduc the appearance of,swimming peanut butter just,found out,,rush around,preheat to 225 degrees i,take my mind off everything,,hope you,,go ahead,,,,believe in specific weight loss or skinny peas or fatties a tea alone,use a tiny bit on the corners of my eyes,make it a little bit too sour,
get my little soap station,watch my cleaning videos you yet definitely,,,watch i,smell it,put on my favorite music i,tell you,yeah this,,end up,,label my squash right into my blender my chicken broth,get into that in a second,take that same water,satisfi when you,subscribe to my channel it,built a home studio music,hang it in my son room for about a week after just it,use the,go to whole foods for lunch i,do it perfectly you,avoid exposure to bpa then you if you,use it,go to bag up separately in these wreaths if reusable bags these,,,soak them,buy precooked hard-boiled eggs they,,mean that i,,yeah again i,sit down,do both of them every single day,,show that we already,,,,,set some goals for yourself,,set your makeup as well,put on my makeup i sometimes,do these things every single day it really,give my body a chance,,repost them,got a lime,dress over top of it,,cook something good i,disgust like it,tackle a space in your bathroom maybe,,,,do a high pony,make like a caesar style,group everything in order of recipe,see you next friday,,,,do we,get a hungry day,bang underneath the hair,sit on my coffee table,,give you the roll-on bottles,head over to ivan channel once again it,,face wash okay,,rip or torn,do mine dry if i,,,,use it,click there,,balance out your sugar,dust i actually,,,come right off when it,use them on oliver 4,add in our veggies you,,,spin applause,,boost your health,,tackle the guest room,got a little weird maybe,use a lot of the same products i,,burn easily,,,list all of the ingredients that as well as some other,,make with all the greens,take the rest of the,,hydrate night cream,got a little bit of clean motivation from it,use every day,got this woodcut at home depot,,put white fluff everywhere,get up super early the entire year,,prep zones,,,fill with a yoga tico product,,,,try to workout first thing in the morning three to five morning a week,calls for tightly packed cups of curly kale,finish it i,call them pumpkin pie pancakes,,put in your,,use vitamin c,go out,play with these in,use the same color that we,use kashi nevada this,go wrong with garlic in my book,paint onto glass jars bottles i,help i,,use the full fat you,walk which,hope you guys,go in with some bioderma,do this,go holy crow,,leave the house,tell just by,make me,,shower if it,,hope you guys,,,,have a better taste that,looks really smooth,use 1 tablespoon of,
use applause,try it out it,,,get your iron from plant sources,use this in my last pudding video,put me in a really good mood,see we,set that concealer a little bit with my mac,,save it for later later in the week we,,splatter out,use it on your kids,fit right to the right once i,make sure you,try one up for yourself if you,live in our apartment when we first,go ahead,cut your wood at home,call oh,do like 20 minutes on either end,add more chicken,make it less spicy i,produce in the house,,,add a lot of good nutrients,,,eat slowly,,heard this,make 20 cookies before you,do maybe one or the other or maybe a bit of both,,paint the other side,,,,,fill in the other days with things like leftovers,,,go over to my laptop,do other things,go a little bit brown,,watch this video i,look for new ideas to spice it up,curri chicken salad like traditional it,,involve today i,works really well,look new again we we generally like the,,,,do lately with long hair,left over,buy them loose,go back to school um,,,,sleep better now since ryan,stop yourself from,tangle like that,put stuff away where they,,put particular,see you in my next video bye,,get the heart rate,,get that start with a breast pump,snap it on the end,,,,try this yet definitely,take me,,take away breakfast option for back-to-school the second breakfast we,see in this video in about an hour i,,,take about 20 minutes,see you very soon in my next video,do one,,,,,yeah it,,look pretty bad dollar tree diy projects,do on a lazy day i tinted moisturizer,bring blood flow,,wrap i,,,do a proper skin,,color if you you,start now,,depend how much time i,watch a show,use that day,shelve for the bathroom as well i,,lie to the two days versus mess i,drink some water,,spent a lot of time,,,do really like this one i also,,,,use the honest companies,use kosher salt anything really against other salts i,do my foundation like the australis foundation,use to by definitely a delicious treat,,start by,,do these occasionally,,hope you,look little it,serve it only,do a lot of blog latias videos,seal it,take right now,,give it a really nice everything,brush my teeth while i,get essentials video,take about 3 months,top if there,see you very soon with my next video bye today video,,go to bed,look gig okay,find very calming,,wash my hair i,,,,,,keep i,brush it out i usually,use as a puree if you,
finish up with my sink i just,try this out,,,mention in the video down below in the description box with links to information if you,love them,give you more sustained energy then i,,do a lot of that my eyes,,put it on top of our pizzas,,do that for all my soups,avoid any crack or dry paws,make you i,find this,,obsess with these they,leave it out,see me,put basil on a margherita pizza then i,make it,get out a large pot,use the leftovers of this,,,,finish my blender this,,,digest it if i,,leave a comment down below,get on with my busy day today as a snack i,achieve everything,,go ahead,,,,,cook three times a week,,,carry away then i,go in,do this,,hope you guys,run through the mixture just,got in there,,wear physicians formula youthful wear spotless foundation which i just,get some product,inspire you,,,,try every hairstyle,do that versus,make some lentil mushroom burgers later on this week,,,,,do it,eat everything inside i,,go through the next day,,provide that for you,thank you,,work out i,,come with connectors which these connectors,make this as well,,,,make sure that it,,,yogurt some mixed berries,tackl underneath of the bed just,,,decide these things they i it i now,complete my fall,cook up before we,,,,,,,add a few christmas touches i also this,wash my heads usually in the evening when i,write java barney,,watch them very closely,,,make the,,buy all the time,ramekin i,,take a shower once i,get home,find products in there,have his cousin over,,interrupt my whole video always by just,make my favorite healthy pumpkin holiday recipe my recipe for healthy pumpkin pancakes or waffles during the festive season i,,look at this far,,,get use in the next week,,,,wash my hair in the morning,take my time a little too much now we,go ahead,,,,,sleep thing,,see you next friday bye guys,look like your skin,work really nicely next,see that i,change them up,give you a nice glow,,make sure,do a quick,have your healthy fats your protein your fiber it,give myself a full-on facial massage for at least 5 minutes this,get a little bit thick,match my top,,give you a little bit of extra time,,relax to me it,,try everything from drunk elephant now,,,,,,help me,go for a full eye shadow or anything just like a little tiny bit,add a teaspoon of sweetener if it,
make it smell,sit my sink i just,,,,use them about a week,give myself about 10 to 15 minutes of me time in the morning,,do my skincare routine,,check that,,do it immers blender i,cut board booze,make the whole kitchen smell awesome,look forward to,,unravel all of my music equipment it kind of,do a little bit more,finish this up by,got a little container of this forager project dairy-free cashew girt,do that,sweat off for a little while about five minutes until they we,make you just,,,,soak for a few minutes just as healthy fats,,,eat it really quickly then i,,clean my favorite part,help me,mean it,,do this one,,,,,do you kids,,,sit there,look like hardwood floors they,do it,,click right here,keep you full,hit the spot i,,thank you it what there i,rinse myself off,make the space,,,,do my hair in the day i usually,dress last night,use it,,,,,help your body,eat good healthy food,,do this to every single surface in my house i,,put like the ratio into this oil bottle,watch once again i,,get nothing i,,go around the nipple,grill up some corn,,,,sit in the sink i,,,use flax whatever you like,help me,,,come up at a recent moms night out,change the recipe,find this a little bit healthier,,,,,,,shove the crap in the closet lousy christmas snow,call it very simple,decide whether i,,rinse your skillet off,,,link the one that i,,add any nest nest this stuff it i,look like,,play my music on my bluetooth speaker in this bottle i,hope you,put everything in,use the restroom,,talk to him for like two days it,turn on my little christmas lights i,,let go of who i,,,have like the middle section which,,,,got in south africa,relax part of my relaxation model,watch at my organizational night routine well this,,,,,get a little puffy,,tell me in the comments below what you,make your foundation,use vanilla extract instead of the powder these,do something for the other person i,see through it,notic a difference in my skin in my nails,,share it with them,watch i i i i,cut into your poached eggs i,make a huge difference in my lashes it,pop it into the fridge,see today,,make sure that you,,slaughter i,,do all the things that you,,,,,,notice off my day with,look a little shiny,serve one tablespoon of dry sae powder,
call a bubble up dish i,make your sink smell,,,,work really really well,see your,,give me sort of like a glowy look i,,see you in my next video bye,,take the little cap off of my top,put that in a container,get up there,hear your feedback,,release the songs that i,work with this,get really pricey,got some basil,drink til 20 minutes after i,eat then,use fresh or frozen strawberries whatever you,,,,help me fuller for longer it,,,do eating,,do applause,eat my lunch,listen to a podcast,,help you,,,,,,,,wear this super cute yellow shirt which,got me as a housewarm gift the irobot,add your personal taste,,enter your email in there,,put some soy ginger,,see a doctor,do myself half my thumbnail i just shots,make all the difference laundering towels,,,,wash it every single day i,make a solid,got okay,,,,,gone i,eat the right foods,,make my life like mess,,blend blended already in here,tell him that i,,do it of why i,,help itself,add a bit of extra flavor to your fish,,,,make this smell,,,defrost as it,do every six months,,,prevent future cleaning,watch my channel,eat a lot of overly cook veggies,,,,,,,go to the store,straighten up the little bits in the ends that,help his mommy,,add the garlic at the end just,,,switch them up,,serve every time,eat a lot of oatmeal when i,,come out of the shower i,,keep everything that you,cut accordingly,,see that,watched enough videos then i,,get it,,,fill with this purple gel,,,,make my breakfast this morning i,gon what you,follow that,,,,,give your skin,,do this summer,do on the outside like little brown part,make the flavors,start a friendly competition with someone when i,go ahead,doe smell really nice,,make it for the following week,apply some lotion,check out my,increase the circulation to the area,add something fresh,use every single day,,,,watch that when i,,make my life,,,,,,make you,clean up the makeup,dry a tea powder you,
use i,go ahead,,,,do a quick,have the protein in it it,,sprinkle shimmer i,,make sure you,,start by,dry out,make this dollar tree diy lavender wreath in a recent video,add frozen banana or a scoop of peanut butter for an extra protein,,get better another goal of mine with this space,fits really well,make them longer or shorter,make a like vegan umm what like a margherita pizza,drink with meals,eat on a chilly fall evening,blend that all together once that,,,,make 3d green obviously,,,make tonight,,go around,drink this much tea just fyi i with mint which,alloc just some time,,hope you guys,,,,,,,,do a video on that then,works great for the,start by,,umm if you also,,use it,,work on my table manners,make the bags,face lots of toothpaste,,,,keep it at night,see oh i,try this healthy food first,,,,,head into my bedroom i,go through this day,,leave my jewelry,,look with a mask they,sent you,,show you what i,,come with two valves,tastes i,,,,thank you,,,use any berries you like you,crush on my dollar store microfiber mitt,,,talk about the best product to clean stainless steel,,find people,,,,,,,work on projects,play ball with them these quick,do kind of like my normal thing i,,compile everything together i i,,,obsess with lately,,use it,look delicious,,take a shower,,sit out maybe,stain i,,brush my hair i,get up-to-date with what my favorite youtubers,,,,,run out way before the rest of the actual shampoo,,,,use some scale moisturizer from honest beauty as well i,sit down breaks,take 17 minutes,,,,,look like i,,trust topper cones,do i,use another nut butter like almond butter peanut butter,start a competition with my mom,go for that more rustic feel,hope that that,,hope you guys,add water to,watch this video i what,grow straight out,cover the jar with a lid again,give it a thumb up,,,,watch netflix i,,wash my hair today i,,,,,,make you,bear with me as i,depend on the brand i,
smell amazing,order from them applause,,,,post there,tastes really similar to an oatmeal,,do too,,leave me,,blend what i,throw it away,flour you,add enough nutrients to kind of fill you up until your next meal if you,,grew up,make sure,show you a little bit about that in a second,have minimal ingredients,serve my day,hope you,make your whole house smell amazing i,,,,taste it baby spinach for the very subtle taste,,,cut them in half,,do in your house to clean,bake them then each cookie,decide i,,hope that it,,,,,,,,depend on how i,go now i,use a big tomato,,go out to this at the end of this month,,got some cucumbers as well,,come a long way then we,get some shots of kind of like me like,catch you guys soon no it never,,,,blow it out,starve it,tell myself like oh i,,,,,get it together what,deal with it every day,,go through whenever i kind of,,give you like all the roll ones like the eye bag roll-on,,,shower you guys i always,,,put some fresh herbs a some parsley from the garden olive oil i,,,,stays nice,,,put a link below of all the ingredients,slow down,,,rave about this product,,allow the eggs,,,,,,,make your house feel,play ball with them these little cuties,get out i dry his hair we,,set aside the veggies,,,use the set day then,,keep in your pantry i,give it that nice this,,put on this healing,,sit in a little acrylic ador that kind of just,got it,,end up with blond hair all over the carpet like i,make breakfast,,,,,leak out,,,,use honest beauty hydrate mist as a toner sometimes a huge growth water instead,tell that kale,see how long it actually,,,,,base on your age range,,,blush i,go well with strawberry,shares the same goals with you really,show you throughout the video how i,fall out right now,,bookmark it you,put together a pregnancy safe mask for me that i,thank you,look like with one coat of mascara it,use banana slices that,,,,,,,do in the shower next thing i,,,,,,wake up honestly,looks greasy,guess the one that i,
do just,use my,,,,move on to my table i just i,focus on the things that just,,do too much,,,,scrape the bottom of the pot here,do it,clean the walls as well,try any of these i,,turns into wildflowers i,make sure if you,cut at home depot,take it inside oh,drink more water or both,work really great in here,pack with omega-3 omega-6 they,,,,finish it off,,,do that i,,hope you,gluten dairy,do everything although in the come weeks it,,add a nice touch to it i,,,,,,,,use a styling spray in my makeup,do some of the things i,,,receive the health net nutrition monthly newsletter in your inbox,,pack a larabar with me,,give a really airbrushed look now i,do that then i,looks like this right applause you,,,,do it like that where it or i,boil or steam that i,start over here on this end with some mushrooms i,,,,,wake up at 4:30 a.m. for work every day,deal with it,,wipe that down as well another thing,,put it right in,,,do a girl,,,stays nice,,,,break down,,,try it out,show you more cleaning tips maybe a deep clean of the kitchen or the bathroom,,,catch all the spills in your oven,,make for more time,,,,,,,come at a price people i,,use with a lotion on your legs on your feet also,,eat it like this i,,,got below it,,post once a week on sundays,call it,,come home i,,mention before i,get a chance to,,check out my last video it,get hungry,,,,,use this for quite a while i,,,,use a bunch of them lately,eat that hard stone,take me,,,,,look for in your skin i recently,,,make me,contain whole carbs good protein,make your water a little bit more special now in terms of physical fitness one tip i my morning routine you,found this wood for a few bucks at michaels,work more as a team than before,,give this video a big thumbs up,go to bed on the earlier side i,see you guys in my next video bye,lash serum this stuff,balanc with good carbs protein,,,,,,,drew my makeup some days it,,,,,,do this what i also,wear in most of my recent videos,add ice when i,
drop on the stove no matter how careful you,search for,,,,give their cast from pillar,subscribe to my channel,,use this mac that,,,,waste any,use this on yourself you,make sure,throw them in the fridge already in a takeaway container,,finish on spotify,mark i,go back,take it inside what,start a new program on fitness blenders website,,point out you,,,,find it,,,drink it while i,,hope you guys,measure out the batter,start it off on the right way possible,,thank you,,,,,,,,put all of my homework that i,carpet areas it,,,suppose my blog right here you,,curry powder,,come in here,film it i,leave it a thumb up,,,,make it,eat that,transfer these to a brown paper bag,,,,,help with the overall,do okay,,belong also on the surface thing,,roll on,,,doe it,,,throw that on the barbecue i already,,,,do i,,,balanc out your sugar levels,take your time,,,deal with all the smoke,,take our cook eggs,,,,,,,see it,,go to bed,,garlic mm-hmm,,,get similar results,,watch i,serve recipe i,,,,write it down as well,sell these in the shop i,,link to another one as my cleaning videos,post recently,,,,,do really it,,,,sponsor by on a cd or the honest company by the way i,come over this way,do all of your makeup in 25 minutes each day,,,,,gone into my 30s i,,,do with the highlight portion i i never,depend on my mood,get points for each video that we,stain them sirens in the background gardening,use i,,thank you,leave that,poach mine for about three minutes that way,add a little bit of jojoba oil,give you 413 calories without the toppings,,,,,,,do the proper,,,,,,make a cup of green tea,film schedule,find it better,
go ahead,get probably 90 % of my cleaners on the grove collaborative website,,,,walk away from me i i,notice some people it,,gon much day okay i,,,,see as we,sit in our garage i,take me back now one tip that i,make them the night before,,improve so for me i,take a pencil,get the items at home depot now what i,tastes like regular yogurt it,looks like when i,,stir it up,,,,eat them all the time at the moment i,,,work either way i,,make one,make anything fancy,leave a link to another one of my videos,,make a christmas tree bucket list of your own i,,,,,,,,leave it down it really,look with this house i,,,sign up over on my blog,,eat lunch,,do we,make sense i,,,,,,put some nutritional yeast,use these,,,,,suppress melatonin production which,get those hungry days for a reason,,throw rug i,,get that diffuser,,,frozen in this little ziplock bag,,,depend on how you like it,,,,use though,,,find the taste,leave it a thumb up i,,,leave this one a thumb up,,serve plate if you,,,,,,,show it,,find these at the body shop these great for up on your bum,,appreciate it,,,use your favorite,,get a notification when i,watch i,,,,wake up the next category,found it at my local nursery,,cleaning things i,play some christmas music while i,,,,,push it in the water,,,,switch up the products,get some love just,sort from the night before,,,,,go into a little bit more detail of this treatment on my blog,,,do it,add generally,help it,give it that kind of rustic feel i,eat right now parenting style,,print it,,mean it,make one of my 2015 resolutions to plus every single night no matter what,watch this video i really,,,,,,,plan out that morning,,,,,,get ruin by the constant brushing,watch my channel,find you,
