,,1p0_5mini_6.mp4,give all of her ball tonight amends i
,,1p0_5mini_6.mp4,mention in my hair video my hair
,,1p0_5mini_6.mp4,give that to him as far as me right now the only thing i
,,1p0_5mini_6.mp4,do you
,,1p0_5mini_6.mp4,give him those
,,1p0_5mini_6.mp4,get extremely thin
,,1p0_5mini_6.mp4,look like we
,,1p0_5mini_6.mp4,ask for those he
,,1p0_5mini_6.mp4,show it here
,,1p0_5mini_6.mp4,call special juice
,,1p0_5mini_6.mp4,show it on instagram
,,1p0_9mini_4.mp4,get lots of smudges
,,1p0_9mini_4.mp4,take me the longest in the day now
,,1p0_9mini_4.mp4,use this for the bathrooms as well
,,1p0_9mini_4.mp4,use before although i i
,,1p0_9mini_4.mp4,turn on to this
,,1p0_9mini_4.mp4,clarify even though i
,,1p0_9mini_4.mp4,clean the entire kitchen every single day i
,,1p0_9mini_4.mp4,put away the kitchen sink
,,1p0_2mini_7.mp4,do every day
,,1p0_2mini_7.mp4,prevent dry lips i
,,1p0_2mini_7.mp4,seem like it
,,1p0_2mini_7.mp4,take a long time
,,1p0_2mini_7.mp4,use it for years
,,1p0_2mini_7.mp4,keep it pretty simple as well i usually
,,1p0_2mini_7.mp4,get this
,,1p0_2mini_7.mp4,do for the day for a night time i
,,1p0_2mini_7.mp4,take my shower at night when my kids
,,1p0_6mini_7.mp4,sleep with wet hair especially in the winter months which i
,,1p0_6mini_7.mp4,help it from
,,1p0_6mini_7.mp4,understand you
,,1p0_6mini_7.mp4,fall asleep my hair
,,1p0_6mini_7.mp4,blow-dry it
,,1p0_6mini_7.mp4,wake up the next morning my hair
,,1p0_6mini_7.mp4,go as
,,1p0_6mini_7.mp4,throw a baseball cap on if it or i
,,1p0_6mini_7.mp4,hope you guys
,,1p0_9mini_9.mp4,bake soda from mrs. myers you
,,1p0_9mini_9.mp4,get pretty dirty
,,1p0_9mini_9.mp4,do it once a week if possible
,,1p0_9mini_9.mp4,reach for when it
,,1p0_9mini_9.mp4,get pretty dirty i
,,1p0_9mini_9.mp4,make a difference
,,1p0_6mini_1.mp4,share with you a few things that i
,,1p0_6mini_1.mp4,ask what i
,,1p0_6mini_1.mp4,do an updat haircare routine a lot of you
,,1p0_6mini_1.mp4,share with you a few thought i
,,1p0_6mini_1.mp4,add the vital proteins marine collagen to my green tea a few months ago
,,1p0_6mini_1.mp4,add the two of those together
,,1p0_6mini_1.mp4,start first with what i
,,1p0_6mini_1.mp4,use for a while i
,,1p0_6mini_1.mp4,drink it occasionally i
,,1p0_6mini_1.mp4,add some hot water i usually
,,1p0_6mini_1.mp4,look soft
,,1p0_6mini_1.mp4,sweeten my tea or anything like that i just
,,1p0_6mini_1.mp4,drink it in the morning with my green tea
,,1p0_6mini_1.mp4,drink green tea every single morning i
,,1p0_5mini_14.mp4,go over products i
,,1p0_5mini_14.mp4,smell good the products often
,,1p0_5mini_14.mp4,get myself a little facial
,,1p0_5mini_14.mp4,go that
,,1p0_1mini_8.mp4,yeah just like some fresh flowers
,,1p0_1mini_8.mp4,hope you guys
,,1p0_1mini_8.mp4,sleep with the wet head
,,1p0_1mini_8.mp4,get a good night sleep
,,1p0_1mini_8.mp4,built like a little nightstand i
,,1p0_1mini_8.mp4,blow out the candle before i officially
,,1p0_1mini_8.mp4,sleep through the night
,,1p0_1mini_8.mp4,roll with the punches
,,1p0_1mini_8.mp4,blow-dry my hair
,,1p0_1mini_8.mp4,cross my kids
,,1p0_3mini_5.mp4,see anything that
,,1p0_1mini_2.mp4,finish up
,,1p0_1mini_2.mp4,try in terms of it
,,1p0_1mini_2.mp4,move my bath tray
,,1p0_1mini_2.mp4,burn his eyes
,,1p0_1mini_2.mp4,complain about that i
,,1p0_1mini_2.mp4,head back
,,1p0_6mini_3.mp4,go down
,,1p0_6mini_3.mp4,weigh it down if i
,,1p0_6mini_3.mp4,find that it
,,1p0_6mini_3.mp4,aim the nozzle downward i
,,1p0_6mini_3.mp4,make my hair
,,1p0_6mini_3.mp4,do my hair in the daytime i usually
,,1p0_6mini_3.mp4,go on top
,,1p0_3mini_2.mp4,get them
,,1p0_3mini_2.mp4,support as always
,,1p0_3mini_2.mp4,relieve any tension or discomfort in my lower abdomen
,,1p0_3mini_2.mp4,affect people to different degrees i personally until after i
,,1p0_3mini_2.mp4,do a light
,,1p0_3mini_2.mp4,stretch when i
,,1p0_3mini_2.mp4,stretch just
,,1p0_3mini_2.mp4,go to a boot camp class
,,1p0_3mini_2.mp4,get really bad ones
,,1p0_3mini_2.mp4,do an at-home workout i
,,1p0_2mini_3.mp4,expos this
,,1p0_2mini_3.mp4,get out of the shower i
,,1p0_2mini_3.mp4,put it on my arm my chest obviously if i
,,1p0_2mini_3.mp4,use my kp duty derma dr
,,1p0_2mini_3.mp4,dry i
,,1p0_2mini_3.mp4,got these for my body
,,1p0_2mini_3.mp4,resurfac pads i
,,1p0_2mini_3.mp4,improve while the mask
,,1p0_2mini_3.mp4,go ahead
,,1p0_5mini_13.mp4,hear you
,,1p0_5mini_13.mp4,make videos that
,,1p0_5mini_13.mp4,ask me about that as well
,,1p0_5mini_13.mp4,take 10 times as long as a video on this channel
,,1p0_5mini_13.mp4,hear comments
,,1p0_5mini_13.mp4,do this that you just alright sometimes i
,,1p0_5mini_13.mp4,take 10 times more money
,,1p0_5mini_13.mp4,produce stuff on my own
,,1p0_5mini_13.mp4,get bore
,,1p0_5mini_13.mp4,make videos on my music channel
,,1p0_5mini_13.mp4,start my youtube channel i
,,1p0_5mini_13.mp4,align with what
,,1p0_5mini_13.mp4,do what i
,,1p0_5mini_13.mp4,share that on my youtube channel
,,1p0_9mini_10.mp4,use this method daily shower cleaner even though i
,,1p0_9mini_10.mp4,make it
,,1p0_9mini_10.mp4,happen a long time ago
,,1p0_9mini_10.mp4,use it every day i
,,1p0_9mini_10.mp4,use a
,,1p0_9mini_10.mp4,squeegee every day
,,1p0_9mini_10.mp4,clean once a week i or i
,,1p0_9mini_10.mp4,make it
,,1p0_9mini_10.mp4,make that a habit i
,,1p0_9mini_10.mp4,use this once a week
,,1p0_5mini_4.mp4,get into a new groove
,,1p0_5mini_4.mp4,sleep through the night when i
,,1p0_5mini_4.mp4,get there
,,1p0_5mini_4.mp4,have chunks in it which i
,,1p0_5mini_4.mp4,wake up two times in the middle of the night still i
,,1p0_5mini_4.mp4,snore in the other oh my goodness
,,1p0_5mini_4.mp4,get into a groove with too
,,1p0_5mini_4.mp4,oppose to
,,1p0_5mini_4.mp4,get a ton of sleep
,,1p0_5mini_4.mp4,cut in half
,,1p0_5mini_4.mp4,slept through the night
,,1p0_3mini_8.mp4,start your period
,,1p0_3mini_8.mp4,get ready
,,1p0_3mini_8.mp4,serve you
,,1p0_3mini_3.mp4,take a supplement internally
,,1p0_3mini_3.mp4,make a magnesium lotion bar which
,,1p0_3mini_3.mp4,stick it in the refrigerator
,,1p0_3mini_3.mp4,make several lotion bars on my channel before
,,1p0_3mini_3.mp4,keep it at room temperature
,,1p0_3mini_3.mp4,come by
,,1p0_3mini_3.mp4,add essential oils once i
,,1p0_3mini_3.mp4,throb one thing that
,,1p0_3mini_3.mp4,list below i
,,1p0_3mini_3.mp4,allow it
,,1p0_3mini_3.mp4,talk to your doctor before you
,,1p0_3mini_3.mp4,cool down
,,1p0_3mini_6.mp4,make me
,,1p0_3mini_6.mp4,veggie broth i
,,1p0_3mini_6.mp4,find that that
,,1p0_3mini_6.mp4,go for
,,1p0_3mini_6.mp4,add lots
,,1p0_9mini_1.mp4,custom my order
,,1p0_9mini_1.mp4,grow of collaborative they
,,1p0_9mini_1.mp4,adjust the ship day
,,1p0_9mini_1.mp4,spend the most time in realistically it
,,1p0_9mini_1.mp4,spend some time every day on cleaning
,,1p0_9mini_1.mp4,share with you guys
,,1p0_9mini_1.mp4,work out really nice
,,1p0_9mini_1.mp4,offers eco-friendly
,,1p0_9mini_1.mp4,carry a lot of my favorite brands like mrs. myers
,,1p0_9mini_1.mp4,save me a trip to the store
,,1p0_9mini_1.mp4,commit to one particular thing
,,1p0_9mini_1.mp4,focus on rooms that we
,,1p0_9mini_1.mp4,sent to my door once a month
,,1p0_3mini_7.mp4,recommend plus even if it or you off it
,,1p0_10mini_5.mp4,see it
,,1p0_10mini_5.mp4,watch friends that
,,1p0_10mini_5.mp4,blow-dry my hair
,,1p0_10mini_5.mp4,drink it in the end of my third trimester it
,,1p0_10mini_5.mp4,check out my last two videos
,,1p0_10mini_5.mp4,see you guys in the next one
,,1p0_10mini_5.mp4,prepare it for childbirth i
,,1p0_10mini_5.mp4,check with your doctor of course before
,,1p0_10mini_5.mp4,do on most nights it
,,1p0_10mini_5.mp4,suppos to tone your uterus
,,1p0_10mini_5.mp4,do while i
,,1p0_3mini_9.mp4,look into them
,,1p0_3mini_9.mp4,talk a lot more about cbd
,,1p0_3mini_9.mp4,recommend for pain
,,1p0_3mini_9.mp4,find us on instagram at pacific time we
,,1p0_5mini_5.mp4,come out with isaiah
,,1p0_5mini_5.mp4,keep them alive i still
,,1p0_5mini_5.mp4,get a good workout in then a manicure pedicure
,,1p0_5mini_5.mp4,care that the ones he
,,1p0_5mini_5.mp4,balanc that between the two of us
,,1p0_5mini_5.mp4,fit he
,,1p0_5mini_5.mp4,rely on me
,,1p0_5mini_5.mp4,see what her name
,,1p0_5mini_5.mp4,prioritize that
,,1p0_5mini_5.mp4,got a manicure pedicure in a really long time
,,1p0_5mini_5.mp4,get stronger
,,1p0_5mini_5.mp4,fit like perfect
,,1p0_5mini_5.mp4,cut significantly
,,1p0_5mini_5.mp4,get a sweat
,,1p0_3mini_10.mp4,watch i
,,1p0_3mini_10.mp4,give you some ideas
,,1p0_3mini_10.mp4,lift your spirit
,,1p0_3mini_10.mp4,make you
,,1p0_3mini_10.mp4,see you guys very soon in the next video you
,,1p0_3mini_10.mp4,hope that this video
,,1p0_2mini_4.mp4,use the masks you
,,1p0_2mini_4.mp4,tighten the skin
,,1p0_2mini_4.mp4,use my vitamin c peel pad the vitamin c peel pad
,,1p0_2mini_4.mp4,gauge how sensitive your skin
,,1p0_2mini_4.mp4,make sure that if your skin you
,,1p0_2mini_4.mp4,call wrinkle revenge that
,,1p0_2mini_4.mp4,keep an eye out for that
,,1p0_2mini_4.mp4,have hyaluronic acid in it
,,1p0_2mini_4.mp4,peel pad after about thirty seconds or
,,1p0_2mini_4.mp4,use them directly after
,,1p0_2mini_4.mp4,brightens lightens
,,1p0_2mini_4.mp4,obsess with them for a few years now they also
,,1p0_2mini_4.mp4,do with that then i
,,1p0_5mini_9.mp4,do me
,,1p0_5mini_9.mp4,watch them
,,1p0_5mini_9.mp4,grown i
,,1p0_5mini_9.mp4,figure out what you
,,1p0_5mini_9.mp4,watched kids when i
,,1p0_5mini_9.mp4,mean like you you kind of stay out of it
,,1p0_5mini_9.mp4,do it
,,1p0_5mini_9.mp4,chang with oliver
,,1p0_5mini_9.mp4,chang i
,,1p0_5mini_9.mp4,throw tantrums
,,1p0_5mini_9.mp4,tell you when i
,,1p0_5mini_9.mp4,have it everything still he he
,,1p0_5mini_9.mp4,work as a team
,,1p0_4mini_1.mp4,act as a really nice primer
,,1p0_4mini_1.mp4,find that it
,,1p0_4mini_1.mp4,get ready for a holiday party
,,1p0_4mini_1.mp4,start first with my you i really i
,,1p0_4mini_1.mp4,share with you guys
,,1p0_4mini_1.mp4,share with you guys what i
,,1p0_4mini_1.mp4,got glam
,,1p0_4mini_1.mp4,get a little glam
,,1p0_4mini_1.mp4,put that on
,,1p0_4mini_1.mp4,go ahead
,,1p0_4mini_1.mp4,do a quick video i
,,1p0_4mini_1.mp4,use to
,,1p0_3mini_1.mp4,follow my blog i recently
,,1p0_3mini_1.mp4,start with the first thing kerbal tea i
,,1p0_3mini_1.mp4,do around that time of the month
,,1p0_3mini_1.mp4,share that
,,1p0_3mini_1.mp4,find something from the store the next thing
,,1p0_3mini_1.mp4,stretch routine i
,,1p0_5mini_15.mp4,clean my skin
,,1p0_5mini_15.mp4,give myself a little facial
,,1p0_5mini_15.mp4,go on my day
,,1p0_5mini_15.mp4,thank you guys for questions there
,,1p0_5mini_15.mp4,do more of these videos
,,1p0_5mini_15.mp4,see you guys in the next video bye
,,1p0_8mini_1.mp4,have a light tint
,,1p0_8mini_1.mp4,got it down to five minutes my makeup look
,,1p0_8mini_1.mp4,doubl as a concealer
,,1p0_8mini_1.mp4,help me
,,1p0_8mini_1.mp4,exit the shower i i really like this
,,1p0_8mini_1.mp4,get a lot of sleep these days
,,1p0_8mini_1.mp4,stay pretty consistent over the years i
,,1p0_6mini_4.mp4,work out
,,1p0_6mini_4.mp4,wash my hair
,,1p0_6mini_4.mp4,wash my hair every single day i
,,1p0_9mini_8.mp4,do it once a week you
,,1p0_9mini_8.mp4,mop i also
,,1p0_9mini_8.mp4,get dusty really easy i
,,1p0_9mini_8.mp4,try to dust
,,1p0_9mini_8.mp4,mirror usually in the bathroom
,,1p0_9mini_8.mp4,clean the
,,1p0_9mini_8.mp4,do once a week
,,1p0_9mini_8.mp4,keep the dust away which
,,1p0_4mini_8.mp4,wear a repeat outfit i
,,1p0_4mini_8.mp4,go like dancing
,,1p0_4mini_8.mp4,dance for a little bit
,,1p0_4mini_8.mp4,got out of the sun
,,1p0_4mini_8.mp4,share with you guys what i
,,1p0_4mini_8.mp4,wear a short skirt i no shame
,,1p0_4mini_8.mp4,worn this skirt before on my channel
,,1p0_4mini_8.mp4,yeah we
,,1p0_4mini_8.mp4,come home
,,1p0_4mini_8.mp4,do for my hair
,,1p0_4mini_8.mp4,hope you
,,1p0_4mini_8.mp4,see you guys very soon in the next one
,,1p0_4mini_8.mp4,go with the shoes that
,,1p0_4mini_8.mp4,go to a party real quick that
,,1p0_8mini_2.mp4,blush i
,,1p0_8mini_2.mp4,make my routine a little quicker
,,1p0_8mini_2.mp4,blush which
,,1p0_8mini_2.mp4,provid really good coverage
,,1p0_8mini_2.mp4,use this
,,1p0_8mini_2.mp4,blush as well
,,1p0_8mini_2.mp4,go back
,,1p0_8mini_2.mp4,look but i
,,1p0_8mini_2.mp4,hits i
,,1p0_8mini_2.mp4,have a bronzer a really pretty highlighter
,,1p0_5mini_12.mp4,see if there
,,1p0_5mini_12.mp4,get it together
,,1p0_5mini_12.mp4,go with the season of my life like right
,,1p0_5mini_12.mp4,do around my house right now
,,1p0_5mini_12.mp4,switch up the kind of videos you
,,1p0_5mini_12.mp4,make yeah i
,,1p0_5mini_12.mp4,figure it out we
,,1p0_5mini_12.mp4,mean i
,,1p0_5mini_12.mp4,go on my life
,,1p0_5mini_12.mp4,move into a house a few years
,,1p0_5mini_12.mp4,do you
,,1p0_5mini_12.mp4,start a garden there
,,1p0_5mini_12.mp4,figure it out
,,1p0_5mini_12.mp4,start things up
,,1p0_5mini_12.mp4,do everything new
,,1p0_5mini_12.mp4,leave house much i
,,1p0_1mini_7.mp4,keep it really simple the shampoo
,,1p0_1mini_7.mp4,get those at target i
,,1p0_1mini_7.mp4,get to bed sometimes i just
,,1p0_1mini_7.mp4,throw my hair in braids
,,1p0_1mini_7.mp4,get a new pair every time
,,1p0_1mini_7.mp4,keep my body really
,,1p0_1mini_7.mp4,use those forever
,,1p0_1mini_7.mp4,do my grove order every month
,,1p0_1mini_7.mp4,get a new forever
,,1p0_1mini_7.mp4,order when i
,,1p0_1mini_7.mp4,do every single night depend on how tired i
