4p1_4mini,4p1_1mini,7p1_8mini,9p1_3mini,2p1_9mini,4p1_3mini,5p1_1mini,10p0_3mini,8p0_9mini,9p0_5mini,2p0_7mini,10p0_9mini,9p0_9mini,1p1_4mini,7p0_6mini,10p1_3mini,10p0_8mini,1p0_1mini,1p1_6mini,1p1_8mini,2p1_10mini,2p1_1mini,5p0_10mini,5p0_9mini,2p0_5mini,2p0_3mini,2p0_2mini,8p1_2mini,5p0_3mini,9p0_2mini,8p1_10mini,10p0_7mini,6p0_8mini,8p1_8mini,6p1_8mini,5p1_9mini,4p0_8mini,3p1_5mini,1p1_5mini,2p1_3mini,7p0_4mini,9p0_7mini,3p0_4mini,6p1_4mini,3p1_1mini,1p0_9mini,8p1_6mini,9p1_2mini,10p1_1mini,2p0_4mini,2p1_7mini,5p1_3mini,5p1_6mini,6p0_4mini,7p0_5mini,8p0_10mini,7p0_9mini,6p0_9mini,1p0_6mini,2p1_4mini,2p0_6mini,9p1_8mini,1p1_2mini,7p0_8mini,6p1_7mini,5p1_2mini,8p1_5mini,1p0_4mini,6p1_9mini,9p0_4mini,4p0_6mini,3p1_2mini,9p1_5mini,8p0_6mini,9p0_10mini,1p1_10mini,10p0_5mini,4p1_6mini,3p0_1mini,9p1_1mini,4p1_2mini,10p0_4mini,9p0_8mini,10p1_2mini,7p0_7mini,5p0_1mini,10p0_6mini,7p0_2mini,1p1_7mini,10p1_4mini,2p0_10mini,7p1_5mini,6p0_10mini,7p1_2mini,9p0_6mini,10p0_10mini,7p0_10mini,8p0_4mini,1p0_10mini,9p1_6mini,5p0_2mini,6p0_5mini,9p1_7mini,8p0_8mini,8p1_9mini,2p0_9mini,10p1_7mini,8p1_4mini,3p1_6mini,4p1_10mini,6p1_6mini,1p1_1mini,2p1_6mini,6p0_1mini,8p0_7mini,7p1_7mini,7p0_1mini,2p0_1mini,4p0_4mini,6p0_7mini,4p1_8mini,10p1_5mini,6p0_6mini,8p0_1mini,2p0_8mini,6p1_1mini,10p1_6mini,8p0_5mini,5p0_4mini,8p0_3mini,1p0_2mini,2p1_5mini,9p1_4mini,3p0_2mini,8p1_3mini,5p0_6mini,1p1_9mini,1p0_5mini,7p0_3mini,10p1_10mini,5p1_10mini,10p1_8mini,5p1_5mini,8p1_7mini,5p0_8mini,9p0_3mini,6p1_2mini,9p0_1mini,6p1_5mini,5p0_5mini,6p1_10mini,7p1_4mini,4p1_5mini,6p1_3mini,2p1_8mini,10p0_2mini,8p0_2mini,1p0_8mini,8p1_1mini,7p1_10mini
clear off the counters next,head out to montana tomorrow for a few weeks just,show a grammer your knee,add our rain i,reduce cortisol,go through we,make this i,make kala hama salad,meant to you,drink the almond milk,replac the tuna with chickpeas,hope you on one of your next salad creations,left over in my fridge which,help with his breath the only thing,get more he,eat out of the bowl of nuts,chop the herbs beforehand just,go to bed,get isaiah room,sell galvanized piping,swear i,do today,put the rice at the bottom of our bowl,make this insanely delicious mango salsa it,set them aside,chop up in one clove of garlic,add more plant-based snacks,miss two nutrients,cool pasta into a bowl,see there,taste a little bit salty,make our cheeseless parmesan you,do an alright job,make strawberry or bernards,get ready brushing my teeth,help me i,take whatever color paints you,make it more flavored or dinner i usually,do that splinters,got already,come right off if you,run out to the store last-minute,do it,do that anywhere in the house really,gon to sadie i,take this,save some for lunch today,tcj sorry,take that out,use the shredded kind,go to my first lab for my chemistry course that i just,froth up about two ounces of milk i,freakin now next i,lose my voice,do this this,look scary look how much that this,love around christmastime oatmeal brown sugar,build up on bench tops which,head out,get a bunch of ingredients,got back from the grocery stores in my saturday morning grocery shop,get new backpacks,make a diy natural surface scrub this,do it,clean water,strand on mars,learn how,side brush for,chang up your cleaning routine,chop walnuts or pecans,blend it,make amazing videos that his channel,take it out,give you a second,see you next time bye yummy yummy,got it i,have really,go ahead,hate then i,split it up into smaller portions,go all day long i,check them out basically,use later to thin out your sauce,take my raw almond butter at least i,stick my cellphone,run out,use parts if you really,soak for about 1 to 2 hours,go to steam your ingredients until they,throw together first thing in the morning,eat greens,nap anymore,fight the dark,add any embellishments you or even fruit then you,spent hours on the phone with me,go that extra step further i,make your whole house,do it then,go after i,have such an unique texture,cut in half to that,meant that there,tell me in the comments below what,call it essential sometimes i,add that little pop of flavor now i,watch my channel you,start off with the medium size pot,make it for a couple of years now,sound kind of,tell the sun,re-think out your entire outfit that just,secure the dinosaur i,do those two things,go there next to this grey one,excit about everything christmassy you,do it on a dime here in this episode of cooking with car,get rid,got zinc,do just like,get from kmart for like five dollars,got home from school,add in a frozen banana it,build up,do that,take the longest,pop on,pancakes it,spend two minutes on this,sustain energy plus it,improve your mood,mind that,clove all stuff i usually,entertain your kids for a lot longer these,tell i just,pop that on to the store for another few minutes anyway from 5 to 10 minutes,start your day off with a green bowl think of this as the lovechild between a green smoothie,have a much more rustic feel which i,break out,got a big tub or a bad,switch up the ingredients,get a free gift,skip this step since the avocado,starts with a full-on session of,make overnight oats,set everything aside on a separate plate,stick in the kids backpack again washable,check out my instagram if you,depend on how tart your fruit,let you,make sure,come up in the new future for different people,work too much this,make me crazy in that good way,head straight to the couch the first thing that i,hey everyone,make a little bit extra,share the specific morning routine that i,end up under my eyes by the end of the day as much as this one,share with you guys a couple of what i,show that in the ink oh here we
prep earlier in the day,visit family,do it,rotate your stick a quarter of a turn place,increase estradiol which,end up on my channel,make regular quinoa,have an amazing youtube channel here on youtube,turn around after the toothpaste episode okay i,,take the can of chickpeas,be creative with your blender,stir all right now a,have his ways,give me a clean slate,collect spirit just,add in all the ingredients,go down before we all,share with you guys a few things i,see a lot of this type of thing on etsy,do with work what better feeling than,eat in a day,do you just,bring you another food video,go to steam the sweet potatoes in the microwave i,chop broccoli,get home from work these,show you what i,add a bunch of veggies,give it one more quick,add a huge amount of sweetener,show you guys how italian seasoning onion powder,leave my makeup everywhere,use other fruit like blueberries apple or banana i always,make me,take several supplements during the day,find them at any other craft store like michaels joanne or possibly even walmart,go to bed,do this,taste it at all all you,find these at the hardware store or even the dollar store,make the same five recipes every week monster again,put a plaid shirt,write my to-do list for the day i,grew enough for me,use gloves i also,make grilled chicken for dinner last night,do yet,find it just kind of matches up the banana really good,show you these three healthy breakfast recipes for my first healthy breakfast recipe i,meet for the lab,receiv a custom,use alpha lipoic acid,get down to the lip products,obsess with these,look really natural next thing i,keep it real first i,drive me insane,drop that kind of cash on shampoo,come up with whatever i,remove kind of like those extra little things that still,do we,make for a really easy diy all-purpose cleanser next i,make the whole kitchen smell awesome by,go ahead,exercise a few hours before bed,eat in a day,look nice,do these things,call peanut butter,ease gas,talk to him he,take it a step farther,call back into bed,share with them them yes probably since that,use it i personally,meet her,grab my steam,see like the it i i,get denser,do like much of an include the only thing i,use these gluten-free crackers by mary gone crackers they,add just a splash in my click liquid,work really good just,inspire at the dollar section at target they,see me,put onto your salad i,grate that,come soon,find out what my quick,chop scallions,waste money,fall down on my knees up in,go through,dawn on me that i,post this,help your space,give you guys a tutorial i,doe grocery shopping,warn you it,help out my channel,live in brisbane i,bring a little bit of the beach home with you without the mess it,do for my skin in the morning,use protein to the smoothie you,add a beautiful natural green color to pretty much anything you,use just a regular cheese grater first you,make this recipe,recommend it,gone down,wear it,keep the door open,eat in a day,make everything,get into the christmassy spirit around the holidays,freeze these,lost all my chances,leave it,got on amazon,moistur cleanser,make that day,make me like oatmeal i,float around,get ready something along the personal development line rob,make my lentils first they,do it whichever way that you like,finish nice,talk like like,pop these in the oven at 375 for between 20 to 25 minutes these,check out muscle skincare routine,get over a cold,talk about on my channel before it,lengthwise they,finish my mascara this,speed up the cooking time though you,focus on how you,do some more rustic type diys,take his naps,recommend this one we,work great in this recipe you,make fun of me,go tuesday on different ways,make a few days earlier,eat it,give these all a rough,wash out they clean love,find outfit,put them in whatever you,see the things that i,make your own chicken,add some new things to your morning routines,bottle name it okay there,come on girl we,look at my phone in the morning anymore,go to a place,go ahead,wash my face brushing my hair you,make my lashes,lost 40 pounds,look it
start the day fresh with an empty dish applause,figure i,thank you,look like this my nails,make with raw cacao,got out of school the day before i,give you sustained energy,call feb lunch i,got some it,,find these days some raw sunflower seeds salt,try them out,smell it,stick with the breath,do brain science,go back,dress into a mason jar or glass salad,make dinner at around five o'clock,do a few diys,make some galvanized piping wood shelve i,eat in a day,transit to that place for a while i,put the dish together by first,give this video a thumb up,use the stove or an instant pot,look amazing,make they,eat mostly plant-based foods,add some dates which,got my helper for the best part which,left out,know i,give my desk,depend on what kind of fruit i,doe the space,expos to that natural sunlight i,do a really light layer of paint on the front,call nut pods,,fool i,wear nice clothes either this,pick up ingredients,show you guys this,guess it just,sent you i,stick a lemon usually a use lemon down the disposal,put a link to it below this video if you,tell me in the comments below if there that you,sing now you,check that out okay,got out two two hours earlier than i,get this honey from my local farmers market,reduce some of the redness in my skin then on to my eye treatment it,put them on my snapchat,clean the bathroom on a budget i first,see the wood,eat with the boys this,do today i just,take showers at night,make some stuff up this,contain animal products,mean caroline it,works perfect with this you,shove it into one pile by the sink i even when we the keene,wipe up a little bit more,walk longer,help you,go a little too over the top with the filling in of the brows,do a deep clean,put my top on,try i,watch that,make these in a pinch,do that really quickly before i,do you,buy it your insurance often,link the recipe for it down below it,slash guest room,take us,make rainbow,figure i,make the base you,set i just,use the unsweetened,give you some easy,go to town once you,watch you,clean your oven what actually,theme skincare,put some of the sesame oil by spectrum right on here you just,add quinoa,hope that you guys,hear me tonight i just,put the lights,find ways,'cause i,do it on a dime with kathryn it since i,make me,read a few books,make this line with cornstarch pudding mix cake mix,see it more in the future,overwhelm with too much stuff,see this summer,call this a luxury or optional item for this i,make it a little sweeter it,use throughout all these recipes today,take the second apple,contain good carbs healthy protein and good fats as well so i,annoy that,check them out,get complic,use for the toothbrush holder,see you in my next video bye,do really quickly,chai tea,use fresh or thawed frozen spinach down some purple tea,got you in the head you,try as well,grate it the next thing you,get it here in australia i also,get a whole lot of things,thank her,do one for you i,take less than a minute,start with the thing that,have a concealer on one end,look like when it,do that day,give you,release endorphins in the body which it i often just my go-to 3-step skincare routine,apologize i,make hot oatmeal this time,start by,look like i,works too,add half an avocado this just,use love spells that,sleep through the night,love it something,bring it to you guys,play the game without,use my earth balance which,pop it in the microwave just for a couple minutes,sound fancy,start by,go my kindergartner you,do the night before,thank you my helper them right in here,do in the evening,get that mayo flavor,make my bed it,make sweet candy corn all you,take you out tonight,stay asleep which,thank you,stir it in the fridge for later i,achieve my weight-loss goal this,use the lip sense in sass easy someone,give you an example of what an ideal day of,do this on your own yeah paint a bottle and you
wake up it,hope you guys house before our trip,listen to you today we,wrap paper now for the fun part we,improv your mood,do any kind of always,make a quinoa port,watch hers after you,form it just there,,drain from the liquid,use parsley if cilantro,turn a nice golden brown which,find that they really,choose a music playlist with music between 120,sweeten um this one only,dress jar like this one,get that all,work on oliver room,cycl wood caddy i you you like home good sometimes,get in your car those oats we,eat a pretty much plant-based diet,make in a pinch it,use seasonal fresh ingredient,use oil,use frozen broccoli as a shortcut to leeks,do it okay,follow whether the vegan,slice in half,looks like when i now i,use frozen blueberries,recreate it,got rid of all the dust i,make it a little sweeter i,make the most out of this time,do this,look a little bit more uniform if i,decaffein road,,drink that,leave this overnight when you,shove in i,ask how i,lead to,comment in his comments that i,clean the kitchen sink i,give that a quick,moves it,go here,chop almonds a cup of sunflower seeds,do that,have the most incredible peach flavor to it,have vitamin c e,jelly beans,create an upstairs cleaning caddy if you,look pottery it still,got this from a friend at a holiday gift exchange next we,,mean a lot of knots,look good,buy there,ruin it for you guys,paste on anything that pretty much anywhere that you,give charlie 9 opportunity,moisturize i,start on dinner,get to the end of the day,have an eyeliner with like a,do these most days,make the first one,heard about,make sure,see you next friday bye guys,make me,watch guys,get it just,start off my mornings with this bamboo herbal coffee i,get those nice,clean up all that crusty foundation that,make a really cute party favor or gift if you,left over we,use a soft goat cheese in this case you,make my kitchen smell,use any milk that you like,help the whole room,add whatever your favorite,make this delicious sick kale salad recipe,bristle brush cleaning between the glass panes,do some fall,show you guys exactly how,give it that like salty kind of eggy flavor without the egg,give this a try i,get into,put in the freezer then tomorrow you,post these pictures to instagram about essential oils,slice some very ripe avocado and just place that,clear out all of the shoes that,do some all when i,share with you guys my current nighttime routine while i,got his seal of approval it,thumbs up button it really,clutter for example,give it a try,do it double,add healthy fats,have amazing nutrient benefits in it,give it a little,help me,obsess with this smoothie,watch grey anatomy since around the time that noah,sit out ready,do animal creatures in this case we,yeah i,lead me in to my next favorite thing,head straight into the bathroom,smell in pain pull,got time for perfect,set overnight in the fridge,use today i,repurchase this one again,take about 30 minutes or,matter i just um,hang a lot of my,appreciate it every day even if it,get all the ingredients,list in the description,pancak okay anyways for me it,eat it i,gluten free,fill with chemicals,do here i,eat in a day on a day that i,brought to you by copper cho,got this for my friend for a present which,chop whole almonds just,get a bikini body,buy a house that,chang my life,talk about,double this recipe,play on saturday august 6 you,do a healthy tip,store it,show you three really easy ways,look i just,start with snacks i,go i,get all those in there,recharge then,use can chicken,drink i,vary it up a bit you,drink some peters in your favorite bar,give it a thumb up,mark on the menu it,add a lot of flavor,use this routine all the time when i,do really like this one,take ass especiall shane today i,looks like this oh yeah
get everything,go throughout the rest of the house,go wow that,sprinkle then just,spikes insulin,go ahead,found these at my health food store,make these delicious lunch recipes,show you this look cuz i just,,make a vegan chickpea tuna salad,hope you guys,do that for the pasta,get into that,take a few minutes,take this one here,make sure to kind of roughly,leave a big mess for the next morning,move into my new house,see a lot of piping wood shelve i,go to whole foods after work her school every time i,consists of it,cook that all together then we,use seasonal fresh ingredients,help out the steam process,refine kind i,share with you three of my favorite afternoon snacks all three of these snacks,rain opinions about what kind of stuff they or plant-based,use for these lunches i,hiding in our mac,lose weight i probably,hop right into the recipe,have like sure i,soften its really yummy,get a bit of a move on with my day same with when i,protect my face,got these circle cutouts,take this medium dark,,go for something really quick,find these,do a great job at something i,head to the door,got something,do a school morning routine for 2017,bake soda,slice up this,see you next friday bye guys,take the end part,make my green free chocolate,do some yoga which,receiv this as a gift a while ago,call super moist which,snack away these like crazy all those jelly beans actually,clean really easy the after,discov it,do it on a dime with katherine today,,put a ball cap on,throw some stuff together,depriv myself i,look adorable on clothes especially,get those for free in my grove box every month i,get as much up as i possibly,lash it,starts around 5:30 with an evening,share about how i,use for years voluminous carbon black by l'oreal,tell me,,have a calming effect which,do too,make earlier that this or fuller alright guys this,do a quick workout honestly i,yeah you,try this particular one which i,add in some bamboo coconut sugar,go ahead,keep awkward,aim this snap of crabs ' um you,gone basically all day,get like a chunkier blended texture you,give it a try thanks for,link below,hidden away,make really tasty,use some curly regular kale here butternut squash cucumber celery green onion cilantro although you,take a dollar tree,add this to a double boiler or in my case i,spend time you,add some greens,save us,make sense of it all i just,get later then it,call rachelle,dress in last week video,clean the rest of the house i,do i always,start every night with dinner now i,give me this really nice consistency,share the video to more people,experienc both sides of too much stuff,go on vacation this summer it,groundbreak enosis,make a,make them super duper healthy,go in your one,make my absolute favorite go-to green smoothie recipe absolutely,come home from the bus usually i,turn on a show i,mean everything like absolutely every detail to your outfit,use this,,ignore the fact that i,starts with my morning routine i,tell you some super easy breakfast ideas,take this time,have over 20 antioxidants in it,follow by the super wash soda at this point i usually,take two seconds,go ahead,melt in the best thing,find myself,make sure that i,make baked potatoes,settle before i actually,finish i,take much time,eat oatmeal for breakfast for years,use the most,start by,do a little bit of maple syrup,promise they,go in with the sumptuous bold volume lifting mascara,serve it in a ball,look good in a bikini i honestly,make several basically with just a double boiler,start like,refresh your bathroom it,go right into the recipe you,look like now i,pop them right out of the toaster now,paste then into that i,make blueberry lemon overnight oats it,make enough for the entire week in advance,get creative with ice,pick outfits,taste it,go back to schools it to kind of start,chop that up as well now in a separate bowl we,share with you today,make all of the brown sugar stick,yeah you,use the black coffee pods i,call papi pizza,work perfectly with this dish,keep that on my nightstand then i just,look as even as possible,hope that it,show you my turkeys this
empty out,get some good cleaning motivation,stop we,create a clean edge,load with sugar,check them out they,have a mixture of complex carbs,watch this one,bear with me,,use the back of a fork next you,make my cilantro hemp,go right in here,put also a little bit of coconut oil in there,do you,dry cranberries whole,give it a quick pulse until blended,dress for bedtime pajamas,do something with chalk for oliver room as well,see caddies like this at flea markets,eat in a day okay,stick to a plant-based diet a hundred percent this year,make the entire meal in a little foil packet,mention this before,got them on amazon as a little christmas gift to myself,use this kind when i,take no prep time barely at all once you,eat in a day when i,found them on amazon for around 10,scoop in next i,seem strange,make it to i,go ahead,taste in other words just,set myself up for a perfect today these,get my vitamin d i,put all our bucket lists,get hungry before i,,go on my two mile walk,hold some of the product on those really really moldy spots then you when,find ways,watch my last video it,take time now,click in the i,mention this in my diy upcycle video,prep that i,watch how it,use a potato masher,show you how,finish my first day back to school kind of i,start i,moisturize i,eat away,do it on a dime today we,see that our friends,jump in the shower i,,work out if i or i,get away with,shop for a lot,denim next up for these super cool locker magnets what or some clear bubble stickers some scrapbook paper,use this for this,take longer than it,jump out of the shower i,wind down once i back home i,lose weight even when you,fill them in,do most days i,,curb those unnecessary cravings,go head over to his channel he,get all the air,gather my thoughts i,tell anyone our secret right okay okay deal secret right okay okay deal thanks for cooking with me today,pump milk i,give up coffee two years ago i,,yeah that,employ people,get a lots,try it out if you please,see you next time bye,use this for all my smoothies i which i,do another dime for this clean with me i,eat it i,make sure everything,open up the bottom of the oven drawer,keep your eyes out for more skincare videos,make a morning scramble you,squeeze on some more sriracha if you,leave a comment down below if you,drift away far away in the deepest of c the world,cross school,guess preschool in a little while rochelle,look cute with the shredded kale,post a cleaning,stalk we,cook with whatever we,link my homemade air dry clay recipe in the description below lincoln,hit that,got my own space in my own apartment i,see you next friday all right guys you,do it,obsess with,incorporate greens into all of those foods,give everything a little,lose weight this recipe,mess up,go ahead,take a little bit of time the night before,make sure,,go around,play rory boys,learn a full recipe down below i,see i,do this the night before,add in your oxy clean,fix that back up it,get everything,told me about,put away my,listen to an audiobook in the morning while i,do it,do you,pancak pumpkin poutine,make some tea or coffee for myself if i,make in advance,stay away from products that,give a little smoky smile,share with you what i,excit to dive in,extend play,add extra sweet another it just,reflect into the outside world,chop up,use before right now my skin,date your bathroom at the hardware store you,come from the can i,get on all my gear furs which,cut a picado,make this by,make them i always when i,look how pretty,sleep it,rush around,get some mangoes,do this at least once a week,chop your dry cranberries once the chicken,come the first thing that i,,take my car,complain it,got back a little bit ago from our big hike,dress now on the cabbage it,give myself a few minutes,use a lot,eat in a day,make them you
