measure anymore,do that i e cloth on all my stainless steel i,,,,deni i,leave any comment that,,help okay i,,,,see that the texture,use it at the for the bottom of his paw as much as he,do this weekly,run out the door sometimes,,plant it it,wear goggles,go ahead,got that,see what i,,try it next up,,,,go to an olive phase right now,,,drink it if i or else i,,do these kinds of videos,make me,start in the best way possible where i,,follow me on instagram,,,,,,,,finish my makeup next i,have black tile,,,receive that newsletter then all you,,starve by the time i,,call a tension comb,excit about i wer,,,,,,got one,doe i like that,,,,,dissolv oil on your skin,create certain nutrient so i,,grab my sponge,,diffuse that particular,,,make it,,,take a little bit longer i,,,,use my,,,chop up,,,,satisfying cleaning videos definitely,,sit here for a little bit couple minutes while you,,,,,,,make cleanup super fast when i,,do i,,come to the point where i,,,exfoliate every day i probably,,notic i,see you guys in the next video bye this,,,,look like,add pictures i,,add to you every day or every other day or weekly routine,put that on it,,,,,end up,,,,get that cooking on the stove while i,gon now it,yeah like i,,,,,show you guys what it,,,hit this gloves actually,works with certain flavors of fruit,have the most points wins,stain you,do you,,stick it on your fridge,,,apply my favorite,contain a lot of good nutrients which,,,,,,,leave a link to another one,,,,,,brush straight onto their skin,keep an eye out for new videos,use the rest of the banana,
ask if they,check out that link if you just,,,,leave this one obviously,sound cheesy,,set that concealer before the creases just a little bit on my t-zone area sorry i,,,,dry flakes you,use an old cut board that,use down below i also,found them helpful,,use it,do that,use the first half of the video,show you what i,put it in my water,,get like a jelly type of texture to them,,,,wrap these,,,add flavor to the chicken when two teaspoons of italian herb,,leave a link to another one of my videos,wake up if i just,get my day right,,see you in my next one,,,,,,,,leave that,go on how they,,,sign up it,,get the he chicken,,use a heat protectant spray then my crazy look hair tool this,upload it,,,,,,mix together,eat with his hands,,,,,avoid it,give you your body what it,,wipe it for my desk for some reason makeup,,put two drops of this,,,pre-prepped it,,,swear i,,,,go on vacation,,,defrost quite quickly since the oatmeal,,,,put out new content,,overcook our greens,,,,,,,make cleanup a breeze the next face i,,,,choose your luck i,,,found that this really,,use regular salt if you,slip my sister,,,,get all of my belongings,cover in frames,,give it a thumb up,start you,,,,,,,,,throw in my robe again,wilt it down,lay out from the night before again books bag handbag everything everything,,,,,increase collagen production in your skin,,,brush through brushes,let the second side cook for another minute or two,show you guys,show you in a second i,correct full coverage plus anti-aging serum from a cosmetics,,try it,,,stick to it,look pretty really,,,,,,,see you in my next one,,,,,,bristl on my skin,see my hair,use frozen fruit instead of,
do a quick,use a little bit of it,,,,live down in georgia,do after that,,use in pot i,,,,do that today,have significantly more power,mean if i,do if you people,,keep it really really simple i actually,get as close to the pencil,watch that video you,got ta,use for my lunch i,,tastes really good,,,,cut eight olives,,,drink at least eight glasses of water a day sometimes more if i,,check out my last video down the bottom i,watch i,create before up the top you,,,,,,,,,,make sure that i,do it a lot more at the old place,,,,,have raisins,,got a professional protein treatment yesterday,edit it i,,,,,,make of brown rice black beans some barbecue sauce bread crumbs,make burritos,,,,,use an app that,keep you full they,,go everywhere,,follow myself,,,frozen smoothie ingredients in this little sip lock reasonable ziplock bag i,,,got this idea from my friend tavita from the healthy maven she,,,,use them for like one or two days,,,make something big thanks again for,,,,get wool,,put this in a tick away container or on your way,,,,,,,make a huge difference when you,,,,hate that i,,,try any of the other brands yet,,look out for my videos i,make enough of them,,,,get out the door,come back to the hallway,,see you guys in my next one bye,make it at home,,,,,,,,,obsess with their products honestly so i,get all the olive oil the lemon,leave it out like it,,,,,check that out on my blog applause applause thanks oh it,,,do anything with my eyebrows for like a daily basis i,read it around a little bit,do something similar with just the concept something similar with just the concept of,do that,stress out about things,,watch this video i,,,do a full facial massage tutorial in my diy facial video,give you 353 calories without toppings the peanut butter raisin overnight oats,,,,,,,get ready sometimes it,,,,,,lose weight,come soon,use half a banana,
works amazing,get several free goodies,,,,get one it actually than it really,look at that little face,,do really simple i ever,,,,see if i,found it,do a good job i,hope you,,sleep i,use once you,put my wood,got some ketchup,do this,,use hummus for this then in the center i,,,,leave me,,,lose weight,,see you guys in my next one bye,give this video a thumbs,move house,,,,,,,,,,finish last night into my bag,look i,,,,,eat that,,do much to my hair today,get my fake tan off,,,,,,got two little mini black bean burgers these bowl veggie burgers,believe that,,,,,clean the,digest than carbs i,,fix my questions like i,,pause it,,,show you guys before i,,,keep it on there for very long,,,,play around with what kinds of rags i,,,guess it we,,,,catch you there,,wilt that way it,,,,,,,run into spills i,,,,watch for all of your support of my channel i,,,make me,,upload a video,meet up here,,,,do that as well,find i,,make sure you,make this healthy pumpkin butter into waffles,,,,,,,,,simmer for about 15 to 20 minutes while i,keep a lot of that some cut board we,make my outfit super simple,,,,,get some tips from it i,,,use it,sit on it on my pate,get outside,make sure it,worri about with oliver,,head over there you,,,,serve one,,,,,,,go back to my emails,,,,,,handle it,thank you guys,add some ice,
share a coupon code with you,find something that,,,,clean up all their toys before they,do lately,,,,,,use parmesan cheese,make the garden bed if you,clean now there,,,smell divine this,see the next thing that i,fall when you,obsess with these,got in my fridge okay,,promise you it,,,,get enough of berries especially blueberries like a blueberry addict,,,see what i,,,lose weight,plan out a new morning routine,,,,,,,,,,have a residue,do it as often,,,,,gone that long i,,do with my makeup now on to hair now i just,get finish,,,,,,go on a walk with the dog,go back here these,,,,,do one last track of my social media,eat carbs only then,,put the bug down,,comment below why you,,,make a smoothie that,,,assemble my grilled corn salad i actually,,,,look really good the last few weeks,,,try out any of them,,,,come up,,eat you,,,,,,,organise on this channel i,,,,give you a little bit it or it,,,guess you,,thank you,make loud noises in the background of my video if you,,,,fumbl through the cupboard,add all the pictures we,,make my home it,get in a can,,,,,,,,,use quite a lot right now i,take about 8 to 10 minutes in the microwave,hope you guys,,,,,include those three ingredients into my skincare routine,,,put it on my upper lip,fill aside in a bowl,leave the specific rules of our little competition in the description box in case you,drill some screws,build upon,,hope you,,,,thank you,,,,,,,go back to whatever i,,,,,,do this wrong most people,get out the door,smooth out the top with a spoon,
see a video on next i just,check them out,,,,guess what you guys i,improv your circulation it,,,,,,go ahead,bowl fit which they,,,,,mark as possible,anchor into the wall when you,happen they also,show you what it,,have tryptophan in it which,,,,serve pretty tasty,,,found it helpful helpful,,,download i,see you in my next one bye,,,,,,,,,,get some breakfast which,have a door that,,,,,end up,,put tension on the hair as you,head out there which really,,,,,,give your body just a burst of energy,brought for from trader joe some days that,,,,,reveal ton it,soak up more water,,do multiple times a day,,yeah check it out it,,,do those,,,put some garlic some,,,,plan on paint my barstools white,,,watch my video guys,,,,hit that bow,,get your tea ready,,,,,,,prepare lots of this channel i,,,,thank you guys,,,prefer the low setting for a gentler massage it,,theme this week,hope you,,,,get out of bed,finish product,,,cover it,,,,,,,,,finish product around my eyes,set it off to the side for now next thing,see you in my next video bye,,,,,hurt at all,,,get this palette it,doe the job too i,use yelp,keep the wood light if you,break out,,,,,,oat recipe,,,,,,,check out my last video down the bottom i,,,,,,do as well you,dry it just,use a 100 grams skinless grilled chicken breast piece all for a plant-based option i,
excit when i,leave streaks on my stainless steel appliances,,,,got new,expel toxins from the body it also,,,,,,add any of that cooking liquid this bowl,recommend this drill,,,,,pay attention to,put items on top of it,go with the burgers pines of course,put everything,,work for today then you just,,,,lose weight,,,eat in a day,,,make sure that you like it,get on with the rest of my day in the best way possible,,,,,,,,,,mess up for the video i just,mop the kitchen floor,,,,,make green smoothies for my breakfast lately now that i,,get stress my pants,excit about,,,,,,mop the entire house which,pack his lunch every day for work,,,,,help you,do this before it,,wipe up makeup quite quickly,,hope you guys,,,see i,,,pour the extra it,,,,toss them out,,,hope you when you,,,,miss those i bye guys,,sit down,,,,,,,leave me a comment down below of lourdes spaces that you,,,,see you next week with a new video bye smell that,,,make these kind of brushes i,,go that,,,,,feed myself in the morning the next category,do another family photo shoot,,,got you,,,,,,,,,turn it into a smoky outlook then i,eat it i or if you,check out my last video at the top,,,,,rain drop you,,,blush brush,give my pan a quick rinse,come to outdoor activities there,go to home depot,try a sample of this first,,,,,,do this,,,,,,,do this the next thing that i,,,,,,throw on some old parts,see you guys very soon in the next video bye,spoil eggs for some good protein,
match our cabinets,found the e cloth several months ago i,,,,look a little bit worse,do lately,,,,,,look for while i,do highly,,,,,screw the chalkboard into the wood,go ahead,got just a little mini one cuz it,get the flavor,,bite that taste like froyo they,,,,eat in a day,,,lose weight in a healthy way the calories,,,eat in a day,plan out my morning routine,,,,,,,,,,do this before i,make sure there,,,,,get the sun warrior brand,,thank you,go out,,,,,,simmer until it,got him this beyond chicken,,,,,help you,drink a black,,chop up food,,enter you,,,go it,,,check her out i,,,,watch my cleaning videos you,,,use frozen they,,,,,,eat later,,,,,,,come up that i,,,,hope you,,,sort it out,,taste just as good,,,,,find everything number four or just like in your head for me i,show you how i,,,turn the christmas lights on,,,,,,,,,use honest beauty warm stable brown eye shadow palette which,make up the salad,give it a thumb up,,,,,see you guys very soon in the next one bye,,,use a three lip product the first one,flip it with my spatula,go on a hike i actually,make sure,do that,,,,,,grow really nicely with this,,,,,,,left off in my me time,,,,,,help you,use recently,boil eggs,
do that pretty soon,give always by your side,,,,link it for you guys if it,do with my videos i,,,,,,cook my pasta you,add the legs onto the bottom i that i,,,,,hang my frame on,,got some vegan coffee creamer,get nice,,work really well here then you,,,,eat the dinner,,,lose weight sometimes i,,,check it out if you,get it,,,,,,,,,,guess i,run in,,,,,go for it,,see you soon,,,,,,,do some nutritional yeast miso traditionally,see i,,,,,provid white noise which also,cook when you,,make sure i,,use the hashtag simply,,,do that,,,,,,,cut back on my laundry which,,,,,,,,,toss that in i just,,,,,,,excit about i,,,,,,,make my skin actually,,hit the,,,,,,start new ones as well along with my other series on this channel,,,make you,,,,,,,,,entic smoky gray eyeshadow palette i,rinse them off,make sure you,,,,,got a little sunburn or something,,,broke it hmm okay,put the,rollerblad whatever,go on the long piece of wood,see you,,,,,,hope that you,,,,,,,go back to my room kind of feel like the rest of the day this,,,,,,help to tone,get back to my normal,give you roughly the same amount of calories as,
clean your appliances better all you,give me up,,,,do all the candy,add to my routine,,,,,,,put on all four corners,,,,,hang it on the wall next i that i,,use the crushed tomatoes,do accord to the recipe,,see my analytics that,,,,relax for a few minutes while i i i generally i then,,,thank you,,,see you soon,see what other things i,,,,,,,,,,tastes absolutely amazing i usually,got heavy traffic just,,,,,do workouts in the morning,,give it a thumb up,,,,,,,thicken up i just,miso soup,,,,,do a little aromatherapy by spray,make sure that you,,find that they,,try simply earth,,,got one cup of frozen mango about half a cup of frozen blueberries half of an avocado,,,,,,,come in a pack of 12,,,,,,,,,wilt that way we,,,,,,,prepare lots of content that,,,,,,,call it,,make sure you,,,,,,see you guys very soon with another video,,,make pumpkin pancakes i,,,,,,,,,use the bare minerals complexion rescue it,put these in the oven even before the lentils,,,,,,,,,use this,make the omniture okay this pot,see you guys next week with a new video uh-huh hi how you,shift around the bathtub,make time for the things that i,,,,,,put the full recipes over my blog for you,,,,,,,get on with the rest of my day,,,,,,see visible results over time obviously along with healthy eating,,snack on these i,
figure that,got from girl you,,,,make some some friends when we,find excuses what i,,,,,,,see if the,,,,,connect the pieces of wood,,wait oh that i it this,have the most starch in it,,give it a thumb up,,,,eat 1100 to 1400 calories a day,,,eat more that you your height,,,see more water,change as i,,,,,,,,,,,do this on the weekends when i,,,,,show you what they,,,,,,,,,sent out some miso,go room temperature,,,,,head it to bed once i,take a few minutes,,do this every single day i just every single day,,thank you,,,show you guys how,,,,,,,get to them for another couple weeks,,,,,,,,,fill me up for the next morning socially if i,,,,,,,catch you guys in the next video merry christma bye guys good cleaning,,,,,,,do my current favorite product,,add some nutrition facts in the videos for all of the recipes,,,,,,,,,use this exact batter recipe,,,,,,,,,come with three shades,bake our baked potatoes,,,,,,,,,put it on i,get ready,find the best hiking,go ahead,come by that,,,,,,make overnight oats with me,,,,,,,,,,,,,lose weight,,add it to meals then,
match our island,get really dusty especially in the summer time,,,,throw pillows,have a smaller molecular structure,,,,,,,watch that video i actually,,,,,come back out the front,,crystal dark chocolate 65 %,do that next time,,watch this video,,,,lose weight depend on how active,,,lose weight if you,,,thank you,,,,,,,,,,,,clean the kitchen stove usually once a week it,,,,,go until like 1:00 or 2:00 i,,,,,,,,,chili powder cumin garlic,tastes really close i,,,,,get me,seem like a strange thing,,do it every single day,,cancel it just,,,do i,,,,,,,get from the dollar tree,,,,,,,,,freeze my when they,,,,,,,thank you owen it,,,,,,,spend a little bit of extra money on a good all-natural brand,,eat in the days here from now on i,,,,,,,,,take a bag of,,,,,,,,,hydrate cream at foundation,do before i,,,,,,,,,use this pacifica,got my two mono mushroom mix that i,get creative with it,paint it,do it,,,,,,see more recipe videos then,,,,,,,,,,,,,release toxins in your body which,,slice up to this meal,
use my cordless vacuum,left i,,,,make like this for pretty now onto our living room,have a lot of health benefits,,,,,,,upgrad our drill,,,,,do here as i,,got a couple,do in the light this,,show that 60 % of you guys,,,,make sure that i,,,hope that you,,,make sure that you up,,,,,,,,,,,,break it down to once a day every three days,,,,,got at whole foods before,,,,,,,,,do six small gold potatoes,find it in the freezer section i,,,,,help you i,keep me,,do it pretty much,,check it out,,,drink that in the car,,,,,,,got around to it,,,,,,,,,froze mine the night before if you,,,,,,,see me,,,,,,,make my skin feel,,see you next week in my next video bye you,,,,,,,,,kid guys so okay i,,,,,,,,,use one shade the darkest shade from the honest beauty,watch i,,,,,,,,,finish this look i,use baby spinach instead of arugula if you,ride kayaking,go on the inside of the bathtub which i,stress out for sure,,,,,,put a link to that below this video if you,,,,,,,,,,,,,focus most on my legs size,,cook up a big part of it every week,
downstair the last thing i,go ahead,,,,check facebook,wear no makeup i,,,,,,,addy walt which,,,,,find the center i,,got i,help i just,,got okay,,,,make them there that i,,,watch this video i really,,,watch this video if you,,,,,,,,,,,,seem like a lot,,,,,left it in my bag,,,,,,,,,see how this,keep it real with you guys,,,,,extend the life of my spray tan this,go to massage the kale if you,,move into their rightful place every single day,,miss out on this prize it,,,,,,,,,,sing their,,,,,,,,,harmon vegan protein i,,,,,,,,,,,,,,use though,,keep your digestion healthy,,,,,,,,,head out,,,,,,,,,use this instead of a liquid liner it,hope this,,,,,,,,,line my lips first it now that i,make these three breakfast recipes,trail near me when it,,do every time i,,,,,,make sure that you like it,,,,,,,,,,,,,tone as well,,flash up,
sprawl across our entire main living area,mind girl,,,,make furniture nowadays,help with skin redness,,,,,,,thank you,,,,,make sure i,,got this lovely this dark chocolate,leaves on top,,see my future videos,,,,watch netflix or something or maybe one of my favorite youtube channels,,,eat today over on the blog for you,,,eat in a day videos,,,,,,,,,,,,do any more than that,,,,,show you two things that i,,,,,,,,,put that there i,cut it in half,,,,,sleep better i,energ i,,make it so easy to just kind of pick,,cancel that at any time,,,,,,,,,,believe they,,,,,,,,,try it,,,,,,,,,,,,,,last longer,,add all the nutrition facts to my recipes,,,,,,,,,get my snowy white christmas i,,,,,,,,,hit my cheekbones,use kalamata olives,,,,,,,,,wear at grad,go perfectly with this motor,hope you guys,,stress out like i,,,,,,see you soon,,,,,,,,,,,,,exercis as well,,do that,
keep the rest of the house pretty clean,make sure,,,,leave it,do that,,,,,,,thank you we,,,,,allow the frame,,wait oh that,pine nuts on top we all,,see you next week with a new video hi,,,,lose weight in a healthy way the calories that you,,,"eat 1,100 to 1,300 calories a day",,,share it,,,,,,,,,,,,see you guys in my next video bye,,,,,try that,,,,,,,,,blend them with some spices,put that in his burrito,,,,,fall asleep faster then,keep me full for a few hours when i,,seem cleaner,,leave all the information for the giveaway in the description box below definitely,,,,,,,,,,pick up anything that,,,,,,,,,try it,,,,,,,,,,,,,,do a few sprays,,add the protein cow,,,,,,,,,get me wrong,,,,,,,,,lumin powder on the areas that the light,thank you guys for,,,,,,,,,make this skirt for me which,finish the meal off really nicely,give this video a thumb up,,matching socks or something it,,,,,,check that out there if you,,,,,,,,,,,,,drink some more water,,go modders,
mop everything now usually i,try it out if you,,,,clean perfectly,give you more intensive hydration the same concept also,,,,,,,see you,,,,,stay together,,focus very well why crushed tomatoes they,have the best flavors for,,do you,,,,make buddha,,,,,,,,,,,,,,,,,,do this,,,,,make it sweet,,,,,,,,,let that,wrap his burrito up in,,,,,see you guys next week with a new video bye i,boil two eggs,,do kind of,,,,,,,,,,,,get like two crossbow price of one,,,,,,,,,go you,,,,,,,,,,,,,,rehydrate the skin after,,keep you full,,,,,,,,,see in the movies,,,,,,,,,use that,eat this whole bowl ready,,,,,,,,,got from lucia toe i,get into better shape the apple oatmeal,do from bike,,stress out,,,,,,give this video a thumb up i,,,,,,,,,,,,,do this every morning for five to ten minutes,,toss them all together,
wake up anybody,make the house feel,,,,leave no streaks,go out,,,,,,,hit a million subscribers,,,,,go for after that,,place these babies,use parsley or basil or no herbs at all i,,support my channel,,,,watch i,,,,,,,,,,,,,,,,,,collabor with me,,,,,find in the other one i,,,,,,,,,go i,sprout green tortillas there,,,,,check those out as well and i babe,cut them into quarters,,get my floors,,,,,,,,,,,,prais all the time i just,,,,,,,,,call a little smoothie pack that you,,,,,,,,,,,,,,rose water as a natural toner which i often,,give you lots of energy throughout the day,,,,,,,,,ask drinking hot starbucks you,,,,,,,,,use some bare minerals round-the-clock intense cream glad alana in the shade midnight,do in 30 minutes,,,,,,,,,yeah so she just basically custom-made this skirt for me,scratch my channel for more videos i,do one new outdoor activity every week when the weather,,have a lot of energy,,,,,,share it,,,,,,,,,,,,,get your heart rate up for a short amount of time,,drizzl 1 tsp of olive oil over my quinoa,
go ahead,take the actual,,,,use the e clock all-purpose cloth i,drops i you guys it i,,,,,,,got something out of it,,,,,depend on how your house,,go these,make it,,appreciate it if you,,,,see you soon,,,,,,,,,,,,,,,,,,make sure that i,,,,,see how it,,,,,,,,,have a really salty umami flavor kind of like soy sauce,end up,,,,,do it,balanc with good protein,,make it really easy,,,,,,,,,,,,wash them they,,,,,,,,,boil before i,,,,,,,,,,,,,,help after,,hope you,,,,,,,,,go to the beach or the pool as i,,,,,,,,,frost in bold brunette,do shoes,,,,,,,,,rear the shoes that i,put all the recipes that i,,,get stress i,,,,,,,,,,,,,,,,,,,do my 16 minute,,cut from the quinoa,
head back,go ahead,,,,talk me out of love,work out how i,,,,,,,,,,,,paint it black or white,,use of them too as the sauce on my pizza i,found it interesting if you,,hit that,,,,,,,,,,,,,,,,,,,,,,look nice,,,,,find that it,,,,,,,,,go in the oven it,sprout different kinds of grains lentils,,,,,go ninja,cook quinoa or rice in the fridge,,find that when my floor free everything,,,,,,,,,,,,watch my videos you,,,,,,,,,boil i,,,,,,,,,,,,,,restore the ph balance to the skin,,add that in there,,,,,,,,,make the most of summer,,,,,,,,,found that,take me 45 minutes,,,,,,,,,pick this one now my mom,lose weight,,,find that time,,,,,,,,,,,,,,,,,,,sweat a little bit i,,cut all of these ingredients up differently,
make it really nice,find out it,,,,come right off,,,,,,,,,,,,,look like an eye for isaiah,,use this as the sauce on my margarita pizza,do too i please,,come up i,,,,,,,,,,,,,,,,,,,,,,get the free products,,,,,sweeten with stevia,,,,,,,,,look really good look at these yum,buy one fuji apple for myself i,,,,,go ninja,look quite big even for me,,do a little bit somewhere you,,,,,,,,,,,,go kitchen,,,,,,,,,take my blueberry cinnamon black instant hot oatmeal from matrix,,,,,,,,,,,,,,found that,,,,,,,,,,,dream of my white christmas,,,,,,,,,give them a little bit of extra color this,got it,,,,,,,,,recognize it from my grad video,make sure that you like it,,,mean you,,,,,,,,,,,,,,,,,,,get ready,,go obviously you,
go ahead,throw it into the washer,,,,depend on how busy our weakest i,,,,,,,,,,,,,keep it the color that it,,focus there we,see more i,,use snacks,,,,,,,,,,,,,,,,,,,,,,spend a little bit more time,,,,,flavor with stevia instead of sugar which i,,,,,,,,,set my timer for 25,buy organic apples,,,,,go ninja ninja,add a little,,,,,,,,,,,,,,try it out,,,,,,,,,pour the half a cup to 2/3 of a cup of water into just a small pot here i,,,,,,,,,,,,,,clean you,,,,,,,,,,,guess a bikini a sarong,,,,,,,,,go down my nose,have an optional note in there that you,,,,,,,,,thank you,see you soon,,,try to film something,,,,,,,,,,,,,,,,,,,get pretty hungry,,contain good protein from the quinoa,
got some cleaning motivation from it,collect the best really well,,,,grow up,,,,,,,,,,,,,finishes up the frame for the inside of the frame what i,,do you,watch this video today i,,come up with some ideas for the n scene for this week video,,,,,,,,,,,,,,,,,,,,,,,,,,,have greens fruits,,,,,,,,,uncov at 350 for 20 25 30 minutes,contain any flour it,,,,,do that,got a lot of healthy food for a lower amount of calories it,,,,,,,,,,,,,,tell it,,,,,,,,,allow it,,,,,,,,,,,,,,add to their product,,,,,,,,,,,understand a hot summery christmas i,,,,,,,,,swear they,add cherry tomatoes,,,,,,,,,watch i,thank you,,,stress out i,,,,,,,,,,,,,,,,,,,get your blood flow,,keep you fuller for longer with sustained energy which,
hope you guys,go for the day,,,,go ahead,,,,,,,,,,,,,put those sticks in the shape of an eye,,finish editing a video for tomorrow hopefully,eat in the day,,come for you guys the summer,,,,,,,,,,,,,,,,,,,,,,,,,,,got that i,,,,,,,,,looks like that i,buy some that,,,,,,add to meals like this,,,,,,,,,,,,,,got dark out,,,,,,,,,put it right in i,,,,,,,,,,,,,,protect your skin even if you,,,,,,,,,,,experience a cold snowy white christmas soon you,,,,,,,,,go in with some honest beauty holiday midnight reflection,look all olives,,,,,,,,,see you in my next video bye,check them out if you,,,,,,,,,,,,,,,,,,,,,,sustain energy,,pull apart salad plate,
