combine that all together,give him one,use other leafy greens like swiss chard or kale,make life with kids easier in the kitchen,retil,add half a banana for a little sweetness,cook up,bring it to a slight simmer,add some more water,sweeten it up a little bit,go to dice this red bell pepper,put away those miscellaneous things,organize all my time,buy some circle kale,add in my broccoli then my zucchini,use it,use powdered peanut butter,head over to my closet,mix it,spray down very liberally,use this,make them,share with my favorite freezer cooking recipes,involve eggs,shave cream corn starch,soak up the sun,make my bed,do smoothies or salad,suggest that,get ready,give that a little mix,pack a little bag of stuff like a drink bottle,add it into a mason jar,start by,look at right now,,cut the wood pieces now,put that to the front of all of my products,go back with the p ranade eyeshadows,sprinkle powdered sugar on top it,make it really vibrant lee green,recommend guys,add some raw unsweetened coconut flakes,open it,spread it,,take also about a tablespoon,make it easier,blend protein vanilla with all essential amino acids,head out into the living room,share with my daily cleaning routine,try right here,make some really easy diy wood coasters now,clean the kitchen every day,grab all of the clothes,do a video,make your a lot less sticky,,add some fresh cucumber slices,find a car keys or your house keys,get our dinner dishes,inspire,go straight,make some tea this morning,chop garlic,last a really long time,put them on to the valve,use the bare minerals,put some mascara on,do a clean with me,take construction paper,,set it all the way down,use chicken breast,make my bed in the morning,give it a little bit of a whisk,look at this,switch these specific skincare products in my routine for any other good natural skincare brand,go upstairs,use on cabinetry,add this into a handy dandy little mason jar,use a comb in the shower,add a little bit of milk,add about a third of a cup of chicken stock,,do regular morning routine things,clean out my sink,come up with a manageable system,cut it out on top of your other piece of cardboard,wipe them down at least once a week,add a great texture to the salad,cover in water,sprinkle on some of those green hemp seeds,,look gross,use any sweetener almond butter cinnamon nutmeg,pop on the lid,give my hair a bit of a shake,fix my computer related cables,mix it up with all sorts of veggies,give them a little bit of saute,clear up the counters,head over to his channel,cleaning,rinse your mushrooms,see sometimes,make a lot of different cleaning supplies for very affordable prices,use a little bucket,use regular oats,add two tablespoons of raw cacao powder,toast your bread,works really beautifully under makeup some moisturizers,relax for a bit,get things nice,break down the cell walls of the kale,use a waterproof one,make your own rain stick with a few supplies,make out of a pool noodle instant tape,,,top it with 1 tablespoon of unsweetened almond butter,use a wood board,smell it in your hands,end up,brush out my hair,link all the ingredients with correct measurements down,,add a pinch of cinnamon,go to fry,pour it into my glass,make cream now,keep a few of those things in the drawer,add the main ingredient with blueberries,do it ourselves,add two tablespoons of olive oil the garlic,wake up,take the kale,wear a little white with this little gold necklace,get some bulk bin stuff,wake up,add one teaspoon of pure maple syrup,put my clothes away,play a board game with me,throw your tomatoes into a medium size food processor,use a tea infuser,stay in the grout lines,,munch on some snacks,bake soda shave cream contact solution air dry clay,rinse out the shower for a few minutes with hot water,add essential oils into my drain,put all the condiments between the cheese,grab a nice size rock from outside,finish it off with these holographic gemstones,use a bowl,brush up very gently,find it,get healthy in your diet,,stick them on the pedestals of your bed,spend ten minutes on the kitchen,stick with the diy,crack them right into the bowl,use my clarisonic,,use myself scott,apply a la creme for the skin,invest about ten dollars in an oven liner,add one drop,curb hunger
use three parts greek yogurt,make it from a dry to a more wet consistency kind of like a cookie dough,add tablespoons of dry whole rolled oats,size stainless steel containers,consider for tile floors,use the cinnamon,add in your veggies,go to dice it into cubes,give our oatmeal a nice creamy consistency,add in my greens,add some water,kick this all over to the laundry,write down my thoughts or my diary kind of things,buy some purple kale,use a pie,make some shelving,cook it yourself,get ready for dance,add in some frozen wild blueberries,clean our toilets,smell like tangerine,help me with this part for safety,prepared meals for my family in two hours,use as a body wash,make beautiful things for my family on a budget,sit in the middle part of my couch,use my honest beauty everyday moisturizer,cut up the stuff the night before,give it a yellowy color,walk my dog max dust,add two teaspoons of chia seeds,give it a couple hours,use a wooden spoon or a whisk,use any kind of milk,face the window,,cut here,keep the purple shampoo,use this like light brown,,blend until,make a tea latte,use one cup of unsweetened almond milk with some spinach,scoop it right out of the food processor,take some bake sheet,,fill it about halfway,break down the fibers in the kale,chop up a little bit of cucumber,prepare a couple weeks ago,tell,do this one outside cramps,stain these with the wood,clean the counters,go off to the dirty wash basket,,add a few scores of liquid glycerin,,add healthy fats,sit on a chair,reload the dishwasher,get up,get ready from,check all the socials instagram,start with four to six cloves,wash my face,get milk storage bags,rose water spray,side lipstick,clean them,cut things out,,decorate the ziplock bag with puffy paint,set it on low heat for eight hours or high heat for three to four hours,make your bed in the morning,incorporate all the ingredients,make myself breakfast,cleanse in the morning,do it in one load,clean the kitchen,pop it in the fridge,take a shower,follow by my cream cheese,put in our lime zest,,tell why in a second,add a few drops of essential oil into my drain,see recipes,use some sharp scissors,wipe those down,add raw sunflower seeds raw sunflower seeds,notice that the water,add about a teaspoon,,taste amazing,chop up apples,sprinkle a little bit of my pink himalayan sea salt,throw on the tv,swear melbourne,chop up,use chives,get any dishes in our sink,do a collab with that,,rub off any extra dirt,eat a lot of nuts,take off your shoes,make a little bedtime snack,make this with oats,mix it up,start,apply that first,pick out something,wash out my sink,give it a good massage with your hands,put it on my face,show another option,make with seashell,,,cook the apples,start to experiment with woodworking,come from plants,put a little bubble bath in there,use two teabags,make this vegan lunch meal prep,,cook that for about to minutes on the stove,use a pair of scissors,add a few ice cubes,get really creative spread your cool hwhip on with a knife,do a light surface cleaning of your kitchen,add one set of an avocado,,scrape down the sides half way through,set my alarm,pull it away from the hard stem,wear these quite simple blue rip jeans,show what,drink some water,add flavor,go into,match same colored objects,check it with a spatula,put in,take a scrub brush,,do some reading,take on this smooth creamy,put some soft scrub on the area,wipe down my counters today,make lunches,drill all the way through,add some puffy paint to the end of the toothpick for a pop of color,add teaspoon of pure maple syrup,brush in an upwards motion,get some greens out some um a head of romaine,make a creamy cheesy yellow squash sauce,,use the hose extension,,start with some pumpkin spice lip balm,stir everything all up again,do for my skin,,work really really well,put some peppermint essential oil on my wrist,touch the outside of the stove,see it,come with the bentonite clay for that mud mask
cut that in half,leave a small space open,mix two teaspoons of chia seeds with about teaspoons of water,go to real school,take off any excess,use half a cup,mix throughout the eggs,grate the entire thing,add a full cup of banana,add a few frozen strawberries,add about a half a cup,go upstairs in art service,get everything together,got some cucumber,add a mixture of five eggs,add some potting soil,dress to whatever consistency,slide it all the way,mix that all up,wipe them down almost every day,part it like this,punch a circle out of your paper,keep it all organize,get ready for the day,make the dough a lot less sticky,head to the living room,get ready for the day shower first thing in the morning,include as well as fruit,got my coffee,add in some vanilla almond milk,absorb water,finish off with a little bit of luck cardio warm down,dress it,show the basic recipe,,,document the process,get water all over my back,put this on my brow bone,,,cook it,add an avocado,scoop it into a bowl,touch them,,pop in the frozen banana,throw on a little bit of uh sea salt,got leftover sweet potato,hop in the shower,give it a thumb up,stretch routine,protect traditional wood,use it on my refrigerator,throw clothes on chairs or over my dining table,,play with our sand,,add really good lean protein to my lunch,lay out,got all of our dishes on model of the dishwasher,clean my apartment from top to bottom,force yourself out of bed,brush your teeth,use about half a teaspoon,use dream cream all over my body,plug it in,use some moisturizer,blush color on my lips,go to dust down my bookshelves,choose red blue,,,use chicken stock,get a little bit of freshener in the morning,stir once again,film it,list those in the description box,work on the of a lot of stuff,clean the countertops,use fresh turmeric root or the powder ginger and then a little bit of sea salt,blow it,use a whisk,get the zest of one lime wash,,get ready for the day,clean it out,keep them clean,use this beautiful gradient rainbow yarn,wipe them down about once a week,put the top on,get all the chunks of almond out,put on your favorite toppings,,talk about it in my healthy breakfast video,add it first,shake it to kind of emulsify all the ingredients the oil,take them all out,give them,add our veggies,use about a half of an onion one bell pepper,see now,collab with someone,,rinse them,try it the other day,cleaning supplies for around the house,watch my current guilty pleasure,vary the top,take the saucepan over to the stove,use a spoon,use the highlighter,go on netflix,clean up,add in cilantro green onion red onion red pepper,mix that with my sunscreen,look online,retrieve them from the bottom,,,add one banana to my blender,paint a board this particular paint,make life with kids easier in the kitchen,add a little bit of bubble bath,add that to the mix,use the spices,,add healthy fats to my meal,cook your butternut squash for about minutes,blend it up,follow the same steps a layer of ice cream sandwiches,do a declutter,use one cup of frozen blueberries,,use parsley or basil whatever herbs,get up,step over here,use this older bag,got a lot of my groceries,get a bit tangle in the night,use sweetener,clean up all of your dirty clothes,eat on the couch,chop tomato cucumber,pop the center part into the outer part of the tumbler,use paper towel all the way around,,make myself some food,cut up our slime,do things,do a quick of my stove,take a little bit of time,paint it,,add half a cup of sliced strawberry pieces,gloss in the shade,top it with some dijon mustard,,,use a dry dryer sheet,,boil underneath,incorporate the eggs,use that with the clarisonic cleanser,,make it,apply my gold serum to my eye area,clean like a boss for the top of the stove,add too much,give three amber glass bottles
assemble my sandwich,cut slits,add to tsp then about to cup of water or coconut water,pack lunch,stain,use one teaspoon of pure maple syrup,take a handful of my baby spinach,stir it we,soak up the water,use zucchini,saute it now,do the laundry clean up all the toothbrushes,add to a portion of my day,go down here brown rice spaghetti,start off with some onions,start with the succulents,mix with sesame,put your ponytail in between the two slots,throw in some eggs,use the method glass,hydrate facial toner by fresh,peel off your stickers,make beef barley soup an amazing chicken,head back downstair,measure in a cup,sit down at my desk,do a little bit of our cream,do a little bit of a tidy up,saute it all in some coconut oil,mix it all up with my special bamboo tea whisk,top it with one flat teaspoon of unsweetened almond butter,start with some cardio,show how,make them three different ways,,,bring the other large pieces of wood,give it a good clean,make like a tiny little triangle on the outer third of my eye,,,add in,add some frozen berries like strawberries blackberries blueberries,use kalamata olives,lift like this,,screw on the lid,massage it,cut them up,come home,do stuff throughout the rest of the week or the month,put that into silicone molds,seal them,get to the stainless steel,grab it,,,,got some romaine lettuce,lay out as well,clean my sink out with some regular soap,speed up cleaning videos,start with coffee,throw on some gray sweatpants,add about a tablespoon of brown sugar,keep it pretty simple,store it by freezing it,apply some coconut oil,iron it,wipe down every single shelf,paint a really light layer of paint,,,boil off your pasta accord to the directions,make their beds in the morning,incorporate together,unbox my new handbag,get some water on my face,put things away,give your kitchen that showroom,add in some water grainy dijon mustard garlic lots of it raw hemp hearts lemon juice fresh cilantro,start with my hands,make our sauce,prep our cilantro,,do it for five minutes,put away the dishes,make again,cut all the way,move on to my bathrooms,get some of your favorite bread some big lettuce like spinach or romaine,drain your almonds,chop up into small pieces as my natural sweetener,,starve after,go ahead in your crock pot or slow cooker,cook that before,make myself tacos,mention the other day in one of my videos,stir,pop these in a degree preheated oven for to minutes,add in some essential oil to my sink,lay there,,use like a wet cloth,lighten slightly,come into the home,help the body,make life really really easy,add that in there,use half or the full,blend it out with a beauty blender,take out my planner,use my dish soap,drizzle it all over,start off with my foundation,show how easy it is,cut in half this,,,call my classic strawberry,use my miter,put five drops of each oil in there,add their toys,put about ounces of milk in my milk frother,chop them up with a sharp knife into inch cubes,,use at least the cinnamon,cover it with the dish towel,use with hummus,add our pink cool whip,clean the outside of the toilet,add about half a cup of water,,form a creamy consistency,drink my tea in bed,put it in this little measuring cup,use my bag,get some protein,get off any excess moisturizer or oils,measure out,fold all my clothes neatly,play the game down below,see that,take a couple of tea spoons of the loose leaf tea into the center container of the tea,wear gloves,,open anything,make the clay super soft mix,rinse it off,clean it,make sandwiches in advance,stain some wood,,add a pinch of cinnamon,,chop it up,,,collect at the broom,,add a dash of pumpkin spice,add in your baking powder,use the clarisonic mia,,get that along with most of my other cleaning products from girlf collaborative,clean off my skin,forgotten about crevices a butter knife,mix it all up,give a little milliliter amber glass bottle
assemble your veggies,cut strips,do a detox this recipe,move on to drinks,make it,slice up on top,put about half of the mixed berries in here,cook for minutes on medium heat,add banana,use a julienne slicer,add that in,wipe down phase,write down some plans or some ideas,got some broccoli a big crown of broccoli with two russet potatoes,add egg whites,put these plastic containers inside,tell these,put it in a really really really tight ponytail,waste another bowl,move back into the shower,use a serum or an oil underneath,use photographs,make these recipes in bulk,wash my hair,crumble apart your dough,go into my office my life,straighten the ends,put away the rest of my leftover soup,take it out,sniff around once,leave the oats,see a fitness routine,drizzle all over,put my greek yogurt in here,,,share with how,put away,use this champagne gold color,,,sprinkle of cheese on there,give a little bit more sweetness,,cut them into nice strips,,use next we,filter water,slice it up,add some cilantro on top,achieve something,mix together ingredients,put cups on it,clean the surface of my kitchen,give it a little bit of a vacuum,,,,add it to my salad,rummage through my actual makeup drawers,use the meyer ever mint scent dish soap,put back into its rightful place,make coffee or tea,get into something a little bit more snuggly,pour your mixture,use at night,find these,use some daily spf cream,it straight,wipe down everything,paint them myself,,,combine the white beans,eat a healthier breakfast in the morning,give everything a nice,check out my last video down the bottom,exfoliate your skin,put those things away,work in sections with my polish cloth,blend it up,look,add some salt to the sauce,prep your ingredients,,reduce cellulite,get my dragon towel,keep recipes in my binder,do tie off the two ends,make your bathroom smell,eat it on a sandwich,got most of the liquid out,use a half of an apple,,get the green color,throw in that cinnamon stick,go ahead,watch tv or on my phone,put everything away,dump in here,add your egg mixture on top finish,use dish meyers,go over to my window,,wipe them off,have four grams of sugar,got a book,put on the trashy tv,fill up each of your muffin cups,add about a teaspoon of pure vanilla extract,slice it into cubes,use the magic foundation by charlotte tilbury,pack up my stuff,load up the rest of the dishes into the dishwasher,give it a good shake,use a pencil brush,start with our cardboard tube,play with our water toys,,,use fresh or frozen banana,create my measurements,combine all four of these oils,prep for the boys,eat my breakfast,do this,,add great flavor,puree the sauce,use romaine lettuce,add a bit of gel food,put something in,add one banana to my blender,,start with rice cakes,lie in bed,chop some garlic the garlic,show,look the ingredients,brush that all out,stir it all together,go right,go on my nightly walk,add on,screw the lid on,help,,head out onto the patio,hold its shape,rub it in with any type of one dollar scrub brush or sponge,wipe it down with a wet rag with water,plan your lunch,do art projects,,soak in the fridge overnight,,make zucchini,,,take up all of the dust,,add a dash of vitamin e oil some cinnamon essential oil clove essential oil,take our two eggs,use some,,save a lot of soap,smell that,wipe between the stove,stick to itself,use those roll ons
stack the chicken salad,tie them all together,add a few ice cubes,stay warm for a very long time,use a little wooden stick,use half a cup of strawberry slices,put that right in there,put your oats right in there,make this oatmeal,tastes really good,use about half a teaspoon,run a dishwasher load,write it,got some romaine,quinoa instead of oatmeal,do a nother diy video for around the house,make a quick peanut sauce,roll it down towards your head,make my veggie spreadeth sandwich with a kale salad on the side with some of my dill tahini,clean up,put some cc cream on this,peel it off,cook up,do my hair,shave cream,go to my laptop,fix my hair,wipe down the benches,smell incredible,mix one teaspoon with water,do this,throw on my little nike runners,add in the rest of the ingredients,add a little bit of cocoa powder,,,create a square,sidetrack magic eraser in my walls,use this color,,,help with my digestion,add some liquid stuff,,roll them up right,,use any yogurt,soften it,got some greens,add some spices,look clean,warm it,look at it,work great really like this method stainless steel cleaner,use some window cleaner,,,,add healthy fats to my meal,plan out your morning either on paper,clean off the counters,see everything,get ready in,watch a movie cuz,put about half a cup of chia seeds in your container,make a cooling foot cream,make diy body butters,make my skin look really nice,use my flat iron,vacuum it,pick these up at my local hobby lobby,,,stir it up gently,eat a healthy breakfast in the morning,stir,,mix it up,get rid of for me outer order,go in any of the cabinetry,make with real wholesome foods,try several,make it smoother,add our press garlic or garlic powder,,make my bed,use them for several uses,organize my recipe in two basic categories sheet protectors,take an additional piece of yarn,use the method antibacterial bathroom cleaner,make a sandwich,drain all,mix up around the oats,,make breakfast,throw it into a bowl,put it all through the food processor,do a little bit more work,cover in makeup,do it together,assemble your egg muffins,make it smell nice,pick out some sock,,take off any extra moisture,talk about the prepackaged oatmeal,jump right in,use my phone once,put cinnamon walnuts,whisk it all together,take a fork or a whisk,apply bronzer on to my cheekbones,go over to my desk,wash any dishes,toss everything together,use this mascara from sigma as an eyebrow gel,sticks that lincoln,create buttons,,,add half a cup of sliced strawberries,move the wood a tiny bit over,roll it once or twice on the bottom of these,use the seventh generation coconut care mousse shampoo for both of them it,head over to my desk area,got your two large sweet potatoes,,take longer,blend all right,use hummus,take the heart cake out of the freezer,stock the bathroom with my favorite products,make this with the chocolate,,plate it up like a crudite with some cucumber carrots,put my little christmas slippers on,make the dress,got a little snack bar,get fresh greens,wash my face,bring out the chocolate flavor,put everything back,play the game,do here,pour in hot water from my kettle,give guys all of the best tips,,read,put down,clean the bathroom,wipe down my bar stools,,stain it a dark brown of course,,sweeten the oats,,saute in oil,,,run it along your baseboards,,put the melted ingredients inside of that,use either a whisk or a fork,put it on your skin,,get several free cleaning products with your first order,start with an toner,give it a try,add to tablespoons,
