throw a drink recipe in the mix,put a hole all the way through it,give this a thumb up,come with four slots,got a deck or a back patio floor,make it a bit thicker,use mango or the banana,cooking for minutes,simmer at a low temperature,boil water for about minutes,add all,wipe down to the whole kitchen,do anything,like the green apples,rinse one cup of quinoa,fill it with beautiful succulents,assemble it all together onto your lettuce drizzle on your sauce,secure that with two hair elastics,flip these,mirror clean,talk about how,place it on top of your circle,stuff all of my tortilla shells,brush your teeth,color if,finish my coffee,use my honest beauty younger eye cream,pack the dishwasher,add it,stir that all together,absorb the water really nicely,see this before,pour,give it a quick shake,,,get a few more pieces of wood,put away,lend it a little bit into your crease,,,start by,thicken it up,,cut right through them,,take our berries,dress,cut it to about like what the size the cucumber,top it off,make my bed,relieve your cramping,use them as coasters,make my house look really clean,put a few things away,,,,chop up in my bowl,use it as like a checklist,give it a good vacuum,leave a comment down,set your alarm,got my laptop,stir this all,rub that dream cream all over my legs my arms all over my body,melt together over a double boiler,put coconut oil on my lips,iron my hair,vacuum,take barely any time to dry,,,add some salt,make their beds,top my pancakes with some fresh maple syrup,,clean your face,open your hands,take my rag,blend it all up until creamy smooth,got some from drybar,smell great,set that aside,,chang into an old pair of tights,wipe it off,keep a master list of all my recipes,wrap your yarn,fill up my diffuser,make this vegan chickpea tuna salad,squeeze it alright,put the lid back on,,move on,chop apple,put as much as little as like,perfect facial,clean off my dining table this morning,add our final ingredient,get your egg mixture together in a separate bowl,use my favorite cleaner,head over to my bathroom,,slice mushrooms into a big bowl,whack of options,sift it onto your carpet,look at your phone,store them in individual freezer bags,put it over a medium low heat until the peanut butter,go to mash up the avocado,give them a really nice full look,make a list with everything,add some essential oils into my sink,top it with some pomegranate seeds,clean up all the edges,stumble across some tutorials,customize your lightsaber,,,use plain full cream regular yogurt,work with the miter,put the cold water in,clean up,prepare mine with almond milk,add a little bit of water,,melt into the oats,squash it,put a little spoonful onto each letter,top it with raspberries,clean it out,blend it up,,blend,get into my robe,blend it up with my trusty immersion blender,keep my probiotic in the fridge,wash my greens that my mom,tie my hair,use one tablespoon of unsweetened cashew nut butter,do my clothes,walk in the early evenings,hydrate your skin,sit on the couch,start a series on this channel of cleaning really dirty things,,cook automatically personally like my veggies only lightly,see next friday,,put them,,stain it,,use raw honey,,start on dinner,,,get right into the corners,,add my essential oil mix,set your stovetop to anywhere from low to medium heat,put it all over my entire body,,wipe down everything from our counters,apply super serum,take everything off of the glass with a little bit of elbow grease,add another score or two,
assemble all of your veggies together,cut the top,make my absolute favorite green smoothie recipe,warm them up,replace their rug,blend,fill the rest up with the frozen mango,simmer for about five minutes,add these,take a bunch of lemons,add the sauce,left over to dry in the sink,do on the right foot,move over here to some fruit,add that to your pan with cups of milk,cover in succulents,slice cucumber,do my hair everyday for dance,grill something else,move on to floors,smell good,attach it with a hot glue gun,make it,head out of my room,mix our ingredients,get my notebook,smash up the avocado a bit,put away,add the tofu mixture to the veggies,rinse them,make it a little sweeter,go to my gym,give it a good whisk,add a little bit of honey,,,create au bed,,blend in all like the edges,,,use dry beans,liquefy that for about seconds,,roll my last one up,,add a really good crunch almost like a sunflower seed,massage your kale,make kind of a bowl or a big salad plate with lots of different components,saute some onion red bell pepper,make my bed in the morning,put in the microwave,go ahead,try to spray,put this stuff away,,,,sit down for a few minutes,put the bowl,throw pillows,leave a comment down below,get out of bed,get up out of bed,commingle in there,rub that in,melt,use bare minerals best skin concealer,use a instant bronzer,throw on the table,write items for this list,,,use one saucepan,do my hair,dig right in,,rinse it off,organize more,light a candle of the same scent,add that in,smell really good,melt,add your onion,,go over each area two or three times,do a big clean of my kitchen,print out every recipe,slide them between the two pieces of cardboard,use this on all of my bathroom,,blend for about one minute,give it a good shake,,get my greens for the day,add in any nuts or seeds,prepare my rainbow salad,do all of my foundation,put away all those bags,stir it up,go in the oven,wipe down my counters,look over to my sock drawer,,toss gently,get all your nuts,bake soda,dim the blue light,add your stock or stock concentrate,spread the granola out,cut open my avocado,fill in any spaces,eat dinner,see a nice clean sink,use my creamy lemon ginger salad,highlight the inside of my eyes,place your first one near the end of the tube,repeat the same thing with your second piece of page fold your corners up,,,throw in a pinch of ground vanilla powder,come down a little bit,put some lavender in there,make sure the water,work on my list,help the sweet potatoes,,make it super creamy,mix it it,top the hummus with some cherry tomatoes,color to the cool whip,use this method surface cleaner,use one tablespoon of unsweetened macadamia nut butter,,lit on top of the raspberry jam,get out of bed,bake my potatoes in the microwave,keep in the fridge vitamin b,stick a little paper towel in there,brush my teeth,add good protein,make a bed,put on my hat,chop celery,chill out on the couch,remove all of the product,,take those out after about minutes,,,vacuum our couch,,paint it,,soak in the fridge,,pull a bunch of different recipes,,,get those cobwebs,,fill the rest with water,show,focus on my arms or the areas of my body,,cut them in half,head downstairs,put a little bit of bar keeper friend,start to clump together,
add some olive oil a little bit of apple cider vinegar,insert them through both holes,,make sandwiches,use power washers,add some toppings,put in our frozen banana,use half the amount of the cinnamon,stir it,deal with fresh lemons,add some nutritional yeast,work in stages,plan my day to minutes,buy for the pantry,turn on,put it,put mixed nuts,apply some us lip balm,put a lid on top kind of speed up the process cuz coconut flour pancakes,dump it on the walls,try different products,cover other school supplies like binder clips or even pencils,fry up these vegetables,meditate for minutes,whisk until it,rinse off my face with their cotton gentle sensitive skin,top it with some sea salt some black pepper,tidy up after,call for in the recipe,add them to your hot oil,see the oats,consists of one of my cotton on body sports bras,add your blackberries into a bowl,give it a really good shake,,,put a large tree in the middle,,blend in this dark color,,,add half an avocado for some good healthy fat,add some vanilla stevia like about three or four drops,,,,top it off with some hemp heart seeds,throw some olive oil lemon juice on there,drink some kombu tea,add some of my corn beans,keep everything clean,put it on your lower abdomen,hang it clean against the wall,sweep the house obviously with hardwood floors,wipe all of the surfaces down,,,,pit for olives then my favorite salad,prepare all of your food for the next day,close our blinds,pick up,do my makeup,watch clueless this morning,add one cup of filter water two cups of apple,buy this one,pull that off the double boiler,apply some concealer,,put boxes,make your bucket list,,,set it aside,take any extra time out of your morning,got my fork here,,apply to my skin,see some garage,clean the sink now,make your own salad dressings,make my hair a lot smoother,stir okay,slice up our onion,,do this in the morning before your workout,cover with a little bit of water,keep my master list online,wrap the yarn,wipe down my countertops,,use a fine mesh strainer,add that teaspoon of spirulina powder a full tablespoon of nutritional yeast,,head to the kitchen,wake up to some fresh oatmeal,throw it in a bowl,finish my food,put them in the basket in the laundry,do some sauce,distribut throughout the muffin tins,wipe down my barstools,open up my blinds,,give a really good coating to your mushrooms,see guys the next video,add whatever essential oils,remove makeup,put it into a solo cup or a plastic cup,take a greased cookie sheet,scoop out the avocado into a bowl,apply this product,go back upstairs,use the same spray here,chop it up,put that on,continue this process all the way down the length of your stick our nails,use colored tape,,,use quarter to half a cup of water,meet the mark,diffuse the scent into your room,head back,accomplish that day,cook vegetables,,stir that up,stir everything up,add the main ingredients the hummus,,use my switch our water,add teaspoon of pure maple syrup,,put them both in a little bowl maple syrup,put on a christmas playlist,use microwaves,,work on dinner,use warm water,use almond butter or natural peanut butter,,go around my neighborhood,make your own,watch a little bit of,find inexpensive ways,,set it,,,make our bed,,create holes in the wood,,add some nuts or nut butter to my oats for extra protein,,heat up a saute pan,,,get on the walls,,mix this together,look nice,use the vitamin c peel pads for my face,,last a little bit longer,go out back into my bedroom,,mix in our activator,
add in some whole fresh organic strawberries,use this old shirt,,give specific compartments,put a link down below to the most inexpensive best power washer,add that to a bowl,take one full banana,stick now,see the blueberries,add other flavorings to it,,use my spray,use pens,leave that on the counter,top it all off with a little bit of honey,add life to really any place,dry apricots,go to hairspray my hair in a couple of spots,put my roasted red pepper on there,use a sprayer,,make projects,add the chicken,include in my morning routine,form a solid,moisturize,use some whole rye bread,grab all of those things,do a couple of grains,make a hash,make breakfast,jump straight into,crush up the blackberries,put the top on,,,adjust our measurements,,use this,,,soak overnight,dress this salad,,,,take my coconut milk yogurt,get my hands in there,get in another glass of water,simmers for minutes to an hour,put everything in the dishwasher,go to the drugstore,take a cloth,divide the laundry,clean up a space,,,,dress recipe a squeeze of fresh lemon,sit there,,,do my makeup,snuggle in bed all morning,try this super easy banana,put a little bit of serum on a light hydrating serum,make a diy lactation support cooking mix,dust this,,clean up,write those things down,,,add to cloves of garlic,list a whole lot of things,pour one big spoon of your pancake batter onto the skillet,,get a little water on your skin,organize tips,clean surfaces,make my three creamy and delicious detox salad dressings,put the dry shampoo,lick his hand,reduce for a few minutes now,,brush upwards in long motions towards your heart,use water,add the descriptive columns,take our scissors,rinse out with water,,use filter water,mix that all together,,jumpstart my hydration for the morning,reheat it in the morning,scoop on your cook quinoa like on a salad,clean wipes,pick up all of the dirty clothes,put on top,prepare mine with avocado,use the car shammies,go on my phone for a bit check instagram twitter snapchat youtube comments,,chop them up in large pieces,,sift it,do my skincare routine,cube chicken into a pan,stir it up,add the full avocado,apply it,take my dance bag,wipe down my table,,use this highlight duo from sigma,take your tube,wrap it around the top,,,add a few ice cubes,get your wood cut,pour them in a pot with some water,remove them from the bath,take out my planner,get a glass bowl,,add some natural sweetener,see guys next time,wrap it,,use a vacuum,use almond or cashew nut butter,,take some maple syrup,toss pumpkin,bake potatoes,,get crispy on all the sides,wash my face with cold water,add a tiny little pinch of sea salt,,assemble my fajitas,buy your favorite hummus from the store,wash off this face mask,tackle those areas,,take my dog to dog beach,,,dust part off,,stain this,,top it with one flat teaspoon of unsweetened almond butter,,make enchiladas,,,do silk plants,,add tablespoon of vegetable glycerin,flip over on each side,follow the instructions,,work for cleaning,hydrate,,do when it,
start off with one cup of ice,insert about three,,pour a little bit of hot water in them,,make a smoothie bowl or an acai bowl,use half or full banana,give it a little,take our pot off,put them in an ice cube tray,,do the deep clean,set myself up,got these hillary world best veggie burgers for us,cover it for about to minutes,fill this to the brim,make it a little bit healthier,put them in my bun,slice it,rewet,,transform your desk accessories,add your veggies a few canned ingredients your barley,,,use the gentle clean gel,write down the most important things,,do,add in my white onion bell pepper,add it,work on,give it a good shake drizzle it all over your salad,stir,,,reach into the middle,,come back,,,store my avocado,add some avocado,,,,have a little bit of coconut flakes,throw everything into a blender,chop my vegetables,sprinkle a little bit of cheese,fluff my pillows,depend on the wattage of your microwave work,stain specifically for this,put fabric softener,empty out the bins,,,,make it from scratch,,,,set everything,snuggle under the blanket,combine it all thoroughly,get that at lush,make it,do a little bit of eyeshadow,,make over my little bookshelf,flip the jingle bell over,,,chop garlic,do some body brushing,use a nonstick pan to two minutes on each side,,rub it sometimes,do it,bake soda generously at the bottom of your sink,,look nice,,add about half of your cilantro,,use a brush with natural,rinse that same rag out with water,store my online recipes on pinterest,secure it with two knobs,use my dollar tree cloth,,take your milk,add a little bit of turmeric to my scramble,,eat my breakfast,stick to the edges,add in your ripe avocado,fit into a taco,take out the rubbish,try it,reheat these,clean our stainless steel,put on a huge warm comfy sweater,,add your salt,,use a little tiny bit of essential oil,brush my teeth of course,finish that off with the juice of half of a large lemon,add about of a cup of water,load up the avocado,do one coat,take an pill,clear off the counter,,take this random mascara brush that,blend of black eyed peas brown rice,turn the noodle over,,,make yourself a banana strawberry peanut butter smoothie,use my miter,bring it down to a simmer,do it together,do an entire video about my planning process,add some kosher salt,,use almond or cashew nut butter,use your fork money,measure out half a cup of hummus,,use my lysol wipes,add some ice cubes,,put one generous tablespoon into the bottom of a little glass dish,measure out of a cup of the pumpkin puree into a mix bowl,do that,,make a salad,drink my tea,add a little bit of unsweetened almond milk,,heat them up,use august containers,lay on the couch for a little bit,pour a bucket of warm water over all the walls of the shower,,play first right after this play,,,make it,,do a very light brushstroke,,sit down,,saute vegetables,,,take off the cushions,,use six drops of frankincense six drops of cedar wood six drops of wild orange essential oil,add a little bit of organic butter,use the cc cream,,put all of the dry dishes,head into the kitchen,,yields great results,
add about seven,push the strip through the ball,,organize your supplies,,use olives,do a video on my smoothie preps for the week,stick to the bottom,melt into the pot,use one or two of these cubes,,turn on our electric fireplace,change the reading,get a coconut milk version ice cream,reduce it to a simmer,fill with succulents,include it,make sure that my hair,lower the peppers,rinse it off with water,,make that math homework a little less painful,freeze so well,,,use the hydrating daily facial moisturizer,look over my list for that day in my productivity planner,,see what this,drink our tea,add two teaspoons of chia seeds,use the qv intensive super dry skin body,shake for good measure drizzle it all over your salad,start with our chocolate banana one my bananas right on top,,,do,,blend brush,,,obsess with it,add some sockeye salmon,,,,use ground chia seeds,throw on that butternut squash roasted butternut squash,chop all these up,cut up strawberries,throw the cushions around,make one yourself,imagine exactly what,turn it on,clean off the table,,,,add a quarter of a onion,,,,do the full face,add a little pinch of cinnamon,put a layer of cranberry,take that with a nice big glass of water,put some more of my tips,use this honest beauty in the shade treaty magnetic heather mauve,,chuck them,take a bucket,,,stir it together,take a long time,try them out,,exfoliate at the same time,empty this out,stick it right in the garbage disposal,,use my macadamia nut oil on my damp hair,,put our garlic,,take a shower,see clean,make an entire video about it,stick these on about anything,wipe down the mirror,,add a little bit of flavor,add my cumin,,chop that up,add on a little bit more maple syrup,,go into the bathroom,do a proper kitchen clean,use chicken broth,set aside some,wipe down,put on my contacts,,line cookie,,rose essential oil,use an oil,fry some asparagus or veggie of your choice with some ginger,make my quick oats with pomegranate,mash it up,do my hair in that case,do some skincare,clean off,,straighten my hair,customize these,place the first piece inches from the end of your noodle,,,make a smoothie,hold it in place,got it to a boil,do with this room,write down all the reasons why,roll them up long ways,,use either a teaspoon of pure maple syrup rohani,give this one a try,measure it out,,take toys,add half a cup of water,,use a fuji apple,blend it up in my nutribullet,eat them with the skin on that,,put them on this grate,drink at least two big glasses of water,sit down,,make vegetable fajitas,take advantage of them,pop these two in,do it on a tiny budget,,check that out,,,do it,,make it a little bit more stable,,make breakfast,,add some vegetable broth to it,,,cleanse the microfiber,,make some pumpkin spice,put about a spoon for each pancake,use a foundation brush,,add about a tablespoon,head outside with my dog,,add in different ingredients like this gold glitter slime,
take it with on the go,braid those together,,pack your kids lunches,,add a little bit of sweetener,take our fruit,sprinkle it over top,do about half a teaspoon,,,write on it with a sharpie,get ready,got this little orange juice,add my toppings,stain these pieces of wood,add some pomegranate seeds,head right into my kitchen,spread some vegan mayonnaise on there,do all my other cleaning,,use a small pair of scissors,find it really helpful,,,use it,go on instagram for like a minute or two,,looks like,wear beautifully,add to a jar,wash my face,pour it into a glass mason jar,sprinkle of nuts,,,rethink our shape of the bed,,start up here,,,prefer iced tea,use the hazelnut or vanilla one,,,,top it off with some of the granola,blend it all up,cook it,watch a little bit of tv,fix my cushions up,do a little,know,mop,make everything look nice,,,,give me that little afternoon perfectly sometimes,,,,do a little bit of bronzing,show guys my recipe,try these tofurky slices,take my prenatal one my vitamin d,bake soda,use this lightest shade,,unpack shoes clothes,jingle bells on our tree,,,add a little parsley on top,increase energy,thank,,exfoliate your skin,,scrub it with a toothbrush,,use the beauty water,,add our chicken mixture,,change into my outfit for that day,polish your stainless steel,involve two components electronic,prune it with some scissors,clean it perfectly with water,,strain it,add about a third of that package of the silken tofu into a nonstick pan,,get my coffee ready,,,remove my makeup,give everything a vacuum,make a bowl of pasta,take oatmeal to the next level,leave your couches,use a mint aos,,break up the mushroom,,choose whichever one,spritz a little lavender pillow,put a large container of this aside,mix it together,use a back of a spoon,dry naturally the rest of my hair,dance,put things away,,brush over my hair,make long ones,wear sunscreen,,,blend it up,put my frame in place,add some carrots,move into this house,write in my gratitude journal,use a sharp knife,,use berries,,make a really nice little shelf like a checker shell,,round it out with clean my floor,use the banana,,prep before,pierce it with a knife,stick them with a fork all the way around,,add some of the greens,go from the windows,use fresh blueberries,,make dinner tonight,collapse them,pop in the tomatoes,,,,,,move on to my master bathroom,,put some really light things on the shelving like a few towels,,eat it straight out of the jar with a spoon,,coat the bottom of a nonstick pan,,,use my hose extension to clean inside of them,,cool down for a few minutes,use a ladle,use this jesse j palette by makeup forever,,fill the rest up with water,throw basically whatever into the blender,,play with,
blend that all together,melt together with an oil like vitamin e,,set aside a drawer in your kitchen,,make chocolate chia pudding,use the fresh banana,stir next,take some walnuts,,,take that upstairs,,got some gerade kombucha for me,sprinkle it with some cinnamon,match wood,dress on top,put on some deodorant,put on the lid or the top of the sandwich,fill it up with water,,show these projects,cover with aluminum foil,,,use organic,look over my list again,,drop this whole thing,happen pretty much every morning,stir another oats,cleanse it,,sprinkle of almonds,,,push it into the ground,,do this,,,blend all of that up,pour it into my mug,,,,add our second layer,add the cucumber celery cilantro green onion,use a carrot,make tea in the evenings,vacuum my rug,fall out,take a dremel,try to steam the floors every three days,put it away,,,,add garlic,,,,start with my foundation,add of a cup of rolled oats medium banana,shake that up,put it on a plate with some peanut butter,go ahead,use the viewfinder as a mirror,,washed everything up,use a pen or marker,,,open a can of white beans,apply a moisturizer,make these pumpkin protein,,use a skin brush,,clean the floor it,,add it to some hot water,,lay out your clean asparagus onto a piece of foil top that with your fresh salmon note,,fix any kinks in my hair,wipe down the stove,set up a calendar,wrap it around the middle with the frame,wipe the entire mirror down with the water,,use a nut bag,got spirulina powder some nutritional yeast some cumin some black pepper,,add some almond milk to my travel mug,,,get off my makeup,do all those kinds of things,add a little bit of water,put a lid on top pop it in the refrigerator overnight,works really really good,use this face,,toss it,,reduce static,finish with a lip balm,mix this all up,chop it up into little bits,mash up the avocado,use the naked palette the good old naked palette in the color buck,do this mud mask,vacuum at least once a day usually twice a day one,,wear this like strap tank top from urban planning,sounds like a real rain stick,protect their little skin,,,add water,screw it in from the other side,see bone broth at the farmers market,do our own thing for a few hours,put in a good mood,pull it down the stem,,add sweetener,,put a few onto each little rest,,take them to a donation center,add about a quarter cup of water,,cut one whole apple up,crack the two eggs into the mix bowl,poke holes,,got a little nonstick skillet with a little bit of canola oil spray,slip on water,use kale base for my salad,,wipe down of the countertops,finish your lunch,take it out,,,,,,wipe it down,,fix on the hardware,,sprinkle of sea salt,,add all of these veggies,,,cleaning windows,,add a few other ingredients,pour it on the same pan from anywhere from low to medium heat depend on your stove,blush on,,wipe down our stove,head into my office,,play with it,
