5p0_5mini,1p1_4mini,8p1_4mini,9p0_3mini,7p0_3mini,8p1_1mini,10p1_4mini,10p1_7mini,10p1_5mini,5p0_6mini,2p0_10mini,7p0_8mini,6p1_8mini,2p0_6mini,5p0_4mini,1p1_8mini,5p0_3mini,3p0_4mini,10p0_5mini,4p1_6mini,1p0_5mini,9p1_8mini,7p1_3mini,6p1_10mini,9p1_1mini,6p1_4mini,8p0_5mini,6p1_2mini,2p0_3mini,5p1_6mini,8p1_7mini,6p1_3mini,10p0_8mini,9p0_4mini,6p0_9mini,7p1_8mini,1p1_5mini,6p0_7mini,3p0_2mini,7p1_6mini,9p0_8mini,5p1_3mini,3p1_5mini,10p0_4mini,9p0_1mini,7p1_4mini,10p1_2mini,10p0_6mini,2p1_1mini,5p1_5mini,6p1_9mini,1p0_3mini,1p1_9mini,1p0_9mini,6p0_1mini,2p1_10mini,9p1_7mini,2p1_5mini,8p1_6mini,6p1_6mini,4p1_10mini,6p0_10mini,6p1_1mini,8p0_4mini,5p0_9mini,1p0_10mini,1p1_10mini,8p0_9mini,1p0_4mini,6p0_6mini,4p0_8mini,7p1_10mini,9p1_5mini,5p0_2mini,8p0_3mini,10p1_6mini,6p0_4mini,8p0_8mini,7p0_1mini,7p0_6mini,10p0_9mini,1p0_6mini,9p0_2mini,5p0_10mini,7p1_7mini,8p0_2mini,4p1_2mini,9p0_7mini,9p1_10mini,4p1_5mini,2p0_7mini,9p0_5mini,2p0_9mini,3p1_2mini,2p1_3mini,10p1_10mini,10p0_2mini,6p1_7mini,6p0_8mini,9p0_10mini,5p0_8mini,4p1_3mini,3p1_1mini,6p0_5mini,10p0_7mini,10p1_3mini,1p1_2mini,5p1_2mini,5p0_1mini,2p0_4mini,10p1_8mini,1p0_8mini,3p1_6mini,4p1_8mini,10p0_10mini,3p0_1mini,9p1_3mini,9p1_4mini,4p0_4mini,2p0_1mini,8p1_3mini,1p1_6mini,9p0_6mini,1p0_1mini,5p1_1mini,2p0_5mini,4p0_3mini,8p1_5mini,9p0_9mini,8p1_2mini,7p1_2mini,7p0_10mini,8p1_9mini,4p0_5mini,2p0_2mini,8p0_7mini,2p0_8mini,8p0_6mini,2p1_7mini,8p0_1mini,8p1_10mini,6p0_2mini,5p1_10mini,10p0_3mini,6p1_5mini,7p0_4mini,2p1_8mini,5p1_8mini,9p1_6mini,7p0_5mini,4p1_1mini,7p1_9mini,1p1_1mini,9p1_9mini,8p1_8mini,8p0_10mini,2p1_4mini,2p1_9mini,7p1_5mini,7p0_7mini,7p0_9mini,1p1_7mini,10p1_1mini,1p0_2mini,7p1_1mini,4p1_4mini,5p1_9mini,7p0_2mini,9p1_2mini,4p0_6mini
add your fresh chicken,make him some breath cookies,share my green detox smoothie recipe,simplify the lunch packing process,use it,lose weight,break that up,rinse them really well underneath the kitchen sink,stir cinnamon,add a frozen banana,chop up the onion into little pieces like a dice,do every single day,water my plants,got these button mushrooms,find my healthy recipes,put some rocks on the very bottom,add shredded carrot,go over to my desk,add this,put the mattress underneath noah bed his bed,add a little bit of water it,get ready for back to school,stick this right in my recipe binder,write lists,involve in things around the house,watch the sun,head straight into the bathroom,hang it somewhere in your room shoes accessories,make a tofu quiche,brush out my tangled mangled hair,bind all of the ingredients together,get out of bed,add in all your ingredients into a blender,use oats,clean your own homes,add your flour little by little cover,make a garden bed,got as a sample bag,start off by prime my eyelids with the painterly pro longwear paint,roll it a bit,blend up my sauce,infuse honey,pour that into the water,get right into the recipe,use strawberries,make it yourself,pack them in simple mason jars,roast the butternut squash,get rid of some clutter,put on my pjs,look clean,do tips,add the scent,stay clean,give it a thumb up,got some vegan mozzarella,give it a mix,recommend a smoothie,crack two eggs open,grab everything out,left on the stove,film the entire thing,cut my coffee machine,set an alarm,use three to four limes,make super quick chicken tacos,look into that website,drop my toothpaste accountants,put on my makeup,hang them all out on clothes horses,use construction paper or circle cutouts,mix it,add a little liquid detergent,make a quick sauce,wake up,add in your vanilla extract,clean off my entire office space,remove that,get my house back under control,rock out to here,continue with the detox theme,take a comb,add my vegetables,get into my favorite dinner recipes,put in a ziploc bags,focus on my main goal for that day,get all the dirty dishes into the sink,develop a recipe system,stack your two pieces,take my sheets off,add about a half of the diced onion to the mixture,use almond milk,stir it up,give guys the very request summer morning routine,do a little bit of journal,try this recipe,squeeze lemon,close my books,do kind of like another vlog,eat our veggies,use onion bell peppers,decor or redecorate,make these videos,go into my system,throw in all your ingredients,show,make diy,use all of my fresh produce,cook these accord to the directions on the package,got a cup of a cup of pumpkin seeds,use ezekiel bread,start with my ecco bella day cream,get home,put some things away on our counters,place this into a large bowl,blend it in even more with my beauty blender,make your own,gather up eight strips,take your castile soap,add as much or as little,show,start first with the diy frames chalkboard,comment,clean up after dinner,use a satin pillowcase,cook our quinoa,have lots of yellow in it,eat it,go through our ingredients,add a bit of avocado to my green smoothies,put the ice cream on the top then more sandwiches on the top,clean off the mat,make a healthy blueberry smoothie,pick the color espresso,use soy products,share my holiday morning routine,make her massage kale caesar salad,make my bed,get the salad bar like the buffet bar,get out of bed,eat in a day,remove all of that fluff,play all different types of games,chop red onion,get yourself ready for the super busy day ahead,use this right in your shower,see my pizza,start at this stand,stir the boric acid,use vinegar,go through the house,wash your fruit,remove a few of the spikes,punch through,bind all of the ingredients together,apply with my fingers,make my favorite protein shake,recommend that book,cut up really finely,listen to music,keep my routine really simple,have some water,peel it,do in the morning,add spoon of mixture,empty everything out,sleep,spread this on the dirtiest parts of your oven,make slime with kids,give all the information
add one teaspoon of apple cider vinegar some salt,add some ingredients to a food processor,add to my green smoothie,found really helpful,put product right on it,add a little pinch of vanilla,go to kind of swirl that around,put everything,add a pinch of sea salt,use some sliced bananas some protein granola fresh sliced peaches,use a red pepper a red onion,set me up for success for the next morning,fit into my morning routine,show,eat healthier,work with wood,put them in your tupperware,put on my spotify music,top it off with my homemade almond milk cream,take off the bedding from our guest bed,cleanse my skin with the clean oil,show three super cute diy projects,find it handy,head back downstair,find crafts,come through my windows,hit the snooze button,take with me into a container,celebrate anything else during the holiday,put on my awesome pink slippers,add some nuts or nut butter to my oats for extra protein,mix my coffee with a little bit of soy milk,use my vitamix,make life with kids easier in the kitchen,do a little bit of every room,add powdered sugar,cut them with my miter,keep these,do one eye on camera,put the chocolate near one of the corners,got my pasta on the stove,add a little bit of vanilla,mix it up,throw everything into a food processor with your olive oil,put in our strawberries,add the coolness microwaves,blend everything up some frozen banana,shake it up,tidy up,head over,get a cleaning routine,make from a great herbal shop,decorate it for the fall,jump right into my cleaning routine,remake over everything,come in a big block,start some flour salt vegetable oil cream of tartar sand,put some powdered peanut butter,serve them on top of my toast egg on whole grain rye toast,go straight into this little box bin thing near the front door,take along with me,inspire to clean,use a little bit of soy milk,drink some water usually a glass or two,put it through my garlic press,cook dinner,found my breast pump,show,apply my cc cream from it cosmetics,wipe down the little tray,cut that out,get messy,mix it all up,chop garlic,keep drinking water throughout the morning,take your two eggs,make a little bit of a mess back on my desk with like no cards pens,share the products,renov my dining room,start with the top of the cabinets,create over the last few months,use this coconut water shampoo,make mac,start this first recipe,break apart,fill up a tall bottle or tall glass of water,load our dishwasher at least once a day,make life of kids easier in the kitchen tip number one,use some cardboard,climb into a freshly make bed,stir it up,make homemade almond milk,cut oats with of a cup of water,give a thumbs up,eat or drink at this point,add in all the other ingredients,shake it all,come home from somewhere,take my camera around with me,do a pasta sauce with hidden veggies,chop,make sure that my space,make sure,keep it clean constantly,emulsify all the ingredients together,control it,suggest which a lot of people,make a veggie sandwich,prep your oatmeal,add a third of a cup of water,use earth balance for my butter,use concealer,open up my fridge,tidy up before luke,add in your butter lettuce,use my maybelline mascara,use one from an aluminum foil roll,cut through,get all of your soap,add a little extra bit in there,show three healthy breakfast ideas,decorate the boys rooms,talk to guys about how,share with guys what my typical routine look like every day,get up,take the quinoa over to the stove,get like cards from the dollar tree,make oatmeal,share the recipe,add of an avocado,put them on the bottom,follow up with a magic eraser from the dollar,add one banana to my blender,wipe down,chop up some lemon zest,wake up,fill up the water,got this,get there,snuggle a little bit longer,mix,pick up tiny little bits of white fluff,found this game,add in your cumin,put on a face mask,drip down,check back in with guys later,find that cost a lot less at the farmers market than at the grocery store this bouquet,start white glue,work from the top of the room downward,start out in my kitchen,find all of the rollbacks,drill two large holes,line up your holes,add that to a jar with half a cup of water,add a little bit more underneath my eyes,blend the vanilla,take charge of your fertility,use reusable grocery bags in the deep freezer,pick up this one dollar spray bottle,get my makeup,incorporate,use a whisk or whatever like,clean my skin,add the egg,watch my cleaning videos,wake me up naturally,do this in scrub vigorously,use this really pretty teal color,offer a giveaway to my wonderful subscribers
put together a slightly healthier mayo combo,make them,use fresh or frozen,get a bit overwhelming,stick them right on,use half a cup of frozen blueberries,break the eggs,show exactly everything,use some cinnamon,add a lot of other ingredients,add some salt,take all of the dirty stuff,cleaning for example,chop up in my for smoothies,watch this video,found this on my property it,try them,do my hair for dance,add in my dry ingredients in a sifter,clean up our upstairs area,left in there,hold the iron on each patch for a few seconds without any patch for a few seconds without any steam,do it on a dime,plan out my day,add about an eighth of a cup of liquid detergent,take that coffee,set my alarm,set aside some into a container,use it on eggs,wash my face with a gentle cleanser,add that to a jar,show in this video in the description,blend until smooth,work for this recipe,put things away,eat it for me,drill into the larger pieces of wood,get through all of these products,use the pure in nada natural cosmetics eyeshadow palette,use a knife,add the avocado right into my blender,combine the tea with the warm froth milk,fill up my glass halfway with room temperature water,pulse everything up,touch it lightly,shake up your bag,use one full banana,stick that right into the oven to roast,meet my water with lemon,do my meal prep,do an actual deep clean,do custom blends,take this sea glass it,make your bed every morning,make my bed,got some more beyond meat burgers,play in the sand,explain to what,make fried eggs,walk out,put away all of our clean dishes,got some cleaning motivation for today monday video,go in,brush my teeth,toss this all together,get my son ready for bed,ship it right to my door,frizz up a little bit,use the it cosmetics concealer,go through,share a diy christmas tree bucket list,,pour it in on it,flake teaspoon of pepper,drink plain herbal tea like rooibos tea or green mint tea plain,crack them into a small size bowl,got this delivery earlier today,start the first thing,look clean,dance every time,share them with guys,get rid of any knots,boil in my steamer,make our chicken really flavorful,,do anything else,move on to the dishes,go through the motions of dinner planning,place it,chang out my sheets now,add to the mixture,take your whole almonds,add a little bit of vanilla extract,do more morning routines or videos of this sort,show,use ground cinnamon,pour everything into a mason jar,take my jacket off,clean under my desk,eat veggies,chop up your fresh herbs,start out in my kitchen,leave a like on his video,do things like that,give everything a really good shake,add a bit of honey,do this in their home,put whatever veggies,get out a muffin pan,add my flavouring,use one avocado,use this one,add in this like collagen stuff,put away our pineapple juice,go to first start by and shred up your kale,curl my eyelashes,add our nails,swim these,put this into a glass container,got some pure ohio maple syrup,add some natural sweetener,paint an entire side of your wall chalkboard,start today with an essential oils,clean up right after,wake up naturally with the daylight,add this better than bullion vegetable broth base,found from the dollar tree,cook the oats for an extra few minutes,add my sage,use half a cup of coconut water,make an ice cream cake,run through the baseboards really quick with a dryer sheet,make the smoothie really creamy,get granite countertops,take the edamame beans,brush my teeth,add some vegetable bullion,get back into bed,explain,bundle up underneath a heap of blankets,add about a quarter teaspoon of cinnamon,vacuum at least like two times a week,talk about this game at this point,throw on the lid,use the tea miralax tea,clean out a shower or tub,get pizza,get some fresh flowers,use shave cream as oppose to gel,use a dish cleaning,get everything nice,lay it out,put the toothbrushes in it,adjust this slightly for smaller or larger hands,absorb water,brighten up my mascara time,put it with some water,recommend that book for any female,,slide out,work on laundry,put that over a pan,use a whisk,remove cream cleansers with a damp cloth,mix it,use the meyers peppermint scent,see my room,clean some ovens,do a slime segment on the today show icon,see it
mix that all together,add a little bit of water,add some fresh cucumber,do that every single day,do it super carefully,use ground vanilla powder,break up the eggs super quick,grate,take our lid off,get your fruits,saute my vegetables in water instead of oil,clean up the living room,plan my ideal morning routine,chop up in my quinoa salad for lunch,come up with ideas,found on my property,works best,pick out a shirt some shorts,throw in some vanilla extract almond milk,clean up our playroom,wash it,personalise your backpack,link down below,wash up all of my dishes,pour cup of corn starch into our mix bowl,do a few things each morning for last few months,brush my teeth,make entirely new food,give it an eggy flavor,use a product,use fresh,do either upper body weights or lower body weights,add in a little bit of lemon zest,find ways,got really bore one day,,get long pieces of wood,get rid of some of the products,put this all over my eyelids,cut into squares,add all of my sauce right in there,brew your tea for depend on the type of tea,squeeze the juice out of a lemon with my little lemon juicer,use original kalamata olives,blend it,add your butter,use the unsweetened vanilla almond milk,drizzl a little bit of coconut oil,make a protein shake,post a video on how,make your bed,visit in the san fernando valley,make a bunch of candles for a very little cost,fix the bed,scratch the side of my bed,got some vino,combine our dry ingredients,put an ice cube in it,sprinkle a little bit of sea salt,put everything like your handbag your books your diaries,put away the news,give your house a good spring clean,work or go to school,head into the bathroom,cook this on low heat in your oil of choice garlic burns,do the dishes,take all of the parts out,got some peach,use a few matte colors for around my eyes that light brown color,wipe down all of the surfaces,draw out the shape of your tree,,pour a solution into a container,add cup of ketchup cup of honey cup of soy sauce or bragg aminos,breathe in fresh air,add in your pureed pumpkin unsweetened vanilla almond milk,move it over next to the couch,check out the products,do other spots of the house,include some footage of me,slather your greens with salad,get them out,add cup of water to a blender,set that aside,,make an effort,load,figure out how to meal plan,draw or trace a circle onto your cardboard mine about inches in diameter,film this,grind of black pepper,show,add it to a bowl,,see a little bit of my morning routine,use the stick,add the olive oil the apple senate of apple cider vinegar maple syrup,throw my hair up in a messy bun,put away things,get presley these peppers,caramelize for about three to five minutes,film this,give it a like,make a bed in the morning,throw in all your ingredients,hang with my greek yogurt banana,switch to a lot more green options,line with the produce bag as a mini trashcan,go to town with whatever your favorite toppings,add half a cup of coconut of a cup of flaxseed,poach two eggs,share with my current makeup routine the products,snapchat,start out in my kitchen,kinda left mine in larger pieces,watch netflix in the background,hammer it in,use rocks,,shake it up,chop up pink lady apples,paint the wall,give that scent,share my night,keep my second day curls intact,boil it,get this at the dollar tree,cook half a cup of dry rolled oats with two cups of water,get a nice sizzle,use plain water too,make this,spray the bed sheets with natural scented spray,add one flat tablespoon of unsweetened almond butter,do the granite countertops,put them in the food processor along with two tablespoons of tahini,make a cup of tea,zest a lemon,make my bed,get some food,fall asleep,add healthy fats,get on top of them that fluffy rug on my floor,sit down,add the red onion cilantro the spinach garlic my jalapeno pepper spices lemon juice,keep in a little basket underneath as well,run this along all of the grout lines,,get these veggies,make the base of our slime start with three tablespoons of white glue,make a great shower door cleaner,get the dishes,customize the selection,do a monster rock,use a needle,prepare my oats,look my eyebrows,see what else,increase my anxiety levels,,push your bed back into place recently,play with the boys,use a bowl,take the whisk,share with guys,,put back,lash extensions,wipe thoroughly,use a clear glue,use that one lately
chop your pecans,put small balls on a baking sheet,make the smoothie really refresh,put things like pretzels,run it along,use frozen berries,add a little bit of crack pepper,pour in your water,stir it constantly,get your greens,chop these veggies,do the laundry clean up,water my plants,got two sweet potatoes,grate gruyere cheese,make a succulents,tell this off,brush up my hair,throw on the pancakes,put in one part dish soap to one part of white vinegar mix it up,use a little bit of that into your skin,iron it on my mom,go gaga for this,mush together a bunch of different ingredients,add the shave cream,allow yourself some decent time for your morning routine,leave my phone on the other side of the rooms,stick with a whole lot of hummus in a container,make this recipe,put on this cool velcro headband,add half a cup of frozen blueberries,make breakfast,blend up,take your oats,chang around,,drill the screws into the four corners,throw out this kevin murphy one,put that all over my eyelid oh also,bake the guys,stir alright,brew off my tea,mix it up,scrape it down,line them with a little bit of parchment paper,sprinkle on your brown sugar,do about a heaping tablespoon,do this to my back,take the opportunity,pick out by the name alone,keep my apartment,blend that,stain them front,make the bedroom look really clean,start again,go on a walk,mix,show what,top my salad with of an avocado,organize your morning routine,get all of those,clean up your house,found that,drink water in the morning,go with six cloves,take showers at night,put the membrane on the valve,wash my face,apply your eyebrow powder,wash out in my living room,cut out a bunch of circles it,,put it in a double ziplock bag,trim green beans,open a window,add our pumpkin pie spice,burn myself with my curling on the other day,put oils,work on a space,do the knobs with the bottle cleaners,make an extra batch of this one,go under the hair,puree them,cut our chicken into cubes,,drink this plain,load it every single day,collect recipes for decades some,make a pretty large,start to dry dust our furniture,stir that up,put them in a bowl,add your spirulina powder,,wake up,add in the coconut milk maple syrup coconut oil almond butter,squeeze half the lemon straight into there,make myself some food,wipe down,dump those in,chop up all of your veggies,get on into it,do a collab with jt,put my dishes in the dishwasher,run them under water,sprinkle them on,have tons of different ideas,eat my dinner,put my favorite trail mix,mix all of that together,boil or simmer some hot water,found what work for me,go upstairs,clean around the house,make it,put on the elf foundation brush,make beautiful things for my family on a budget,give this little guy an eye,,get some more,add a little bit of cinnamon,get a little bit of decor,break with the oil in it,jump right in,get me physically out of bed,add under cups of water,put a card in there,use vanilla extract,melt my butter,blend it up again,get super creative with the shape of your pan it a layer of ice cream,stock up for my guests people,add a pinch of cinnamon,decide the size,add the cilantro,wake up a little bit,cut the lemons,use on my hair,put like a ton of greens on the bottom,show my morning routine,use two flat teaspoons of cacao powder,vacuum it,convince him,throw in the rest of your ingredients,use the teenie tumbler,put some paper towel on top of it,,reread a book,add of a teaspoon of bake soda,squeegee off,wash that out,put everything away,fit the toothbrushes,turn off the ends of our toothpick,add good protein,do as much mascara,wash it,add maca powder to my oats,,switch around,clean up breakfast dishes from the sink,melt once they,whisk everything together,clean my skin,,add a few drops of essential oil into it,start with my spring morning routine,use a plastic scraper,mix a cup of glue,try some of these out
