press garlic,use this for the bottom of their feet when it like a whip body cream,,pack your kid lunch,,add some cinnamon,use about a cup,sprinkle that in,take them in my hand,,,write things down,,move on some more beverages,add tbsp of xylitol,screw on the cap,chop green bell pepper red onion cucumbers,pack for dance,massage kale,mop if,,peel off the back,do,,,clean gel,check my emails,,end up,blend this all out,give it that little pop of extra flavor,enjoy brushing their teeth in the shower,,put on top,,,drill the posts into the new pieces of wood with our new measurements,,go from the crease,,,take it over the top,boil my water,,,,add the coconut milk yogurt,add all your veggies to a massage scale,chop up,take place in the back of a cab,plug in,stick in the microwave ten to thirty seconds,dab it down a little bit,use the steam mop every day,wipe down my kitchen benches,,,,find that a cup of green tea,,,,blend that all out,defrost a little then to a blender,start by,make some tea,bake powder,keep it simple okay,,put the dishwasher on,put the jingle bell on your tree,,,add olive oil over medium heat,help routine habit,make them,,do this scrub,,mop this thing,,put my hair in two braids,,touch the salmon,,do my skincare routine,polish your stainless steel amazingly,snap a pic of this list,pull it nice,wipe this down at multiple times a week,,add my water today,pair it with some really simple ezekiel toast with half an avocado,,top it with some coffee,,,wash my face,tidy my apartment,give it a taste test,add in your banana deliciousness mixture,use this,wash my face with it,,bake until,,use these with a laundry booster,moisturize my body every night,grate white onion egg cloves of garlic,start with one medjool date,spread it on,dry naturally,do a face mask,get it nice,,,scrunch up some tinfoil,,,,make it,fit to the chalkboard,add in some epsom salts,listen to him,head over to the bathroom,remove the leaf from the really fibrous stem,,top my oatmeal with some fruit,,measure our two tablespoons of sunflower seeds,,open up all of my living spaces,add one banana to my blender,,slices into the almond butter,use a blender,chop up some olives some cashews,,put them on the skillet,call red bush tea,cook the peel actually easily today for lunch,,talk about this a lot more detail,add some hummus,put some oil on it,,,,,,use them,,see there,,top it with some avocado slices,,got some zucchini a small red onion,,,help the room,,add about one teaspoon of vanilla extract,melt into like a nice cherry sauce,blush there,,make the cal drake concentrate cleaner,,,,
use organic black beans,place my oils or my shea butter together,,put them in your kids lunches,,sweetened almond milk,use this new protein powder,shred apple along with the unsweetened almond milk,crush them up,,,,,got this hazelnut kind,bring that all to a boil,screw the piping into the floor flange,add some eggs for add protein to this dish,pack some strawberries,rinse it,mop the bathroom,,cut our paper to size,cool for a time,,,fill my face full of chemicals,finish my toast,,do this,do a little bit of bronzing,make the overnight oats extra creamy,waste water,,top it with a drizzle of honey,,,dig some holes,,curl my lashes,,,have coconut water banana frozen blueberries,use a creamer,,,,cement cinnamon,make this butternut squash kale salad with the maple tahini,use extra virgin olive oil a little bit,call cash cab,vacuum the couch yes the couch or the floor,keep your eyes very closely on anything like this,take my drill,make sure that sweep,put away,,,,caramelize slightly,,,,start with the color camel all over my lid from the lorac mega pro palette,measure out half a cup of frozen blueberries,use turkey or substitute turkey,cut up an apple,layer in the jar,go in with this mac brush,,clean my kitchen,put all the jingle bells in there,,,cover it,make in a better mood for the day,,,apply your cleanser to the brush with some water,,use it everywhere in my house,,curl,,add some fresh slices of lemon,,mix it together,go into my living room,keep a pantry tally list on the inside door of my pantry tag,remove the cardboard frame,feed my toilet,,pour my almond milk back into my blender homemade almond milk,,,put that in there,,,go back to the couch,,,add some slice bananas one cap full of vanilla extract a dash of cinnamon,got this duster from grove collaborative,give in my face,,prep your arugula salad,,refresh your carpet,use a melatonin spray,put these into a pan,add of a cup of oats to a large mason jar,do one half,flatiron,put that on with a brush,vacuum,,,turn it into an education,,,,blend my classic strawberry banana smoothie,use a little bit of gorilla glue to temporarily glue the pieces onto the chalkboard,,use the coconut body lotion in combination with a lavender oil,do some exfoliation of my body,prep the greens,,add some nut fat on top,,add good protein fiber,,,use almond butter or cashew nut butter,,take some almond butter,add one tablespoon of macadamia nut butter,put cashews on top,,make some patties,get toothpaste all around my mouth,add some fruit to my salads,,hop in the shower,create these containers,put in the oven,,,,,,wipe down our bathroom,,shelve there,,whip up in a few minutes,,add about a teaspoon,,,vacuum really way too fast move your vacuum,,add a little bit of pumpkin pie spice,eat it up,apply the cc cream,,smell it,,,,
use lime zest the juice of one lime,add a few popular ingredients,,dedicate to lunch fights,,mix that together,grind me up,take my pot over to the counter,add a little bit more cinnamon,,,,,got these,use almond milk,drill into the wall,drizzle some italian,fill my water bottle with around of ice,fill it up with lots of sprouts,vacuum the boys room,,wrap it around,add my onions beans enchilada sauce,,,use the mineral spring water mist,make it a cute little outfit,,looks like,finish with this revlon chubby stick,use smooth,get on with my admin work,,got a nice handful of strawberries,,,fill the garden,,put it on,,,make myself a quick smoothie,put it in my french press,,,,use raw oats,,mix it all up,use something,,pull out a few stress relief products,stain on there,mop in my master bathroom,get rid of all the dirt,,,,make one of my favourite easy meals,,,,go into the outer crease in the outer corner with sepia,blend that up,add a teaspoon of vanilla extract,take every single night before,make for yourself as a special treat,brush up really gently,,wipe down,write all of your bucket list items on to your jingle bells,,,cook after a couple minutes,use a cleanser,,,clean it,,,,put my hair in the braids,,wrap this all up like a little present,,prep this last night,watch my cleaning videos,get yourself some disposable pans,attach to a keychain in an unexpected perk,use the method toilet bowl cleaner,,store my milk in these little jars,,,drink my coffee in the car on the way,,,head to bed,,,stir it all together,pass into the wash machine,take my neutrogena natur fresh facial cleanser,,drizzl on that salad,,throw into the wash in place of regular laundry detergent,hit the thumbs up,line with your favorite marinara sauce,add your dates in there,add the other half of the avocado,,head out the door,tidy it up,,,huevos blingle,,,,use another good cooking oil,remove the clamps,,clean my body with my exfoliate gloves,penetrate more deeply into the skin,add one more tablespoon of tahini,,top my oats with one tablespoon,,got half a cup of fresh cherries half a cup of blueberries,,,add a pinch of cinnamon,,add some raw pumpkin seeds for a little bit of crunch,mix the coconut flour in,get packaging,,comment down below,go outside for a second,add healthy protein,,jump into my skincare routine,make a comeback,do a roast chicken breast,,,,,,mirror,,shelve,,slice up one,,whisk together some,,,open the windows,,mix that together,heat up,do kind of conceals,,wipe it down,,,,
assemble your salad,add that after once the oil,,save on dishes,,make my basic chia pudding recipe,take some of these on bob red mill,add some nice raw fruit to your breakfast,put the oatmeal into my bowl,,,,,got some of these seaweed snacks with sea salt,use regular eggs or egg whites,do measure,slice green pepper,do a really really really quick stretch,use some tomato cucumber red radish,add essential oils onto the top of it,,trim it,found on pinterest,,,do my makeup,finish my coffee,,get the top all brown,go over the front,go really nicely with peanut butter,use it on my face,,,,,move that with a wheelbarrow,,put it all over my face,,,add some cayenne pepper garlic powder,set a timer for four minutes,,,,use the blueberry flax by nature path,,drizzle with some olive oil,wash my face,,make a lentil kale soup,got the wood,dust with a little duster in the bathroom,do a quick clean over,,,,go to fry that in a pan over medium to high heat for a few minutes,,,,fill my brows,check out the full recipe on my blog,chop up cherries,make a snack for myself,combine the rolled oats flax seed meal,get them even,,fit in the dishwasher,decor your tree,,,add chili powder cumin lemon pepper,wash my face,,,exfoliate,,,,put it in two braids,,unwrap it,,add teaspoons of raw cacao powder,try it,,play with our pom poms as always,use our dyson vacuums,,,,,top it with some extra cinnamon,,,fall asleep,,,use banana,do any time,use this mundu toner,,take them out,,use lemon or orange,do a diy planner,add half,add about a teaspoon,take my ezekiel toasts,,check social media,vacuum,,,create different sounds,,,,add to teaspoon of macadamia nut oil to my frying pan,screw into the top back of the board,,my hair,use this serum here,add them to a ziploc bag with a paper towel at the bottom,,sit down,,sprinkle on top of salad,,,add one tablespoon of natural unsweetened peanut butter,,sprinkle on some cinnamon,add some coconut flour,add some thyme,,,brush my teeth,do this,,eat my dinner,add them into recipes like this one,eat food,,,,,,tidy up a little bit,,stay pretty steady,,cut into thin strips,,do this,,,spend all day cleaning,,melt,take no more than three to five minutes to kind of heat up,cover up,,weight them down,,,,
make your own,place on top of a pan,,packs,,soak in the fridge overnight or for a few hours,put about a tablespoon,stir,take my chia seeds,,,,,got this little packet of almond butter,assemble your burrito,find a stud,make this sandwich,put on my moccasins,throw it in a bowl,start in the playroom,,,go like a file system into your deep freezer,,,highlight and a sort of purple or pink or tones lips,pick my outfit for the day,,,make it smoother,add a pinch of cinnamon,sit down at my computer,,,,,prep the soil,,use this tiny little brush,,,use a premade,press it,,,,pop that right into our saucepan,,take the shaker top hop,hydrate the eyes,,reach for products,put something there,use the steam,clean with on the glass,,,,add one cup of baby tomatoes,,,,take some eyeliner,wash my face in the shower,pour cups of greek yogurt into a bowl,drink my tea,put some of the flour mixture,use the loreal volume,,wash those up,write out,,,make these delicious,give your skin that healthy glowy look,,,give me like spa treatment facial vibe a mini spa treatment at home,,,,take my hair out of the braids,,add your seasoning like simple salt,,make healthy chocolate overnight oats teaspoon of pure maple syrup optional,try this vacuum,,,clean the toilet,,,,,tastes delicious,,,make yourself a cup of tea,,,slice up your banana,ride us throughout the week,explain,,pop it into the oven on the lower shelf,,share a few natural laundry alternatives start with soap nuts in a muslin bag,,,sprinkle on some cinnamon then an extra little dash of almond milk,load up the avocado,,turn on my lights,tidy up the main living space,,,play with our rain stick,,,,add one cup of baby tomatoes,screw those in,,create that kind of zen space,hop into the shower,add a little bit of salt,,add tsp of olive oil,,sprinkle of black pepper,,,use peanut butter with the smoothie,,put a lid on top,mix that all up,put it in our toaster oven on the darker setting,,,make it,add the rest of the ingredients,,head upstairs,have tons of healthy minerals,come to bed,,,,,,go up to the playroom,,get some,,add a little,,take them over to the saute pan,,,tackl three rooms of our house,,whip it with a kitchenaid,use spatula here to kind of mix them up,use something to kind of even out my skin tone the little tiny bit of melasma,,paint the seats of them gray,,,,
chop here,use shea butter coconut oil,,pack the lunches,,top it with the other half of the banana,absorb when,crush them up in my hands,sprinkle that on,,,,,got these roasted seaweed snacks,heat them up,mark it,add some cranberry chutney,,put some lemon juice some olive oil a little bit of salt,mop it,,,add things like cilantro,,,put makeup as part of your morning routine,keep my teeth really clean,,,use a clear mascara gel,give it another quick,do all of my emails,,,,,mesh down,,apply it,,,cut them in half,take two tablespoons of that,,,,do this with one hand,,use my palm,finish with alpha lipoic acid cream,,make something hearty,fit on this bath tub,try to dust once a week,give the kitchen a little bit of a clean over,,,,use a tiny little pinch of cayenne pepper or chili if like spicy food,,,,do a little bit of a wing,pick out an outfit for the day,roll them up,eat my snack,put some chocolate chips,find a different eye line,,give it a sweep,complete that task,,,cook for about five to eight minutes,get ready in the morning,,,use it,,,,do anything to my hair,,give it up a lemon cashews brown rice fettuccine,,use the cinnamon,get my dyson,,,vacuum our room,,,,,make dinner,,,go to bed,,,wrap that all up,look like new,do anything with my makeup,,use a like a tongs or something like it,,decrease the dry time,,,add some pomegranate,add on your two poached eggs onto your avocado,,moisturize with the desert essence,get everything vacuum,,,wrap paper paint or decorative tape,,,,show today,turn the chalkboard over,,put some hyaluronic acid serum on my face,rinse off,keep a lot longer in the fridge,,break down the phytates in the kale,,saute some kale in a pan,,,make my smoothie recipes,,,measure it out properly,make in heaven then we everything for the salad,,,do it,massage the kale,,go to bed,sprinkle the pumpkin seeds on top,go straight into bed,,,,,,move into my office,,give it an even more secure finished product,,fill one slice,,steam some potatoes,,,get it clean,,use vanilla bean like always,put them on a plate,put a little bit,,use the glass,,,,
mix all of that in to some olive oil,make a bomb or a lotion,,store everything in a large plastic storage bin,,use half a banana at breakfast,pop them right into my mason jar,sprinkle a little bit more of cinnamon,sprinkle that on okay,,,,,take magnesium,cook your eggs,make sure,use some edamame hummus,,transfer it to a bowl,clean with your steam,,,frozen,,,gone with this top,pick out this white shirt with this cute coral floral print,,,doe work,add teaspoon of pure maple syrup,use a real techniques,,,,,,,go back into this eyeshadow palette,,,put on top of the salmon,use to a super dark chocolate,,,,put two thirds of a cup of water,,got some short grain brown rice in a pan with some vegetable stock,floss,,reduce redness or puffiness,drill a hook in the back,use the anti back tile it cleaner,,,,,use baby tomatoes,,,,use cream as a highlight,get this full healthy chocolate blueberry pancake grace,sweeten it up a little bit,put my hair in a braid,add some peanut butter,give me a little highlight there on my nose,,clear the kitchen out,flip them over your tree,,,add portobello mushrooms,improve the condition of your skin,,,clean my skin,,,,,,prepare my pasta,,make a whole batch at the start of the week,vacuum up,,,do a quick vacuum through there,,,,,got my lunch together,,,play on my phone,,,add some crunch,take the duster part off,make a mistake with my mascara,,transfer to a parchment,,use glass,,,put it in your bowl,enhance the flavors,,check off the day in my planner,,,,entertain younger children,,,,crack two eggs into a bowl,use the clamps,,head to bed,apply to the eyes,mix that up,,rub the olive oil into the kale,,add that to a bowl,,,contain lots of good nutrients,,,do two tablespoons of that,make sure,,,make my bed,add about one cup of cook beetroot pieces,,go to bed,make it,come to bed,,,,,,put those toys away,,keep it pretty simple,,cut one slice in half,,make like a cheesy queso enchilada sauce,,,,,pour that into there,give it a big thumbs,put a concealer under my eyes,,wipe them down with a wet rag with water,,,,
add chicken on top for some additional protein,use it on your dog,,cut boards,,use at breakfast,sprinkle that over top of your frozen fruit,chop them up,,,,,,,add half a cup of oats scoop of vanilla protein powder,use anchors,,,make it,make it smell,,,go into four different ziploc bags,,,dress up,watch,,,straighten it,add a little bit of unsweetened almond milk or a little drop of water to the oats,try it out,,,,,,,blur brush,,,put my salmon on the tray spray both of those down with a little bit of olive oil,,,,,stir mix everything up,,use kosher salt,hop into bed,,reduce any redness or puffiness,hang it in my closet,work really great,,,,,add a small pinch of paprika or a little pop of extra flavor,,,,soften up all the edges,head straight into the shower,add stevia to this then about cup of your favorite nuts,,give these as a gift,see it in the camera,,,flip this one over,,,start by,look different,,,apply my moisturizer,,,,,,make it even creamier,,mix half a cup of whole rolled oats with two teaspoons of chia seeds,mop now,,,mop our tile floors with my steam,,,,,top it on top of some arugula with a little spoonful of avocado,,,,,,give sustained energy throughout the day,wipe it down,do anything special with my hair,,use my hands,,put a little bit of hydrogen peroxide into a container,,,stir it up,add some crack pepper on the avocados,,moisturize with the desert essence moisturizer,,,,use a paper towel holder,,,,pull the eggs into the pan,measure the length of the wall,,,finish my skincare off with alpha lipoic acid,add a third of a cup of apple cider vinegar,,add some healthy fats to my salad,,chop up a big handful of kale about one cup,,,,,,spin the batter into the waffle maker,add some,,,read for that day,break down the phytates in the kale,,apply to my face,look a little bit pretty,brush my teeth,,,,,,move into the boys room,,create that,,go perfectly with the cookie,,add a big scoop of salsa to the cheesy sauce,,,,,choose whichever molds,top my banana pancakes with my homemade berry syrup,blush every single day,,pick up a few of those things,,,,
go in with my brie cheese,trace the bottom part of the bowl,,freeze really well,,use a few fresh raspberries,pop that right into our little mason jar,take some extra maple syrup,,,,,,,take out your blender,use an anchor,,,top it off with a little bit of hemp arts for some extra add protein,,,,leave it a thumb up,,,make myself breakfast,see my weekday morning routine for work,,,deal with my flyaways,top my peanut butter over nut oats with another teaspoon,use this around my eye area,,,,,,,blend it,,,make them,,,,,chop up banana,,use my hands dirty spread,fall asleep,,add some onions,go for really like this dark wood feel,clean those up,,,,,balance the flavor,,,,do this particular makeup look,apply some moisturizer,sprinkle of honey,,make a lactation support smoothie,use a brush,,,decor beautifully,,,add some,get ready in the morning,,,hydrate mist,,,,,,start with about two cups of cashews,,serve it in a bowl,take the garbage out,,,move back into the bathroom,,,,,add some pizza ingredients,,,,,,have grams of sugar,take a dry cloth as well,melt off my face,,do as always,,use essential oils,,,add a half a teaspoon of spirulina powder,double up on that,,put that on like the lower parts of my cheeks,,,,make them,,,,whip them up with a fork,determine how far apart the holes,,,put some wedge by mac in the crease of my eyes,chop up an apple,,chop up one carrot,,put the full recipes with a calorie breakdown for everything,,,,,,do this as quickly as possible,use all,,,read the secret daily teachings books,toss now,,lay down,add all the veggies,check out my last video down the bottom,,,,,,get them these matching sheet sets,,finish up,,refresh,,put the sauce on,,,,,add it to molds,top with your homemade free berry jam,use the it cosmetics,,move on to our living room,,,,
do seasoned it up with a little bit of pepper,get a little spa treatment,,make ahead surprisingly peanut butter,,leave out the bananas,take one full scoop,,,,,,,,tablespoon of xylitol or sweetener of your choice egg whites strawberries fresh or frozen cup of greek yogurt,make sure,,,make it more palatable,,,,bye person,,,do both,show guys my outfit quickly the whole thing together,,,,add a few strawberry slices on top,move on to my makeup routine,,,,,,,use this elf foundation,,,prepare,,,,,mix with the almond milk,,cook risotto,grab my kindle,,chop kale in,measure it,clean the toilets,,,,,add half a teaspoon of pure maple syrup,,,,make some fresh green juice,relax after a busy week or something,scoop them in to your mold a mini muffin pan,,add a little bit of brewers yeast,apply mascara,,,,,,add in my onions,do something for yourself each morning or something for yourself each day,,,use some sunscreen,,,,,,make pasta unless,,mix it together,tackle a few chores on your list,,,,,,,,pick up a huge sweet potato from the store on my way home,,,,,,follow that with my fruit,pick up the books,move on to my hair,,watch,,soak for about to minutes,,,score the flesh of the avocado,add a little bit of black pepper,,go to bed,,,,play with we,,,,add another half to teaspoon of macadamia nut oil to my pan,create two pilot holes,,,put on some concealer,make it even,,add the teaspoon of olive oil,,eat today over on the blog,,,,,,get it all in,got our greens,,,scroll through social media for ages,eat my meals,,turn off the lights,make a chickpea salad sandwich,,,,,,,put some new sheets on their bed,,painting that with chalkboard paint,,toss that around in a frying pan on the stove for a few minutes,,pull it out,,,,,stay really solid,sign up for my newsletter,go palette by makeup forever,,throw pillows on the couch,,,,
give it a little bit of crispness,follow the line,,keep in your kitchen,,make a healthy chickpea brown rice,pop the lid on,,,,,,,,do greek yogurt,do it on the other side,,,eat it all the time,,,,see guys,,,do my hair as well,give it that extra little something,,,,add the oats to a bowl,make my bed,,,,,,,do on the eyes,,,add some red wine vinegar,,,,,make it a little bit creamier,,got my oven on convection,do some reading,,stick it in a crock pot,take a cloth,clean once,,,,,add cup of sliced button mushrooms,,,,chuck it in the juicer,brush my teeth,pop these in the freezer,,put the instructions,blush basin,,,,,,start with my veggie mix,get ready in the morning,,,applied moisturizer,,,,,,add only two cloves,,got fresh strawberry slices,,,,,,,,,got some of this tomato basil kinda like a marinara sauce,,,,,,use two teaspoons,use my dyson,brush it,,serve myself a lot of it,,put our toothbrushes inside,,,mash it up,,,plug in my phone,,,,,,,,make this omelet for an easy lunch or dinner,hammer in anchors for add support,,,see it,take the edge off,,add any more oil of salt,,,,,,,,turn the waffle maker on lightly grease,dress always,,,chang into my workout clothes really quickly,add any more,,read a book,chop up all the ingredients,,,,,,,move into the playroom,,hang those,,take a few minutes,,,,,,,do over the double boiler,see in my next video,use a little bit of mascara,,clean up the toy room,,,,
add chicken,trace as best as possible,,make your life a lot easier,,use another good cooking oil,make some blueberry quick oats packet of your favorite instant oatmeal,,,,,,,,go like a little burrito,hang two shelves,,,drizzle a little bit of olive oil on there some salt,,,,do it all on a budget,,,eat healthier,matches my shoes,,,,add a pinch of ground vanilla powder,hairbrush it,,,,,,,do on my other eye,,,chop up almonds,,,,,put that all into the mason jar,,use a short grain rice when,read a book,,add some rosemary from the garden,stain it dark depend on your style,clean the toilet,,,,,toss now,,,,make breakfast my favorite breakfast,brush it out,stir it all up to then,,increase your milk supply,apply some of this bare minerals,,,,,,fold it all up,do something for yourself,,,apply your sunscreen,,,,,,blend everything up,,top my oats with one tablespoon of unsweetened almond butter as well as some berries,,,,,,,,,mix that all together,,,,,,put three teabags to ounces of water,get a lot of questions about our wood flooring,wipe some of it off,,serve yourself,,add my essential oils,,,use this,,,,,,,,,,,spread out over half of the omelette,measure how far apart the brackets,,,add some mascara,dress,,add the rest of the ingredients,,,,,,,,close it,dress exactly,,,fix those cushions,sit down for a few minutes,,,add in your fresh herbs,,,,,,,clean off,,put the wall hooks into the wall,,add tsp of macadamia nut oil to a pan,,,,,,,suit your needs,click on it,use the elizabeth arden hour cream on my lips,,take all their toys upstairs,,,,
